### ISSUE TITLE
Mesh doesn't load balance between nodes (Wireguard setup)

### ISSUE THREAD

**Issue by angristan** [moby/moby#37985]
**Description**

I am running a swarm cluster with 3 workers that also are managers.

I am running them on Hetzner Cloud, and since they don't have private networking, I use Wireguard to create a VPN between the servers.

I had no issues before running the same steps on Digital Ocean, without wireguard and with "real" private networking, so I assume the issues come from my current setup, but I can't understand why.

All the nodes are running Debian 9.

```sh
root@erina ~# ip a show wg0
3: wg0: <POINTOPOINT,NOARP,UP,LOWER_UP> mtu 1420 qdisc noqueue state UNKNOWN group default qlen 1
    link/none
    inet 10.0.42.5/32 scope global wg0
       valid_lft forever preferred_lft forever
```

```sh
root@honoka ~# ip a show wg0
3: wg0: <POINTOPOINT,NOARP,UP,LOWER_UP> mtu 1420 qdisc noqueue state UNKNOWN group default qlen 1
    link/none
    inet 10.0.42.6/32 scope global wg0
       valid_lft forever preferred_lft forever
```

```sh
root@utaha ~# ip a show wg0
3: wg0: <POINTOPOINT,NOARP,UP,LOWER_UP> mtu 1420 qdisc noqueue state UNKNOWN group default qlen 1
    link/none
    inet 10.0.42.7/32 scope global wg0
       valid_lft forever preferred_lft forever
```

Of course, they can reach other, and the 3 required ports for Swarm are not closed. I'm even running a GlusterFS cluster without issue.

I have seen quite a number of issues in this repo regarding this exact problem, but since my setup is different I have opened another one.

**Steps to reproduce the issue:**
1. Setup Docker and Wireguard
2. On `erina`: `docker swarm init --advertise-addr 10.0.42.5`
3. On the 2 others: `docker swarm join --token xxxx 10.0.42.5:237`
4. `docker service create -p 80:80 --name web nginx:latest`

**Describe the results you received:**

The nginx container is only accessible via the node it's running on.

```sh
root@erina ~# docker service ps web
ID                  NAME                IMAGE               NODE                DESIRED STATE       CURRENT STATE            ERROR               PORTS
w6s5wvr3uyxo        web.1               nginx:latest        utaha               Running             Running 10 minutes ago
```

Here, I will be able to access Nginx on `utaha`'s localhost, pirvate IP and public IP, but not via the other nodes.

**Describe the results you expected:**

Thanks to Swarm's mesh network, I should be able to access any service from any node.
Since they can reach each other and there is not closed ports, I wonder what's wrong? Maybe something with the overlay network?

**Output of `docker version`:**

```
Client:
 Version:           18.06.1-ce
 API version:       1.38
 Go version:        go1.10.3
 Git commit:        e68fc7a
 Built:             Tue Aug 21 17:23:18 2018
 OS/Arch:           linux/amd64
 Experimental:      false

Server:
 Engine:
  Version:          18.06.1-ce
  API version:      1.38 (minimum version 1.12)
  Go version:       go1.10.3
  Git commit:       e68fc7a
  Built:            Tue Aug 21 17:22:21 2018
  OS/Arch:          linux/amd64
  Experimental:     false
```

**Output of `docker info`:**

```
root@erina ~# docker info
Containers: 0
 Running: 0
 Paused: 0
 Stopped: 0
Images: 1
Server Version: 18.06.1-ce
Storage Driver: overlay2
 Backing Filesystem: extfs
 Supports d_type: true
 Native Overlay Diff: true
Logging Driver: json-file
Cgroup Driver: cgroupfs
Plugins:
 Volume: local
 Network: bridge host macvlan null overlay
 Log: awslogs fluentd gcplogs gelf journald json-file logentries splunk syslog
Swarm: active
 NodeID: 5vlol9p0ulu73d79dq6ie08w7
 Is Manager: true
 ClusterID: yva12o7oaiq6tws478wrlm2bx
 Managers: 3
 Nodes: 3
 Orchestration:
  Task History Retention Limit: 5
 Raft:
  Snapshot Interval: 10000
  Number of Old Snapshots to Retain: 0
  Heartbeat Tick: 1
  Election Tick: 10
 Dispatcher:
  Heartbeat Period: 5 seconds
 CA Configuration:
  Expiry Duration: 3 months
  Force Rotate: 0
 Autolock Managers: false
 Root Rotation In Progress: false
 Node Address: 10.0.42.5
 Manager Addresses:
  10.0.42.5:2377
  10.0.42.6:2377
  10.0.42.7:2377
Runtimes: runc
Default Runtime: runc
Init Binary: docker-init
containerd version: 468a545b9edcd5932818eb9de8e72413e616e86e
runc version: 69663f0bd4b60df09991c08812a60108003fa340
init version: fec3683
Security Options:
 seccomp
  Profile: default
Kernel Version: 4.9.0-8-amd64
Operating System: Debian GNU/Linux 9 (stretch)
OSType: linux
Architecture: x86_64
CPUs: 2
Total Memory: 3.769GiB
Name: erina
ID: SMEQ:ZNHW:JQKH:D3ZA:YACF:FWT5:GUYS:3DVB:7NSQ:DQVL:PYTI:AQAR
Docker Root Dir: /var/lib/docker
Debug Mode (client): false
Debug Mode (server): false
Registry: https://index.docker.io/v1/
Labels:
Experimental: false
Insecure Registries:
 127.0.0.0/8
Live Restore Enabled: false

WARNING: No swap limit support
```

```
root@honoka ~# docker info
Containers: 0
 Running: 0
 Paused: 0
 Stopped: 0
Images: 1
Server Version: 18.06.1-ce
Storage Driver: overlay2
 Backing Filesystem: extfs
 Supports d_type: true
 Native Overlay Diff: true
Logging Driver: json-file
Cgroup Driver: cgroupfs
Plugins:
 Volume: local
 Network: bridge host macvlan null overlay
 Log: awslogs fluentd gcplogs gelf journald json-file logentries splunk syslog
Swarm: active
 NodeID: purz0nyznvqmuk9pyng2s4crw
 Is Manager: true
 ClusterID: yva12o7oaiq6tws478wrlm2bx
 Managers: 3
 Nodes: 3
 Orchestration:
  Task History Retention Limit: 5
 Raft:
  Snapshot Interval: 10000
  Number of Old Snapshots to Retain: 0
  Heartbeat Tick: 1
  Election Tick: 10
 Dispatcher:
  Heartbeat Period: 5 seconds
 CA Configuration:
  Expiry Duration: 3 months
  Force Rotate: 0
 Autolock Managers: false
 Root Rotation In Progress: false
 Node Address: 10.0.42.6
 Manager Addresses:
  10.0.42.5:2377
  10.0.42.6:2377
  10.0.42.7:2377
Runtimes: runc
Default Runtime: runc
Init Binary: docker-init
containerd version: 468a545b9edcd5932818eb9de8e72413e616e86e
runc version: 69663f0bd4b60df09991c08812a60108003fa340
init version: fec3683
Security Options:
 seccomp
  Profile: default
Kernel Version: 4.9.0-8-amd64
Operating System: Debian GNU/Linux 9 (stretch)
OSType: linux
Architecture: x86_64
CPUs: 2
Total Memory: 3.769GiB
Name: honoka
ID: L4TQ:BHFL:4TVF:5UCU:BYF4:F6GR:6XOV:HWWC:BNMJ:H6DX:6G36:3SIU
Docker Root Dir: /var/lib/docker
Debug Mode (client): false
Debug Mode (server): false
Registry: https://index.docker.io/v1/
Labels:
Experimental: false
Insecure Registries:
 127.0.0.0/8
Live Restore Enabled: false

WARNING: No swap limit support
```

```
root@utaha ~# docker info
Containers: 1
 Running: 1
 Paused: 0
 Stopped: 0
Images: 1
Server Version: 18.06.1-ce
Storage Driver: overlay2
 Backing Filesystem: extfs
 Supports d_type: true
 Native Overlay Diff: true
Logging Driver: json-file
Cgroup Driver: cgroupfs
Plugins:
 Volume: local
 Network: bridge host macvlan null overlay
 Log: awslogs fluentd gcplogs gelf journald json-file logentries splunk syslog
Swarm: active
 NodeID: mmxnqjixdse5ilap5rajq56rn
 Is Manager: true
 ClusterID: yva12o7oaiq6tws478wrlm2bx
 Managers: 3
 Nodes: 3
 Orchestration:
  Task History Retention Limit: 5
 Raft:
  Snapshot Interval: 10000
  Number of Old Snapshots to Retain: 0
  Heartbeat Tick: 1
  Election Tick: 10
 Dispatcher:
  Heartbeat Period: 5 seconds
 CA Configuration:
  Expiry Duration: 3 months
  Force Rotate: 0
 Autolock Managers: false
 Root Rotation In Progress: false
 Node Address: 10.0.42.7
 Manager Addresses:
  10.0.42.5:2377
  10.0.42.6:2377
  10.0.42.7:2377
Runtimes: runc
Default Runtime: runc
Init Binary: docker-init
containerd version: 468a545b9edcd5932818eb9de8e72413e616e86e
runc version: 69663f0bd4b60df09991c08812a60108003fa340
init version: fec3683
Security Options:
 seccomp
  Profile: default
Kernel Version: 4.9.0-8-amd64
Operating System: Debian GNU/Linux 9 (stretch)
OSType: linux
Architecture: x86_64
CPUs: 2
Total Memory: 3.769GiB
Name: utaha
ID: LOXM:5A2Q:TXEG:L52Z:CJT6:OYVY:ZBGS:RZLW:EP65:H5GA:FLDQ:7R6A
Docker Root Dir: /var/lib/docker
Debug Mode (client): false
Debug Mode (server): false
Registry: https://index.docker.io/v1/
Labels:
Experimental: false
Insecure Registries:
 127.0.0.0/8
Live Restore Enabled: false

WARNING: No swap limit support
```

**Additional environment details (AWS, VirtualBox, physical, etc.):**

Here are some logs:

```
Oct 06 23:08:36 erina systemd[1]: Starting Docker Application Container Engine...
Oct 06 23:08:36 erina dockerd[877]: time="2018-10-06T23:08:36.768946546+02:00" level=info msg="libcontainerd: started new docker-containerd process" pid=969
Oct 06 23:08:36 erina dockerd[877]: time="2018-10-06T23:08:36.769103268+02:00" level=info msg="parsed scheme: \"unix\"" module=grpc
Oct 06 23:08:36 erina dockerd[877]: time="2018-10-06T23:08:36.769114245+02:00" level=info msg="scheme \"unix\" not registered, fallback to default scheme" module=grpc
Oct 06 23:08:36 erina dockerd[877]: time="2018-10-06T23:08:36.769331073+02:00" level=info msg="ccResolverWrapper: sending new addresses to cc: [{unix:///var/run/docker/containerd/docker-containerd.sock 0  <nil>}]" module=grpc
Oct 06 23:08:36 erina dockerd[877]: time="2018-10-06T23:08:36.769363513+02:00" level=info msg="ClientConn switching balancer to \"pick_first\"" module=grpc
Oct 06 23:08:36 erina dockerd[877]: time="2018-10-06T23:08:36.769413803+02:00" level=info msg="pickfirstBalancer: HandleSubConnStateChange: 0xc42020ba80, CONNECTING" module=grpc
Oct 06 23:08:36 erina dockerd[877]: time="2018-10-06T23:08:36+02:00" level=info msg="starting containerd" revision=468a545b9edcd5932818eb9de8e72413e616e86e version=v1.1.2
Oct 06 23:08:36 erina dockerd[877]: time="2018-10-06T23:08:36+02:00" level=info msg="loading plugin "io.containerd.content.v1.content"..." type=io.containerd.content.v1
Oct 06 23:08:36 erina dockerd[877]: time="2018-10-06T23:08:36+02:00" level=info msg="loading plugin "io.containerd.snapshotter.v1.btrfs"..." type=io.containerd.snapshotter.v1
Oct 06 23:08:36 erina dockerd[877]: time="2018-10-06T23:08:36+02:00" level=warning msg="failed to load plugin io.containerd.snapshotter.v1.btrfs" error="path /var/lib/docker/containerd/daemon/io.containerd.snapshotter.v1.btrfs must be a b
Oct 06 23:08:36 erina dockerd[877]: time="2018-10-06T23:08:36+02:00" level=info msg="loading plugin "io.containerd.snapshotter.v1.aufs"..." type=io.containerd.snapshotter.v1
Oct 06 23:08:36 erina dockerd[877]: time="2018-10-06T23:08:36+02:00" level=info msg="loading plugin "io.containerd.snapshotter.v1.native"..." type=io.containerd.snapshotter.v1
Oct 06 23:08:36 erina dockerd[877]: time="2018-10-06T23:08:36+02:00" level=info msg="loading plugin "io.containerd.snapshotter.v1.overlayfs"..." type=io.containerd.snapshotter.v1
Oct 06 23:08:36 erina dockerd[877]: time="2018-10-06T23:08:36+02:00" level=info msg="loading plugin "io.containerd.snapshotter.v1.zfs"..." type=io.containerd.snapshotter.v1
Oct 06 23:08:36 erina dockerd[877]: time="2018-10-06T23:08:36+02:00" level=warning msg="failed to load plugin io.containerd.snapshotter.v1.zfs" error="path /var/lib/docker/containerd/daemon/io.containerd.snapshotter.v1.zfs must be a zfs f
Oct 06 23:08:36 erina dockerd[877]: time="2018-10-06T23:08:36+02:00" level=info msg="loading plugin "io.containerd.metadata.v1.bolt"..." type=io.containerd.metadata.v1
Oct 06 23:08:36 erina dockerd[877]: time="2018-10-06T23:08:36+02:00" level=warning msg="could not use snapshotter btrfs in metadata plugin" error="path /var/lib/docker/containerd/daemon/io.containerd.snapshotter.v1.btrfs must be a btrfs f
Oct 06 23:08:36 erina dockerd[877]: time="2018-10-06T23:08:36+02:00" level=warning msg="could not use snapshotter zfs in metadata plugin" error="path /var/lib/docker/containerd/daemon/io.containerd.snapshotter.v1.zfs must be a zfs filesys
Oct 06 23:08:36 erina dockerd[877]: time="2018-10-06T23:08:36+02:00" level=info msg="loading plugin "io.containerd.differ.v1.walking"..." type=io.containerd.differ.v1
Oct 06 23:08:36 erina dockerd[877]: time="2018-10-06T23:08:36+02:00" level=info msg="loading plugin "io.containerd.gc.v1.scheduler"..." type=io.containerd.gc.v1
Oct 06 23:08:36 erina dockerd[877]: time="2018-10-06T23:08:36+02:00" level=info msg="loading plugin "io.containerd.service.v1.containers-service"..." type=io.containerd.service.v1
Oct 06 23:08:36 erina dockerd[877]: time="2018-10-06T23:08:36+02:00" level=info msg="loading plugin "io.containerd.service.v1.content-service"..." type=io.containerd.service.v1
Oct 06 23:08:36 erina dockerd[877]: time="2018-10-06T23:08:36+02:00" level=info msg="loading plugin "io.containerd.service.v1.diff-service"..." type=io.containerd.service.v1
Oct 06 23:08:36 erina dockerd[877]: time="2018-10-06T23:08:36+02:00" level=info msg="loading plugin "io.containerd.service.v1.images-service"..." type=io.containerd.service.v1
Oct 06 23:08:36 erina dockerd[877]: time="2018-10-06T23:08:36+02:00" level=info msg="loading plugin "io.containerd.service.v1.leases-service"..." type=io.containerd.service.v1
Oct 06 23:08:36 erina dockerd[877]: time="2018-10-06T23:08:36+02:00" level=info msg="loading plugin "io.containerd.service.v1.namespaces-service"..." type=io.containerd.service.v1
Oct 06 23:08:36 erina dockerd[877]: time="2018-10-06T23:08:36+02:00" level=info msg="loading plugin "io.containerd.service.v1.snapshots-service"..." type=io.containerd.service.v1
Oct 06 23:08:36 erina dockerd[877]: time="2018-10-06T23:08:36+02:00" level=info msg="loading plugin "io.containerd.monitor.v1.cgroups"..." type=io.containerd.monitor.v1
Oct 06 23:08:36 erina dockerd[877]: time="2018-10-06T23:08:36+02:00" level=info msg="loading plugin "io.containerd.runtime.v1.linux"..." type=io.containerd.runtime.v1
Oct 06 23:08:36 erina dockerd[877]: time="2018-10-06T23:08:36+02:00" level=info msg="loading plugin "io.containerd.service.v1.tasks-service"..." type=io.containerd.service.v1
Oct 06 23:08:36 erina dockerd[877]: time="2018-10-06T23:08:36+02:00" level=info msg="loading plugin "io.containerd.grpc.v1.containers"..." type=io.containerd.grpc.v1
Oct 06 23:08:36 erina dockerd[877]: time="2018-10-06T23:08:36+02:00" level=info msg="loading plugin "io.containerd.grpc.v1.content"..." type=io.containerd.grpc.v1
Oct 06 23:08:36 erina dockerd[877]: time="2018-10-06T23:08:36+02:00" level=info msg="loading plugin "io.containerd.grpc.v1.diff"..." type=io.containerd.grpc.v1
Oct 06 23:08:36 erina dockerd[877]: time="2018-10-06T23:08:36+02:00" level=info msg="loading plugin "io.containerd.grpc.v1.events"..." type=io.containerd.grpc.v1
Oct 06 23:08:36 erina dockerd[877]: time="2018-10-06T23:08:36+02:00" level=info msg="loading plugin "io.containerd.grpc.v1.healthcheck"..." type=io.containerd.grpc.v1
Oct 06 23:08:36 erina dockerd[877]: time="2018-10-06T23:08:36+02:00" level=info msg="loading plugin "io.containerd.grpc.v1.images"..." type=io.containerd.grpc.v1
Oct 06 23:08:36 erina dockerd[877]: time="2018-10-06T23:08:36+02:00" level=info msg="loading plugin "io.containerd.grpc.v1.leases"..." type=io.containerd.grpc.v1
Oct 06 23:08:36 erina dockerd[877]: time="2018-10-06T23:08:36+02:00" level=info msg="loading plugin "io.containerd.grpc.v1.namespaces"..." type=io.containerd.grpc.v1
Oct 06 23:08:36 erina dockerd[877]: time="2018-10-06T23:08:36+02:00" level=info msg="loading plugin "io.containerd.grpc.v1.snapshots"..." type=io.containerd.grpc.v1
Oct 06 23:08:36 erina dockerd[877]: time="2018-10-06T23:08:36+02:00" level=info msg="loading plugin "io.containerd.grpc.v1.tasks"..." type=io.containerd.grpc.v1
Oct 06 23:08:36 erina dockerd[877]: time="2018-10-06T23:08:36+02:00" level=info msg="loading plugin "io.containerd.grpc.v1.version"..." type=io.containerd.grpc.v1
Oct 06 23:08:36 erina dockerd[877]: time="2018-10-06T23:08:36+02:00" level=info msg="loading plugin "io.containerd.grpc.v1.introspection"..." type=io.containerd.grpc.v1
Oct 06 23:08:36 erina dockerd[877]: time="2018-10-06T23:08:36+02:00" level=info msg=serving... address="/var/run/docker/containerd/docker-containerd-debug.sock"
Oct 06 23:08:36 erina dockerd[877]: time="2018-10-06T23:08:36+02:00" level=info msg=serving... address="/var/run/docker/containerd/docker-containerd.sock"
Oct 06 23:08:36 erina dockerd[877]: time="2018-10-06T23:08:36+02:00" level=info msg="containerd successfully booted in 0.022201s"
Oct 06 23:08:36 erina dockerd[877]: time="2018-10-06T23:08:36.902770000+02:00" level=info msg="pickfirstBalancer: HandleSubConnStateChange: 0xc42020ba80, READY" module=grpc
Oct 06 23:08:36 erina dockerd[877]: time="2018-10-06T23:08:36.912410004+02:00" level=info msg="parsed scheme: \"unix\"" module=grpc
Oct 06 23:08:36 erina dockerd[877]: time="2018-10-06T23:08:36.912443441+02:00" level=info msg="scheme \"unix\" not registered, fallback to default scheme" module=grpc
Oct 06 23:08:36 erina dockerd[877]: time="2018-10-06T23:08:36.912478778+02:00" level=info msg="ccResolverWrapper: sending new addresses to cc: [{unix:///var/run/docker/containerd/docker-containerd.sock 0  <nil>}]" module=grpc
Oct 06 23:08:36 erina dockerd[877]: time="2018-10-06T23:08:36.912490812+02:00" level=info msg="ClientConn switching balancer to \"pick_first\"" module=grpc
Oct 06 23:08:36 erina dockerd[877]: time="2018-10-06T23:08:36.912524030+02:00" level=info msg="pickfirstBalancer: HandleSubConnStateChange: 0xc4203481f0, CONNECTING" module=grpc
Oct 06 23:08:36 erina dockerd[877]: time="2018-10-06T23:08:36.912727681+02:00" level=info msg="pickfirstBalancer: HandleSubConnStateChange: 0xc4203481f0, READY" module=grpc
Oct 06 23:08:36 erina dockerd[877]: time="2018-10-06T23:08:36.915611444+02:00" level=info msg="[graphdriver] using prior storage driver: overlay2"
Oct 06 23:08:36 erina dockerd[877]: time="2018-10-06T23:08:36.922769065+02:00" level=info msg="Graph migration to content-addressability took 0.00 seconds"
Oct 06 23:08:36 erina dockerd[877]: time="2018-10-06T23:08:36.923277607+02:00" level=warning msg="Your kernel does not support swap memory limit"
Oct 06 23:08:36 erina dockerd[877]: time="2018-10-06T23:08:36.923648157+02:00" level=warning msg="Your kernel does not support cgroup rt period"
Oct 06 23:08:36 erina dockerd[877]: time="2018-10-06T23:08:36.923948367+02:00" level=warning msg="Your kernel does not support cgroup rt runtime"
Oct 06 23:08:36 erina dockerd[877]: time="2018-10-06T23:08:36.924632248+02:00" level=info msg="parsed scheme: \"unix\"" module=grpc
Oct 06 23:08:36 erina dockerd[877]: time="2018-10-06T23:08:36.924996002+02:00" level=info msg="scheme \"unix\" not registered, fallback to default scheme" module=grpc
Oct 06 23:08:36 erina dockerd[877]: time="2018-10-06T23:08:36.925309891+02:00" level=info msg="ccResolverWrapper: sending new addresses to cc: [{unix:///var/run/docker/containerd/docker-containerd.sock 0  <nil>}]" module=grpc
Oct 06 23:08:36 erina dockerd[877]: time="2018-10-06T23:08:36.925595559+02:00" level=info msg="ClientConn switching balancer to \"pick_first\"" module=grpc
Oct 06 23:08:36 erina dockerd[877]: time="2018-10-06T23:08:36.925900079+02:00" level=info msg="pickfirstBalancer: HandleSubConnStateChange: 0xc420348e90, CONNECTING" module=grpc
Oct 06 23:08:36 erina dockerd[877]: time="2018-10-06T23:08:36.926492085+02:00" level=info msg="pickfirstBalancer: HandleSubConnStateChange: 0xc420348e90, READY" module=grpc
Oct 06 23:08:36 erina dockerd[877]: time="2018-10-06T23:08:36.926922934+02:00" level=info msg="Loading containers: start."
Oct 06 23:08:37 erina dockerd[877]: time="2018-10-06T23:08:37.166515706+02:00" level=info msg="Default bridge (docker0) is assigned with an IP address 172.17.0.0/16. Daemon option --bip can be used to set a preferred IP address"
Oct 06 23:08:37 erina dockerd[877]: time="2018-10-06T23:08:37.200500071+02:00" level=info msg="Loading containers: done."
Oct 06 23:08:37 erina dockerd[877]: time="2018-10-06T23:08:37.246219920+02:00" level=info msg="Docker daemon" commit=e68fc7a graphdriver(s)=overlay2 version=18.06.1-ce
Oct 06 23:08:37 erina dockerd[877]: time="2018-10-06T23:08:37.246589871+02:00" level=info msg="Daemon has completed initialization"
Oct 06 23:08:37 erina dockerd[877]: time="2018-10-06T23:08:37.277017891+02:00" level=info msg="API listen on /var/run/docker.sock"
Oct 06 23:08:37 erina systemd[1]: Started Docker Application Container Engine.
Oct 06 23:14:15 erina dockerd[877]: time="2018-10-06T23:14:15.801132469+02:00" level=info msg="parsed scheme: \"\"" module=grpc
Oct 06 23:14:15 erina dockerd[877]: time="2018-10-06T23:14:15.801217056+02:00" level=info msg="scheme \"\" not registered, fallback to default scheme" module=grpc
Oct 06 23:14:15 erina dockerd[877]: time="2018-10-06T23:14:15.801336474+02:00" level=info msg="ccResolverWrapper: sending new addresses to cc: [{/var/run/docker/swarm/control.sock 0  <nil>}]" module=grpc
Oct 06 23:14:15 erina dockerd[877]: time="2018-10-06T23:14:15.801359905+02:00" level=info msg="ClientConn switching balancer to \"pick_first\"" module=grpc
Oct 06 23:14:15 erina dockerd[877]: time="2018-10-06T23:14:15.801430262+02:00" level=info msg="pickfirstBalancer: HandleSubConnStateChange: 0xc420ab3e30, CONNECTING" module=grpc
Oct 06 23:14:15 erina dockerd[877]: time="2018-10-06T23:14:15.806367078+02:00" level=info msg="Listening for connections" addr="[::]:2377" module=node node.id=5vlol9p0ulu73d79dq6ie08w7 proto=tcp
Oct 06 23:14:15 erina dockerd[877]: time="2018-10-06T23:14:15.806508629+02:00" level=info msg="Listening for local connections" addr=/var/run/docker/swarm/control.sock module=node node.id=5vlol9p0ulu73d79dq6ie08w7 proto=unix
Oct 06 23:14:15 erina dockerd[877]: time="2018-10-06T23:14:15.810957083+02:00" level=info msg="pickfirstBalancer: HandleSubConnStateChange: 0xc420ab3e30, READY" module=grpc
Oct 06 23:14:15 erina dockerd[877]: time="2018-10-06T23:14:15.819838510+02:00" level=info msg="44d099625302cf1f became follower at term 0" module=raft node.id=5vlol9p0ulu73d79dq6ie08w7
Oct 06 23:14:15 erina dockerd[877]: time="2018-10-06T23:14:15.820413278+02:00" level=info msg="newRaft 44d099625302cf1f [peers: [], term: 0, commit: 0, applied: 0, lastindex: 0, lastterm: 0]" module=raft node.id=5vlol9p0ulu73d79dq6ie08w7
Oct 06 23:14:15 erina dockerd[877]: time="2018-10-06T23:14:15.820467764+02:00" level=info msg="44d099625302cf1f became follower at term 1" module=raft node.id=5vlol9p0ulu73d79dq6ie08w7
Oct 06 23:14:15 erina dockerd[877]: time="2018-10-06T23:14:15.822656939+02:00" level=info msg="44d099625302cf1f is starting a new election at term 1" module=raft node.id=5vlol9p0ulu73d79dq6ie08w7
Oct 06 23:14:15 erina dockerd[877]: time="2018-10-06T23:14:15.822724250+02:00" level=info msg="44d099625302cf1f became candidate at term 2" module=raft node.id=5vlol9p0ulu73d79dq6ie08w7
Oct 06 23:14:15 erina dockerd[877]: time="2018-10-06T23:14:15.822753509+02:00" level=info msg="44d099625302cf1f received MsgVoteResp from 44d099625302cf1f at term 2" module=raft node.id=5vlol9p0ulu73d79dq6ie08w7
Oct 06 23:14:15 erina dockerd[877]: time="2018-10-06T23:14:15.822772604+02:00" level=info msg="44d099625302cf1f became leader at term 2" module=raft node.id=5vlol9p0ulu73d79dq6ie08w7
Oct 06 23:14:15 erina dockerd[877]: time="2018-10-06T23:14:15.822784040+02:00" level=info msg="raft.node: 44d099625302cf1f elected leader 44d099625302cf1f at term 2" module=raft node.id=5vlol9p0ulu73d79dq6ie08w7
Oct 06 23:14:15 erina dockerd[877]: time="2018-10-06T23:14:15.824055570+02:00" level=info msg="Creating default ingress network" module=node node.id=5vlol9p0ulu73d79dq6ie08w7
Oct 06 23:14:15 erina dockerd[877]: time="2018-10-06T23:14:15.825692045+02:00" level=info msg="leadership changed from not yet part of a raft cluster to 5vlol9p0ulu73d79dq6ie08w7" module=node node.id=5vlol9p0ulu73d79dq6ie08w7
Oct 06 23:14:15 erina dockerd[877]: time="2018-10-06T23:14:15.825908931+02:00" level=info msg="dispatcher starting" module=dispatcher node.id=5vlol9p0ulu73d79dq6ie08w7
Oct 06 23:14:16 erina dockerd[877]: time="2018-10-06T23:14:16.327800756+02:00" level=info msg="manager selected by agent for new session: { }" module=node/agent node.id=5vlol9p0ulu73d79dq6ie08w7
Oct 06 23:14:16 erina dockerd[877]: time="2018-10-06T23:14:16.328535321+02:00" level=info msg="waiting 0s before registering session" module=node/agent node.id=5vlol9p0ulu73d79dq6ie08w7
Oct 06 23:14:16 erina dockerd[877]: time="2018-10-06T23:14:16.331564429+02:00" level=info msg="worker 5vlol9p0ulu73d79dq6ie08w7 was successfully registered" method="(*Dispatcher).register"
Oct 06 23:14:16 erina dockerd[877]: time="2018-10-06T23:14:16.336467018+02:00" level=info msg="Initializing Libnetwork Agent Listen-Addr=0.0.0.0 Local-addr=10.0.42.5 Adv-addr=10.0.42.5 Data-addr= Remote-addr-list=[] MTU=1500"
Oct 06 23:14:16 erina dockerd[877]: time="2018-10-06T23:14:16.336952412+02:00" level=info msg="New memberlist node - Node:erina will use memberlist nodeID:61113be67569 with config:&{NodeID:61113be67569 Hostname:erina BindAddr:0.0.0.0 Adve
Oct 06 23:14:16 erina dockerd[877]: time="2018-10-06T23:14:16.340097522+02:00" level=info msg="Node 61113be67569/10.0.42.5, joined gossip cluster"
Oct 06 23:14:16 erina dockerd[877]: time="2018-10-06T23:14:16.340463507+02:00" level=info msg="Node 61113be67569/10.0.42.5, added to nodes list"
Oct 06 23:14:16 erina dockerd[877]: time="2018-10-06T23:14:16.451896856+02:00" level=error msg="error reading the kernel parameter net.ipv4.vs.expire_nodest_conn" error="open /proc/sys/net/ipv4/vs/expire_nodest_conn: no such file or direc
Oct 06 23:14:32 erina dockerd[877]: time="2018-10-06T23:14:32.677672996+02:00" level=info msg="parsed scheme: \"\"" module=grpc
Oct 06 23:14:32 erina dockerd[877]: time="2018-10-06T23:14:32.677758228+02:00" level=info msg="scheme \"\" not registered, fallback to default scheme" module=grpc
Oct 06 23:14:32 erina dockerd[877]: time="2018-10-06T23:14:32.678233853+02:00" level=info msg="ccResolverWrapper: sending new addresses to cc: [{10.0.42.6:2377 0  <nil>}]" module=grpc
Oct 06 23:14:32 erina dockerd[877]: time="2018-10-06T23:14:32.678259473+02:00" level=info msg="ClientConn switching balancer to \"pick_first\"" module=grpc
Oct 06 23:14:32 erina dockerd[877]: time="2018-10-06T23:14:32.678382077+02:00" level=info msg="pickfirstBalancer: HandleSubConnStateChange: 0xc4215b4610, CONNECTING" module=grpc
Oct 06 23:14:32 erina dockerd[877]: time="2018-10-06T23:14:32.685426270+02:00" level=info msg="pickfirstBalancer: HandleSubConnStateChange: 0xc4215b4610, READY" module=grpc
Oct 06 23:14:32 erina dockerd[877]: time="2018-10-06T23:14:32.689241995+02:00" level=info msg="parsed scheme: \"\"" module=grpc
Oct 06 23:14:32 erina dockerd[877]: time="2018-10-06T23:14:32.689313955+02:00" level=info msg="scheme \"\" not registered, fallback to default scheme" module=grpc
Oct 06 23:14:32 erina dockerd[877]: time="2018-10-06T23:14:32.690387376+02:00" level=info msg="ccResolverWrapper: sending new addresses to cc: [{10.0.42.6:2377 0  <nil>}]" module=grpc
Oct 06 23:14:32 erina dockerd[877]: time="2018-10-06T23:14:32.690434968+02:00" level=info msg="ClientConn switching balancer to \"pick_first\"" module=grpc
Oct 06 23:14:32 erina dockerd[877]: time="2018-10-06T23:14:32.690572105+02:00" level=info msg="pickfirstBalancer: HandleSubConnStateChange: 0xc42173a0d0, CONNECTING" module=grpc
Oct 06 23:14:32 erina dockerd[877]: time="2018-10-06T23:14:32.703830708+02:00" level=info msg="pickfirstBalancer: HandleSubConnStateChange: 0xc42173a0d0, READY" module=grpc
Oct 06 23:14:32 erina dockerd[877]: time="2018-10-06T23:14:32.792400950+02:00" level=info msg="worker purz0nyznvqmuk9pyng2s4crw was successfully registered" method="(*Dispatcher).register"
Oct 06 23:14:33 erina dockerd[877]: time="2018-10-06T23:14:33.193782128+02:00" level=info msg="Node 66434deef943/10.0.42.6, joined gossip cluster"
Oct 06 23:14:33 erina dockerd[877]: time="2018-10-06T23:14:33.193891161+02:00" level=info msg="Node 66434deef943/10.0.42.6, added to nodes list"
Oct 06 23:14:39 erina dockerd[877]: time="2018-10-06T23:14:39.412553161+02:00" level=info msg="parsed scheme: \"\"" module=grpc
Oct 06 23:14:39 erina dockerd[877]: time="2018-10-06T23:14:39.412652667+02:00" level=info msg="scheme \"\" not registered, fallback to default scheme" module=grpc
Oct 06 23:14:39 erina dockerd[877]: time="2018-10-06T23:14:39.412928029+02:00" level=info msg="ccResolverWrapper: sending new addresses to cc: [{10.0.42.7:2377 0  <nil>}]" module=grpc
Oct 06 23:14:39 erina dockerd[877]: time="2018-10-06T23:14:39.412945426+02:00" level=info msg="ClientConn switching balancer to \"pick_first\"" module=grpc
Oct 06 23:14:39 erina dockerd[877]: time="2018-10-06T23:14:39.413018920+02:00" level=info msg="pickfirstBalancer: HandleSubConnStateChange: 0xc420b60090, CONNECTING" module=grpc
Oct 06 23:14:39 erina dockerd[877]: time="2018-10-06T23:14:39.421483563+02:00" level=info msg="pickfirstBalancer: HandleSubConnStateChange: 0xc420b60090, READY" module=grpc
Oct 06 23:14:39 erina dockerd[877]: time="2018-10-06T23:14:39.426802400+02:00" level=info msg="parsed scheme: \"\"" module=grpc
Oct 06 23:14:39 erina dockerd[877]: time="2018-10-06T23:14:39.427245029+02:00" level=info msg="scheme \"\" not registered, fallback to default scheme" module=grpc
Oct 06 23:14:39 erina dockerd[877]: time="2018-10-06T23:14:39.427967680+02:00" level=info msg="ccResolverWrapper: sending new addresses to cc: [{10.0.42.7:2377 0  <nil>}]" module=grpc
Oct 06 23:14:39 erina dockerd[877]: time="2018-10-06T23:14:39.428043646+02:00" level=info msg="ClientConn switching balancer to \"pick_first\"" module=grpc
Oct 06 23:14:39 erina dockerd[877]: time="2018-10-06T23:14:39.428114067+02:00" level=info msg="pickfirstBalancer: HandleSubConnStateChange: 0xc420b05910, CONNECTING" module=grpc
Oct 06 23:14:39 erina dockerd[877]: time="2018-10-06T23:14:39.435951375+02:00" level=info msg="pickfirstBalancer: HandleSubConnStateChange: 0xc420b05910, READY" module=grpc
Oct 06 23:14:39 erina dockerd[877]: time="2018-10-06T23:14:39.515967916+02:00" level=info msg="worker mmxnqjixdse5ilap5rajq56rn was successfully registered" method="(*Dispatcher).register"
Oct 06 23:14:39 erina dockerd[877]: time="2018-10-06T23:14:39.915913094+02:00" level=info msg="Node e29997e99be2/10.0.42.7, joined gossip cluster"
Oct 06 23:14:39 erina dockerd[877]: time="2018-10-06T23:14:39.916019536+02:00" level=info msg="Node e29997e99be2/10.0.42.7, added to nodes list"
Oct 06 23:16:05 erina dockerd[877]: time="2018-10-06T23:16:05+02:00" level=info msg="shim docker-containerd-shim started" address="/containerd-shim/moby/cff02f8ce4cd9eee5da51bd6287a539934512fce80f0ca924300bc9a53f88e93/shim.sock" debug=fal
Oct 06 23:17:03 erina dockerd[877]: time="2018-10-06T23:17:03+02:00" level=info msg="shim reaped" id=cff02f8ce4cd9eee5da51bd6287a539934512fce80f0ca924300bc9a53f88e93
Oct 06 23:17:03 erina dockerd[877]: time="2018-10-06T23:17:03.877115321+02:00" level=info msg="ignoring event" module=libcontainerd namespace=moby topic=/tasks/delete type="*events.TaskDelete"
Oct 06 23:17:03 erina dockerd[877]: time="2018-10-06T23:17:03.877818612+02:00" level=warning msg="rmServiceBinding 6cbe6e43c69ed9115589acd06aee30354dd07a5480178d23dbde42c844d1f8d7 possible transient state ok:false entries:0 set:false "
Oct 06 23:17:03 erina dockerd[877]: time="2018-10-06T23:17:03.991738857+02:00" level=warning msg="rmServiceBinding 2a273d588b999b0992f3eb71527d683cb2ec9c93f24a7566311899998997ce25 possible transient state ok:false entries:0 set:false "
Oct 06 23:19:16 erina dockerd[877]: time="2018-10-06T23:19:16.341187532+02:00" level=info msg="NetworkDB stats erina(61113be67569) - netID:4sqgzuyftpssn311oacx8xuql leaving:false netPeers:3 entries:12 Queue qLen:0 netMsg/s:0"
Oct 06 23:24:16 erina dockerd[877]: time="2018-10-06T23:24:16.540785611+02:00" level=info msg="NetworkDB stats erina(61113be67569) - netID:4sqgzuyftpssn311oacx8xuql leaving:false netPeers:3 entries:12 Queue qLen:0 netMsg/s:0"
Oct 06 23:29:16 erina dockerd[877]: time="2018-10-06T23:29:16.740837575+02:00" level=info msg="NetworkDB stats erina(61113be67569) - netID:4sqgzuyftpssn311oacx8xuql leaving:false netPeers:3 entries:12 Queue qLen:0 netMsg/s:0"
```

I'll be happy to provide more information if needed.

**Comment by angristan** [comment]
I've been able to reproduce the issue on Vultr with Wireguard too.

Here are some network info of one node, if that helps:

```sh
root@node1:~# ip a
1: lo: <LOOPBACK,UP,LOWER_UP> mtu 65536 qdisc noqueue state UNKNOWN group default qlen 1
    link/loopback 00:00:00:00:00:00 brd 00:00:00:00:00:00
    inet 127.0.0.1/8 scope host lo
       valid_lft forever preferred_lft forever
    inet6 ::1/128 scope host
       valid_lft forever preferred_lft forever
2: ens3: <BROADCAST,MULTICAST,UP,LOWER_UP> mtu 1500 qdisc fq state UP group default qlen 1000
    link/ether 56:00:01:b5:94:b1 brd ff:ff:ff:ff:ff:ff
    inet 217.69.xxx.xxx/23 brd 217.69.xxx.255 scope global ens3
       valid_lft forever preferred_lft forever
    inet6 2001:19f0:6801:d6c:5400:1ff:feb5:94b1/64 scope global mngtmpaddr dynamic
       valid_lft 2591730sec preferred_lft 604530sec
    inet6 fe80::5400:1ff:feb5:94b1/64 scope link
       valid_lft forever preferred_lft forever
3: wg0: <POINTOPOINT,NOARP,UP,LOWER_UP> mtu 1420 qdisc noqueue state UNKNOWN group default qlen 1
    link/none
    inet 10.0.0.1/32 scope global wg0
       valid_lft forever preferred_lft forever
4: docker0: <NO-CARRIER,BROADCAST,MULTICAST,UP> mtu 1500 qdisc noqueue state DOWN group default
    link/ether 02:42:c5:f5:66:4f brd ff:ff:ff:ff:ff:ff
    inet 172.17.0.1/16 brd 172.17.255.255 scope global docker0
       valid_lft forever preferred_lft forever
9: docker_gwbridge: <BROADCAST,MULTICAST,UP,LOWER_UP> mtu 1500 qdisc noqueue state UP group default
    link/ether 02:42:17:2a:59:de brd ff:ff:ff:ff:ff:ff
    inet 172.18.0.1/16 brd 172.18.255.255 scope global docker_gwbridge
       valid_lft forever preferred_lft forever
    inet6 fe80::42:17ff:fe2a:59de/64 scope link
       valid_lft forever preferred_lft forever
11: vethad870c8@if10: <BROADCAST,MULTICAST,UP,LOWER_UP> mtu 1500 qdisc noqueue master docker_gwbridge state UP group default
    link/ether 22:ed:0a:82:44:16 brd ff:ff:ff:ff:ff:ff link-netnsid 1
    inet6 fe80::20ed:aff:fe82:4416/64 scope link
       valid_lft forever preferred_lft forever
15: vethfa2ee72@if14: <BROADCAST,MULTICAST,UP,LOWER_UP> mtu 1500 qdisc noqueue master docker_gwbridge state UP group default
    link/ether 0e:2d:83:44:9a:8b brd ff:ff:ff:ff:ff:ff link-netnsid 2
    inet6 fe80::c2d:83ff:fe44:9a8b/64 scope link
       valid_lft forever preferred_lft forever
```

```sh
root@node1:~# ip r
default via 217.69.xxx.1 dev ens3
10.0.0.2 dev wg0 scope link
10.0.0.3 dev wg0 scope link
169.254.169.254 via 217.69.xxx.1 dev ens3
172.17.0.0/16 dev docker0 proto kernel scope link src 172.17.0.1 linkdown
172.18.0.0/16 dev docker_gwbridge proto kernel scope link src 172.18.0.1
217.69.xxx.0/23 dev ens3 proto kernel scope link src 217.69.xxx.xxx
```

**Comment by angristan** [comment]
Containers on different hosts can access each other trough the `swarm` overlay.

**Comment by angristan** [comment]
Is there any technical documentation on Swarm routing?

**Comment by angristan** [comment]
It seems that @cecchisandrone has the **exact** same issue as me! 

https://stackoverflow.com/questions/52409012/docker-swarm-mode-routing-mesh-not-working-with-wireguard-vpn

**Comment by cpuguy83** [comment]
Why are you running the swarm listener through wireguard?

Also, have you tried tracing this through something like tcpdump?

**Comment by angristan** [comment]
Because that's the only way the nodes can communicate? As I said, on Hetzner Cloud, we don't have private networking.

Yes, I have done a ton of tcpdump, while comparing to a functional non-wireguard cluster. I didn't find anything, but I also don't really know what I should be searching.

**Comment by bagbag** [comment]
Same happens for me with wireguard 0.0.20181018 and docker-ce 18.09.0
Have you found a solution for this problem?

**Comment by angristan** [comment]
Hello @bagbag, no, I'm still searching for a solution

**Comment by bagbag** [comment]
I gave up and use the public network with `--opt encrypted`.

**Comment by klipitkas** [comment]
Also experiencing this issue on Hetzner Cloud.

**Comment by stiivo** [comment]
Maybe https://github.com/moby/moby/issues/36689#issuecomment-987706496 can help if people from search engines land here.

**Comment by bungeefield** [comment]
I had this same issue, was being caused by ufw blocking the overlay network packets (4789/udp).

You can test to see if this is your issue by temporarily disabling ufw with `sudo ufw disable` and then waiting a bit to see if it works (or just restart everything because your impatient like me). Then afterwards remember to reenable ufw with `sudo ufw enable`.

If that was your issue you can add a rule as follows `sudo ufw allow from 10.0.42.0/24 proto udp to any port 4789`, where `10.0.42.0/24` is your wireguard network.

**Comment by bungeefield** [comment]
> I had this same issue, was being caused by ufw blocking the overlay network packets (4789/udp).
> 
> You can test to see if this is your issue by temporarily disabling ufw with `sudo ufw disable` and then waiting a bit to see if it works (or just restart everything because your impatient like me). Then afterwards remember to reenable ufw with `sudo ufw enable`.
> 
> If that was your issue you can add a rule as follows `sudo ufw allow from 10.0.42.0/24 proto udp to any port 4789`, where `10.0.42.0/24` is your wireguard network.

Nevermind scratch that, it stopped working after a few hours, but what does work is just allowing all traffic from the wireguard interface with `sudo ufw allow in on wg0` where `wg0` is your wireguard interface.

**Comment by bdoublet91** [comment]
Hi, I try to do the same setup with wireguard and two cloud provider. All route are ok, I create my cluster and swarm can communicate through UDP and TCP through internal LAN.
![image](https://user-images.githubusercontent.com/57101863/167629887-aea05941-c70b-4dc8-b505-be8eb565ebc7.png)


Sam problem when services try to communicate on the same overlay networks, the dns docker resolve the ip but the ping doesnt reach the target.

I have debug a little further with tcpdump and udp port 4789. Because swarm use vxlan techno to send ip packet to another host, I saw the echo request and echo reply in UDP packet:
CF below
10.110.1.130 is the worker where the sender icmp container is
10.10.3.182 is the worker where the target container is

sudo tcpdump -i any -n -p udp port 4789
```
13:55:38.193961 IP 10.110.1.130.45777 > 10.10.3.182.4789: VXLAN, flags [I] (0x08), vni 4120
IP 10.0.24.234 > 10.0.24.130: ICMP echo request, id 99, seq 7, length 64
13:55:38.194083 IP 10.10.3.182.53901 > 10.110.1.130.4789: VXLAN, flags [I] (0x08), vni 4120
IP 10.0.24.130 > 10.0.24.234: ICMP echo reply, id 99, seq 7, length 64
```

And after on the worker where the sender icmp container is
```
11:57:09.224234 IP 10.110.1.130.45777 > 10.10.3.182.4789: VXLAN, flags [I] (0x08), vni 4120
IP 10.0.24.234 > 10.0.24.130: ICMP echo request, id 99, seq 98, length 64
11:57:09.232460 IP 10.110.1.129.53901 > 10.110.1.130.4789: VXLAN, flags [I] (0x08), vni 4120
IP 10.0.24.130 > 10.0.24.234: ICMP echo reply, id 99, seq 98, length 64
```

I don't know why the icmp packet doesnt return to the container whereas I saw it on the worker host ...

Default iptables Rules:
```
sudo iptables -L -v -t nat
Chain PREROUTING (policy ACCEPT 4182 packets, 437K bytes)
 pkts bytes target     prot opt in     out     source               destination         
97743 9383K DOCKER-INGRESS  all  --  any    any     anywhere             anywhere             ADDRTYPE match dst-type LOCAL
 3930  405K DOCKER     all  --  any    any     anywhere             anywhere             ADDRTYPE match dst-type LOCAL

Chain INPUT (policy ACCEPT 3982 packets, 427K bytes)
 pkts bytes target     prot opt in     out     source               destination         

Chain OUTPUT (policy ACCEPT 1004 packets, 69268 bytes)
 pkts bytes target     prot opt in     out     source               destination         
 2178  175K DOCKER-INGRESS  all  --  any    any     anywhere             anywhere             ADDRTYPE match dst-type LOCAL
    0     0 DOCKER     all  --  any    any     anywhere            !localhost/8          ADDRTYPE match dst-type LOCAL

Chain POSTROUTING (policy ACCEPT 1004 packets, 69268 bytes)
 pkts bytes target     prot opt in     out     source               destination         
    0     0 MASQUERADE  all  --  any    !docker0  172.18.0.0/20        anywhere            
  902 45348 MASQUERADE  all  --  any    !docker_gwbridge  172.18.48.0/20       anywhere            
    6   304 MASQUERADE  all  --  any    docker_gwbridge  anywhere             anywhere             ADDRTYPE match src-type LOCAL

Chain DOCKER (2 references)
 pkts bytes target     prot opt in     out     source               destination         
    0     0 RETURN     all  --  docker0 any     anywhere             anywhere            
    2   144 RETURN     all  --  docker_gwbridge any     anywhere             anywhere            

Chain DOCKER-INGRESS (2 references)
 pkts bytes target     prot opt in     out     source               destination         
    0     0 DNAT       tcp  --  any    any     anywhere             anywhere             tcp dpt:8082 to:172.18.48.2:8082
    0     0 DNAT       tcp  --  any    any     anywhere             anywhere             tcp dpt:8083 to:172.18.48.2:8083
    0     0 DNAT       tcp  --  any    any     anywhere             anywhere             tcp dpt:http-alt to:172.18.48.2:8080
    0     0 DNAT       tcp  --  any    any     anywhere             anywhere             tcp dpt:9090 to:172.18.48.2:9090
 3965  409K RETURN     all  --  any    any     anywhere             anywhere            
```

```
docker network inspect test-arsenal 
[
    {
        "Name": "test",
        "Id": "8nopak0wwpxlb75gg9y8mrtcq",
        "Created": "2022-05-10T14:17:57.193769059+02:00",
        "Scope": "swarm",
        "Driver": "overlay",
        "EnableIPv6": false,
        "IPAM": {
            "Driver": "default",
            "Options": null,
            "Config": [
                {
                    "Subnet": "10.40.0.0/16",
                    "Gateway": "10.40.0.1"
                }
            ]
        },
        "Internal": false,
        "Attachable": false,
        "Ingress": false,
        "ConfigFrom": {
            "Network": ""
        },
        "ConfigOnly": false,
        "Containers": {
            "1a94a2c6937a8bb8c3d8d2bf59da0d16ed48e604217185f827b9bf14b1976bd1": {
                "Name": "test-zap-1.1.2o9zf96c62emx4bjyflgmuau7",
                "EndpointID": "0cfafef8f2f318b31b91f4b5ecc59460688d2c952a2e428dff68c9f648480d3e",
                "MacAddress": "02:42:0a:28:00:62",
                "IPv4Address": "10.40.0.98/16",
                "IPv6Address": ""
            },
            "315c71b8c571cf430d8c061b51ae731b1e9d9196518998b0f65cf4086140ff4a": {
                "Name": "test-nessus-1.1.p3mpildppvby7x77a5zj0a0tr",
                "EndpointID": "23156f996b5cf88763590bcea64941fbe64fef2feee507a8e9b2d6b6e698fa95",
                "MacAddress": "02:42:0a:28:00:13",
                "IPv4Address": "10.40.0.19/16",
                "IPv6Address": ""
            },
            "53154c800f7929037464607fbfd9b1b9368f4f740e8f2bc8c4ddc628b6b83900": {
                "Name": "test-arsenal_web.1.ag35t66u9ojet8wamllkpicvt",
                "EndpointID": "b85ddd8c5c3f3ed4dd7e92dd7fffe69ee0a977ec1e1ff62dd32c4b5f8117e192",
                "MacAddress": "02:42:0a:28:00:64",
                "IPv4Address": "10.40.0.100/16",
                "IPv6Address": ""
            },
            "7cf3fa6eff6031b6a1c5dc2d7a68244265e9a6db70588050576a0f09c810e7a2": {
                "Name": "test-rabbitmq.1.3khyzd4fglcyirq6ymkovts71",
                "EndpointID": "f464be9d41bf8d875d5f21458a2bf9f07e8d90a067e22fe40deefba2c304a477",
                "MacAddress": "02:42:0a:28:00:69",
                "IPv4Address": "10.40.0.105/16",
                "IPv6Address": ""
            },
            "809f9c10fddc331b530574016f475157642b60e57502a21fe03116a4652e5e16": {
                "Name": "test-ssllabs-1.1.6tiat5d69u8pf3hmt4kbiwee3",
                "EndpointID": "77e5c503a5978937b66fa9bb4ed9fa3bd7c81e39aca3c11b8e53e4c9b47c4cff",
                "MacAddress": "02:42:0a:28:00:1c",
                "IPv4Address": "10.40.0.28/16",
                "IPv6Address": ""
            },
            "850abc0fd42f5f12455837c9f9e4719b8b350acef4dc5694ae51e93f753f2724": {
                "Name": "test-wpscan-1.1.q3t2nyv0mlyry274n5jd1ywb6",
                "EndpointID": "fa471b40b95191f45d05f8e9b8e8d206627c086f670ccaf0a5aa5ec7555ffc33",
                "MacAddress": "02:42:0a:28:00:38",
                "IPv4Address": "10.40.0.56/16",
                "IPv6Address": ""
            },
            "lb-test-arsenal": {
                "Name": "test-endpoint",
                "EndpointID": "cbe916c35f8ccde5cc8c405cc973fd9688bafb25056494139c00b0ff86a00864",
                "MacAddress": "02:42:0a:28:00:14",
                "IPv4Address": "10.40.0.20/16",
                "IPv6Address": ""
            }
        },
        "Options": {
            "com.docker.network.driver.overlay.vxlanid_list": "4148"
        },
        "Labels": {},
        "Peers": [
            {
                "Name": "86cfc7ed5320",
                "IP": "10.110.1.130"
            },
            {
                "Name": "39230bb49658",
                "IP": "10.10.2.102"
            },
            {
                "Name": "848bb0c1d6fb",
                "IP": "10.10.3.182"
            },
            {
                "Name": "af036cd6708e",
                "IP": "10.10.3.26"
            }
        ]
    }
]

```
