### ISSUE TITLE
swarm not forwarding when keepalived configured?

### ISSUE THREAD

**Issue by tanimientras** [moby/moby#45172]
### Description

Consider 2 nodes (IPs: 192.168.120.53 and 192.168.120.78) in a **swarm cluster**. Both hosts are configured with **keepalived** to share a VIP (192.168.120.79)

Then deployed a **service** listening on 514/udp (rsyslog)

Although tcpdump shows messages are being received, nothing is forwarded to the container (tcpdump in container outputs nothing)
> host1$ sudo tcpdump port 514 -i ens192
```bash
14:07:47.886354 IP source2.domain.com.51218 > host1.domain.com.syslog:  (invalid)
14:07:47.887469 IP source2.domain.com.51218 > host1.domain.com.syslog:  (invalid)
14:07:47.898652 IP source1.domain.com.49011 > 192.168.120.79.syslog:  (invalid)
14:07:47.898728 IP source1.domain.com.49011 > 192.168.120.79.syslog:  (invalid)
14:07:47.899947 IP source1.domain.com.49011 > 192.168.120.79.syslog:  (invalid)
14:07:48.056801 IP source1.domain.com.49011 > 192.168.120.79.syslog:  (invalid)
14:07:48.057569 IP source2.domain.com.51218 > host1.domain.com.syslog:  (invalid)
14:07:48.957936 IP source2.domain.com.51218 > host1.domain.com.syslog:  (invalid)
```
> hosts1$ sudo iptables -L -n -t nat 
```
Chain DOCKER-INGRESS (2 references)
target     prot opt source               destination         
DNAT       tcp  --  0.0.0.0/0            0.0.0.0/0            tcp dpt:514 to:172.18.0.2:514
DNAT       udp  --  0.0.0.0/0            0.0.0.0/0            udp dpt:514 to:172.18.0.2:514
```

If I run a **normal**(ie: docker run) container instead of service, traffic arrives properly.

### Reproduce

1. configure keepalived on 2 hosts 
2. deploy a docker swarm
3. create a service (514 udp)

### Expected behavior

rsyslog container should be receiving traffic, but it doesn't.

### docker version

```bash
Client: Docker Engine - Community
 Version:           23.0.1
 API version:       1.42
 Go version:        go1.19.5
 Git commit:        a5ee5b1
 Built:             Thu Feb  9 19:47:01 2023
 OS/Arch:           linux/amd64
 Context:           default

Server: Docker Engine - Community
 Engine:
  Version:          23.0.1
  API version:      1.42 (minimum version 1.12)
  Go version:       go1.19.5
  Git commit:       bc3805a
  Built:            Thu Feb  9 19:47:01 2023
  OS/Arch:          linux/amd64
  Experimental:     false
 containerd:
  Version:          1.6.18
  GitCommit:        2456e983eb9e37e47538f59ea18f2043c9a73640
 runc:
  Version:          1.1.4
  GitCommit:        v1.1.4-0-g5fd4c4d
 docker-init:
  Version:          0.19.0
  GitCommit:        de40ad0
```

### docker info

```bash
Client:
 Context:    default
 Debug Mode: false
 Plugins:
  buildx: Docker Buildx (Docker Inc.)
    Version:  v0.10.2
    Path:     /usr/libexec/docker/cli-plugins/docker-buildx
  compose: Docker Compose (Docker Inc.)
    Version:  v2.16.0
    Path:     /usr/libexec/docker/cli-plugins/docker-compose
  scan: Docker Scan (Docker Inc.)
    Version:  v0.23.0
    Path:     /usr/libexec/docker/cli-plugins/docker-scan

Server:
 Containers: 3
  Running: 3
  Paused: 0
  Stopped: 0
 Images: 16
 Server Version: 23.0.1
 Storage Driver: overlay2
  Backing Filesystem: extfs
  Supports d_type: true
  Using metacopy: false
  Native Overlay Diff: true
  userxattr: false
 Logging Driver: json-file
 Cgroup Driver: systemd
 Cgroup Version: 2
 Plugins:
  Volume: local
  Network: bridge host ipvlan macvlan null overlay
  Log: awslogs fluentd gcplogs gelf journald json-file local logentries splunk syslog
 Swarm: active
  NodeID: qksi69dzvixw23db2v5wmpdxq
  Is Manager: true
  ClusterID: tthbncu84qm3po4rgiy3g269u
  Managers: 2
  Nodes: 2
  Default Address Pool: 10.0.0.0/8  
  SubnetSize: 24
  Data Path Port: 4789
  Orchestration:
   Task History Retention Limit: 5
  Raft:
   Snapshot Interval: 10000
   Number of Old Snapshots to Retain: 0
   Heartbeat Tick: 1
   Election Tick: 10
  Dispatcher:
   Heartbeat Period: 5 seconds
  CA Configuration:
   Expiry Duration: 3 months
   Force Rotate: 0
  Autolock Managers: false
  Root Rotation In Progress: false
  Node Address: 192.168.120.53
  Manager Addresses:
   192.168.120.53:2377
   192.168.120.78:2377
 Runtimes: io.containerd.runc.v2 runc
 Default Runtime: runc
 Init Binary: docker-init
 containerd version: 2456e983eb9e37e47538f59ea18f2043c9a73640
 runc version: v1.1.4-0-g5fd4c4d
 init version: de40ad0
 Security Options:
  apparmor
  seccomp
   Profile: builtin
  cgroupns
 Kernel Version: 5.15.0-30-generic
 Operating System: Ubuntu 22.04.2 LTS
 OSType: linux
 Architecture: x86_64
 CPUs: 2
 Total Memory: 3.833GiB
 Name: vmdocker-mz-01
 ID: 5HYM:XFWT:QXNU:A525:43KK:M6W6:4MUF:LNG3:6MCR:H374:MIDF:BT6X
 Docker Root Dir: /var/lib/docker
 Debug Mode: false
 Registry: https://index.docker.io/v1/
 Experimental: false
 Insecure Registries:
  127.0.0.0/8
 Live Restore Enabled: false

WARNING: Running Swarm in a two-manager configuration. This configuration provides
         no fault tolerance, and poses a high risk to lose control over the cluster.
         Refer to https://docs.docker.com/engine/swarm/admin_guide/ to configure the
         Swarm for fault-tolerance.
```

### Additional Info

Dockerfile 
```
FROM ubuntu:22.04
RUN apt update && apt -y install software-properties-common
RUN add-apt-repository -y ppa:adiscon/v8-stable
RUN apt update && apt -y install rsyslog-relp rsyslog-mmjsonparse liblognorm5
EXPOSE 514/tcp
EXPOSE 514/udp
EXPOSE 20514/tcp
CMD rsyslogd -n
```
rsyslog-stack.yml 
```
version: '3.8'
services:
  rsyslog:
    image: 'rsyslog:22.04'
    ports:
     - '514:514/udp'
     - '514:514/tcp'
     - '20514:20514/tcp'
    volumes:
      - ./rsyslog.conf:/etc/rsyslog.conf
      - /var/log/:/logs/
```
rsyslog.conf
```
module(load="builtin:omfile")
module(load="imudp")
input(
 	port="514"
	type="imudp"
	name="imudp"
	ruleset="ruleset"
)
module(load="imtcp")
input(
	port="514"
	type="imtcp"
	name="imtcp"
	ruleset="ruleset"
)
module(load="imrelp")
input(
	port="20514"
	type="imrelp"
	name="imrelp"
	ruleset="ruleset"
)
ruleset(name="ruleset") {
	action(
		name="error"
		type="omfile"
		file="/logs/rsyslog-errors.log"
		)
	stop
	} 
}
```

**Comment by Abyss777** [comment]
Hello. I have similar problem with forwarding UDP traffic.

Ubuntu 22.04, docker 28.5.0

I have a swarm service with number of netflow collectors `nfcapd` with number udp port forwarded.

And number of netflow senders (linux and different devices).

Want to notice that udp traffic is in one direction. Collectors do not answer to senders.

Sometimes something happens and traffic stop forwarding. I see the traffic on the host with tcpdump, but stop seeing inside the container.

Restarting container, restarting docker, even restarting host don't help. The only thing is help is restarting sender on device.

At the same time when everything is work restarting container don't break anything.

I believe the problem is in udp/iptables/conntrack.

First packet after sender restart considered as NEW (somehow, may be some counter) but others are considered as ESTABLISHED,RELATED. Then something happens (network issue or something) info about connection is flushed from conntrack. Conntrack considers following packets as ESTABLISHED,RELATED and don't forward them.

I looked in `nft list ruleset` and it looks like upd forwarding treated as tcp, but it should not. Udp is stateless.

I hope you can make sense of my muddled explanation.

Also I've found this investigation https://serverfault.com/questions/1156832/docker-swarm-routing-mesh-does-not-forward-udp-traffic-after-container-restart
