### ISSUE TITLE
docker_gwbridge not forwards traffic

### ISSUE THREAD

**Issue by sergey-safarov** [moby/moby#35922]
**Description**
I created swarm network with flag `--attachable`
Then I created container with published ports (used `-p 15984:15984` in my case)
Then I stoped and created again container using same `docker run` command (restarted systemd unit).

Then new container not receives traffic from external devices (from Internet).
I found that network traffic issue resolved if ARP cache is cleared on host device using command
`ip -s -s neigh flush all`

**Steps to reproduce the issue:**
Issue have side effect. Some time container restarts correctly. Not know how to reproduce.

**Describe the results you received:**
Container is not accessible via published port.

**Describe the results you expected:**
Container must be accessible via published port after container restart.

**Additional information you deem important (e.g. issue happens only occasionally):**
Issue resolved if i executed command `ip -s -s neigh flush all` on host system.

**Output of `docker version`:**

```
[root@node1 ~]# docker version
Client:
 Version:	17.12.0-ce
 API version:	1.35
 Go version:	go1.9.2
 Git commit:	c97c6d6
 Built:	Wed Dec 27 20:12:17 2017
 OS/Arch:	linux/amd64

Server:
 Engine:
  Version:	17.12.0-ce
  API version:	1.35 (minimum version 1.12)
  Go version:	go1.9.2
  Git commit:	c97c6d6
  Built:	Wed Dec 27 20:14:50 2017
  OS/Arch:	linux/amd64
  Experimental:	false
```

**Output of `docker info`:**

```
[root@node1 ~]# docker info
Containers: 9
 Running: 6
 Paused: 0
 Stopped: 3
Images: 24
Server Version: 17.12.0-ce
Storage Driver: overlay2
 Backing Filesystem: xfs
 Supports d_type: true
 Native Overlay Diff: true
Logging Driver: none
Cgroup Driver: cgroupfs
Plugins:
 Volume: local
 Network: bridge host macvlan null overlay
 Log: awslogs fluentd gcplogs gelf journald json-file logentries splunk syslog
Swarm: active
 NodeID: e7nj67uocrqcqpvybgj8qso8q
 Is Manager: true
 ClusterID: iw12j90oh79yv3ul39okfkcd6
 Managers: 1
 Nodes: 2
 Orchestration:
  Task History Retention Limit: 5
 Raft:
  Snapshot Interval: 10000
  Number of Old Snapshots to Retain: 0
  Heartbeat Tick: 1
  Election Tick: 3
 Dispatcher:
  Heartbeat Period: 5 seconds
 CA Configuration:
  Expiry Duration: 3 months
  Force Rotate: 0
 Autolock Managers: false
 Root Rotation In Progress: false
 Node Address: 10.31.1.98
 Manager Addresses:
  10.31.1.98:2377
Runtimes: runc
Default Runtime: runc
Init Binary: docker-init
containerd version: 89623f28b87a6004d4b785663257362d1658a729
runc version: b2567b37d7b75eb4cf325b77297b140ea686ce8f
init version: 949e6fa
Security Options:
 seccomp
  Profile: default
Kernel Version: 4.13.13-300.fc27.x86_64
Operating System: Fedora 27 (Twenty Seven)
OSType: linux
Architecture: x86_64
CPUs: 8
Total Memory: 125.8GiB
Name: node1.docker.rcsnet.ru
ID: UBXK:GAHS:YEWN:BRYI:DRP4:3PXH:A55E:IFXZ:4Z4Z:BTN5:S4NK:7ICQ
Docker Root Dir: /var/lib/docker
Debug Mode (client): false
Debug Mode (server): false
Registry: https://index.docker.io/v1/
Labels:
Experimental: false
Insecure Registries:
 127.0.0.0/8
Live Restore Enabled: false
```

**Additional environment details (AWS, VirtualBox, physical, etc.):**
Docker installed on bare metal server.

**Comment by sergey-safarov** [comment]
Think need to add arp cache cleanup  for records with MAC address and IP equal to MAC address and IP of started container.

**Comment by sergey-safarov** [comment]
Think same arp cache cleanup required also for:
1) each container connected to same `swarm` network;
2) host and each container connected to same `bridge` network.

**Comment by sergey-safarov** [comment]
Issue is resolved also when send [`gratuitous arp`](https://wiki.wireshark.org/Gratuitous_ARP) from container. Example
```
docker exec -it haproxy1 arping -A -c 4 -I eth1 172.17.0.3
```
Please add new feature - required to send `gratuitous arp` via each available network interface.
Other examples how to send `gratuitous arp` located [here](https://www.cyberciti.biz/faq/linux-networking-sending-gratuitous-arps/)

**Comment by sergey-safarov** [comment]
if container not have `arping` utility, then may be used `arping` from host.
```
[root@node0 system]# docker inspect --format="{{.NetworkSettings.SandboxKey}}" haproxy1
/var/run/docker/netns/51deb6fdc509
[root@node0 system]# ip netns exec 51deb6fdc509 arping -A -c 4 -I eth1 172.17.0.3
ARPING 172.17.0.3 from 172.17.0.3 eth1
Broadcast reply from 172.17.0.3 [02:42:AC:11:00:03]  0.559ms
Unicast reply from 172.17.0.3 [02:42:AC:11:00:03]  0.531ms
Unicast reply from 172.17.0.3 [02:42:AC:11:00:03]  0.534ms
Sent 4 probes (1 broadcast(s))
Received 3 response(s) (1 broadcast(s))
```

**Comment by thaJeztah** [comment]
ping @ddebroy @selansen could you have a look?

**Comment by selansen** [comment]
we will add in our work item list and will take a look at it soon.

**Comment by ddebroy** [comment]
@sergey-safarov can you please clarify/detail the repro steps specifically the exact commands used to bring up the container and restart it?

I created a swarm node and configured an attachable overlay network there:
```docker network create --driver=overlay --attachable testnet1```

Next I brought up a container attached to the network with: 
```docker run --name docker-nginx --network=testnet1 -d -p 80:80 nginx ```
exposing port 80. 

After I stopped and restarted this container (with ```docker rm -f``` followed by ```docker run```) I am always able to access nginx over port 80.

**Comment by sergey-safarov** [comment]
@ddebroy 

To start container i used systemd unit file `/etc/systemd/system/haproxy-docker.service`
```
[Unit]
Description=haproxy container
After=docker.service network-online.target
Requires=docker.service

[Service]
Restart=always
TimeoutStartSec=0
#One ExecStart/ExecStop line to prevent hitting bugs in certain systemd versions
ExecStart=/bin/sh -c 'docker rm -f haproxy1; \
          docker run -t --rm=true --log-driver=none --network kazoo --name haproxy1 \
                 --hostname haproxy1.kazoo \
                 -p 15984:15984 -p 15986:15986 \
                 --ip 10.0.9.10 \
                 -v /dev/log:/dev/log \
                 -v /etc/kazoo/kazoo-configs-haproxy/haproxy:/usr/local/etc/haproxy \
                 haproxy:1.5.19-alpine'

#ExecStartPost=/usr/sbin/ip -s -s neigh flush all
ExecStop=/usr/bin/docker stop haproxy1

[Install]
WantedBy=multi-user.target
```
and then command `systemctl restart haproxy-docker.service`

Now I cannot reproduce issue on my host.
Think need to close issue and open when issue is reproduced again.

**Comment by thaJeztah** [comment]
Thanks for the update @sergey-safarov  - I'll close this issue

**Comment by sergey-safarov** [comment]
Today issue is reproduced on `CentOS7` host with `Docker 17.09`
Version
```
[root@node12 ~]# docker version
Client:
 Version:      17.09.0-ce
 API version:  1.32
 Go version:   go1.8.3
 Git commit:   afdb6d4
 Built:        Tue Sep 26 22:41:23 2017
 OS/Arch:      linux/amd64

Server:
 Version:      17.09.0-ce
 API version:  1.32 (minimum version 1.12)
 Go version:   go1.8.3
 Git commit:   afdb6d4
 Built:        Tue Sep 26 22:42:49 2017
 OS/Arch:      linux/amd64
 Experimental: false
```
Info
```
[root@node12 ~]# docker info
Containers: 12
 Running: 12
 Paused: 0
 Stopped: 0
Images: 18
Server Version: 17.09.0-ce
Storage Driver: devicemapper
 Pool Name: docker-thinpool
 Pool Blocksize: 524.3kB
 Base Device Size: 10.74GB
 Backing Filesystem: xfs
 Data file: 
 Metadata file: 
 Data Space Used: 2.122GB
 Data Space Total: 32.3GB
 Data Space Available: 30.17GB
 Metadata Space Used: 561.2kB
 Metadata Space Total: 1.032GB
 Metadata Space Available: 1.031GB
 Thin Pool Minimum Free Space: 3.23GB
 Udev Sync Supported: true
 Deferred Removal Enabled: true
 Deferred Deletion Enabled: true
 Deferred Deleted Device Count: 0
 Library Version: 1.02.140-RHEL7 (2017-05-03)
Logging Driver: none
Cgroup Driver: cgroupfs
Plugins:
 Volume: local
 Network: bridge host macvlan null overlay
 Log: awslogs fluentd gcplogs gelf journald json-file logentries splunk syslog
Swarm: active
 NodeID: noff2ec8sguhl1aoqqjj6p13s
 Is Manager: false
 Node Address: 10.0.2.203
 Manager Addresses:
  10.0.0.187:2377
  10.0.1.101:2377
  10.0.2.124:2377
Runtimes: runc
Default Runtime: runc
Init Binary: docker-init
containerd version: 06b9cb35161009dcb7123345749fef02f7cea8e0
runc version: 3f2f8b84a77f73d38244dd690525642a72156c64
init version: 949e6fa
Security Options:
 seccomp
  Profile: default
Kernel Version: 3.10.0-693.5.2.el7.x86_64
Operating System: CentOS Linux 7 (Core)
OSType: linux
Architecture: x86_64
CPUs: 2
Total Memory: 3.701GiB
Name: node12.docker.nga911.com
ID: PPV2:YPTG:NEHC:KNS3:EOES:YPZ7:JSQR:QZPF:DKDW:CI7P:ALQ2:AOMY
Docker Root Dir: /var/lib/docker
Debug Mode (client): false
Debug Mode (server): false
Registry: https://index.docker.io/v1/
Experimental: false
Insecure Registries:
 127.0.0.0/8
Live Restore Enabled: false
```
Configured swarm from five CentOS7 hosts. Issue reproduced `sporadically` on all host of swarm.

**Comment by sergey-safarov** [comment]
Hello @ddebroy, @thaJeztah 
Now i can reproduce issue on my hosts. Could you reopen issue.
One one swarm host I start ping to other container
```
[root@node13 ~]# docker run -it --rm=true --network kazoo --name busybox1 --ip 10.0.9.40 --hostname busybox1.kazoo --entrypoint=ping busybox 10.0.9.56
PING 10.0.9.56 (10.0.9.56): 56 data bytes
```
Where `10.0.9.56` is IP used before by container where issue is reproduced and now is stoped.
On second host we start new container with IP `10.0.9.56`.
```
[root@node11 ~]# docker run -it --rm=true --network kazoo --name busybox2 --ip 10.0.9.56 --hostname busybox2.kazoo busybox
/ # 
```
As you can see first 3 minutes we not have connectivity between containers.
Now on container `busybox2` I executes command `arping -U -c 3 -I eth0 10.0.9.56` and connectivity is lost again.
Then i executes command `arping -A -c 3 -I eth0 10.0.9.56` and connectivity between containers is returned back.
If i use for test other IP not used before (`not 10.0.9.56`), then all works as expected.
Think issue related to docker process uptime and container total uptime.
On my hosts uptime is 5 weeks
Also i recorded [movie of issue](http://node1.http.rcsnet.ru/docker_issue.mp4)

**Comment by sergey-safarov** [comment]
Think i useful info about issue
Connectivity is lost because bridge inside swarm network have learned wrong port for container MAC.
I started both containers on same docker host. On terminal i executed
```
[root@node11 ~]# docker inspect kazoo | grep Id
        "Id": "jy62ngc5cl7nfozststg67mbf",
[root@node11 ~]# ln -s /var/run/docker/netns/1-jy62ngc5cl /var/run/netns/
[root@node11 ~]#
[root@node11 ~]# docker exec busybox2 ifconfig eth0
eth0      Link encap:Ethernet  HWaddr 02:42:0A:00:09:38  
          inet addr:10.0.9.56  Bcast:0.0.0.0  Mask:255.255.255.192
          UP BROADCAST RUNNING MULTICAST  MTU:1450  Metric:1
          RX packets:461 errors:0 dropped:0 overruns:0 frame:0
          TX packets:542 errors:0 dropped:0 overruns:0 carrier:0
          collisions:0 txqueuelen:0 
          RX bytes:43666 (42.6 KiB)  TX bytes:47068 (45.9 KiB)
[root@node11 ~]# ip netns exec 1-jy62ngc5cl brctl showmacs br0 | grep '02:42:0a:00:09:38'
  1	02:42:0a:00:09:38	no		  29.98
```
As you can you see MAC of container is learned on `vxlan0` port. That is issue.
Then
```
[root@node11 ~]# docker exec busybox2 arping -A -c 3 -I eth0 10.0.9.56
ARPING to 10.0.9.56 from 10.0.9.56 via eth0
Sent 3 probe(s) (3 broadcast(s))
Received 0 reply (0 request(s), 0 broadcast(s))
[root@node11 ~]# ip netns exec 1-jy62ngc5cl brctl showmacs br0 | grep '02:42:0a:00:09:38'
  8	02:42:0a:00:09:38	no		   0.30
[root@node11 ~]# ip netns exec 1-jy62ngc5cl brctl show br0
bridge name	bridge id		STP enabled	interfaces
br0		8000.066a0bf96430	no		veth1135
							veth2061
							veth2064
							veth2110
							veth2113
							veth2114
							veth2176
							veth2182
							veth2245
							veth2333
							veth2334
							veth345
							veth5
							vxlan0
```
As you can see container MAC is learned on port 8.
**Verification**
Inside container i executed `arping -U -I eth0 10.0.9.56` command. And on other terminal.
```
[root@node11 ~]# ip netns exec 1-jy62ngc5cl tcpdump -ni vxlan0 -c 4 --direction=out host 10.0.9.56
tcpdump: verbose output suppressed, use -v or -vv for full protocol decode
listening on vxlan0, link-type EN10MB (Ethernet), capture size 262144 bytes
18:20:31.233561 ARP, Request who-has 10.0.9.56 (Broadcast) tell 10.0.9.56, length 28
18:20:32.233747 ARP, Request who-has 10.0.9.56 (Broadcast) tell 10.0.9.56, length 28
18:20:33.233922 ARP, Request who-has 10.0.9.56 (Broadcast) tell 10.0.9.56, length 28
18:20:34.234256 ARP, Request who-has 10.0.9.56 (Broadcast) tell 10.0.9.56, length 28
4 packets captured
8 packets received by filter
0 packets dropped by kernel
[root@node11 ~]# ip netns exec 1-jy62ngc5cl tcpdump -ni vxlan0 -c 4 --direction=in host 10.0.9.56
tcpdump: verbose output suppressed, use -v or -vv for full protocol decode
listening on vxlan0, link-type EN10MB (Ethernet), capture size 262144 bytes
18:20:42.235856 ARP, Reply 10.0.9.56 is-at 02:42:0a:00:09:38, length 28
18:20:43.236052 ARP, Reply 10.0.9.56 is-at 02:42:0a:00:09:38, length 28
18:20:44.236229 ARP, Reply 10.0.9.56 is-at 02:42:0a:00:09:38, length 28
18:20:45.236421 ARP, Reply 10.0.9.56 is-at 02:42:0a:00:09:38, length 28
4 packets captured
8 packets received by filter
0 packets dropped by kernel
```
As you can see host is receive ARP response from other docker swarm host.
Next i find docker swarm host where is located duplicated MAC.

**Comment by sergey-safarov** [comment]
Think issue with overlay network is same as https://github.com/docker/libnetwork/issues/1952
Now i will upgrade docker to `17.12.0-ce` and will wait when issue reproduced with `docker_gwbridge` or `swarm` bridge.
My current `fdb` table
```
[root@node11 ~]#  ip netns exec 1-jy62ngc5cl bridge fdb show dev vxlan0 
02:42:0a:00:09:0e master br0 
02:42:0a:00:09:04 master br0 
02:42:0a:00:09:32 master br0 
02:42:0a:00:09:35 master br0 
02:42:0a:00:09:07 master br0 
02:42:0a:00:09:0f master br0 
02:42:0a:00:09:23 master br0 
02:42:0a:00:09:20 master br0 
02:42:0a:00:09:1e master br0 
02:42:0a:00:09:06 master br0 
02:42:0a:00:09:27 master br0 
02:42:0a:00:09:05 master br0 
02:42:0a:00:09:15 master br0 
02:42:0a:00:09:36 master br0 
02:42:0a:00:09:21 master br0 
02:42:0a:00:09:0d master br0 
02:42:0a:00:09:09 master br0 
02:42:0a:00:09:33 master br0 
02:42:0a:00:09:19 master br0 
d6:d1:c6:a5:08:a7 master br0 permanent
02:42:0a:00:09:1f master br0 
02:42:0a:00:09:1b master br0 
02:42:0a:00:09:31 master br0 
02:42:0a:00:09:1a master br0 
02:42:0a:00:09:37 master br0 
02:42:0a:00:09:38 master br0 
02:42:0a:00:09:22 master br0 
02:42:0a:00:09:25 master br0 
02:42:0a:00:09:26 master br0 
02:42:0a:00:09:04 dst 10.0.2.203 link-netnsid 0 self permanent
02:42:0a:00:09:05 dst 10.0.1.101 link-netnsid 0 self permanent
02:42:0a:00:09:06 dst 10.0.1.184 link-netnsid 0 self permanent
02:42:0a:00:09:07 dst 10.0.0.187 link-netnsid 0 self permanent
02:42:0a:00:09:09 dst 10.0.2.203 link-netnsid 0 self permanent
02:42:0a:00:09:0a dst 10.0.1.101 link-netnsid 0 self permanent
02:42:0a:00:09:0b dst 10.0.1.184 link-netnsid 0 self permanent
02:42:0a:00:09:0d dst 10.0.2.203 link-netnsid 0 self permanent
02:42:0a:00:09:0e dst 10.0.1.101 link-netnsid 0 self permanent
02:42:0a:00:09:0f dst 10.0.1.184 link-netnsid 0 self permanent
02:42:0a:00:09:11 dst 10.0.2.203 link-netnsid 0 self permanent
02:42:0a:00:09:12 dst 10.0.1.101 link-netnsid 0 self permanent
02:42:0a:00:09:13 dst 10.0.1.184 link-netnsid 0 self permanent
02:42:0a:00:09:15 dst 10.0.2.203 link-netnsid 0 self permanent
02:42:0a:00:09:19 dst 10.0.2.203 link-netnsid 0 self permanent
02:42:0a:00:09:1a dst 10.0.1.101 link-netnsid 0 self permanent
02:42:0a:00:09:1b dst 10.0.1.184 link-netnsid 0 self permanent
02:42:0a:00:09:1d dst 10.0.2.203 link-netnsid 0 self permanent
02:42:0a:00:09:1e dst 10.0.1.101 link-netnsid 0 self permanent
02:42:0a:00:09:1f dst 10.0.1.184 link-netnsid 0 self permanent
02:42:0a:00:09:21 dst 10.0.2.203 link-netnsid 0 self permanent
02:42:0a:00:09:22 dst 10.0.1.101 link-netnsid 0 self permanent
02:42:0a:00:09:23 dst 10.0.1.184 link-netnsid 0 self permanent
02:42:0a:00:09:25 dst 10.0.2.203 link-netnsid 0 self permanent
02:42:0a:00:09:26 dst 10.0.1.101 link-netnsid 0 self permanent
02:42:0a:00:09:27 dst 10.0.1.184 link-netnsid 0 self permanent
02:42:0a:00:09:2c dst 10.0.1.101 link-netnsid 0 self permanent
02:42:0a:00:09:2d dst 10.0.1.184 link-netnsid 0 self permanent
02:42:0a:00:09:31 dst 10.0.2.203 link-netnsid 0 self permanent
02:42:0a:00:09:32 dst 10.0.1.101 link-netnsid 0 self permanent
02:42:0a:00:09:33 dst 10.0.1.184 link-netnsid 0 self permanent
02:42:0a:00:09:35 dst 10.0.2.203 link-netnsid 0 self permanent
02:42:0a:00:09:36 dst 10.0.1.101 link-netnsid 0 self permanent
02:42:0a:00:09:37 dst 10.0.1.184 link-netnsid 0 self permanent
02:42:0a:00:09:39 dst 10.0.2.203 link-netnsid 0 self permanent
02:42:0a:00:09:3a dst 10.0.1.101 link-netnsid 0 self permanent
02:42:0a:00:09:3b dst 10.0.1.184 link-netnsid 0 self permanent
[root@node11 ~]#
```
And output of `brctl`
```
[root@node11 ~]# ip netns exec 1-jy62ngc5cl brctl showmacs br0
port no	mac addr		is local?	ageing timer
  6	02:42:0a:00:09:03	no		   1.13
  1	02:42:0a:00:09:04	no		   0.35
  1	02:42:0a:00:09:05	no		   2.32
  1	02:42:0a:00:09:06	no		   2.17
  1	02:42:0a:00:09:07	no		   0.36
  3	02:42:0a:00:09:08	no		   0.35
  1	02:42:0a:00:09:09	no		   1.13
  2	02:42:0a:00:09:0c	no		   0.75
  1	02:42:0a:00:09:0d	no		   0.59
  1	02:42:0a:00:09:0e	no		   0.71
  1	02:42:0a:00:09:0f	no		   0.75
 11	02:42:0a:00:09:14	no		   0.55
  1	02:42:0a:00:09:15	no		   0.75
  9	02:42:0a:00:09:18	no		   0.75
  1	02:42:0a:00:09:19	no		   0.35
  1	02:42:0a:00:09:1a	no		   0.74
  1	02:42:0a:00:09:1b	no		   0.74
  7	02:42:0a:00:09:1c	no		   0.75
  1	02:42:0a:00:09:1e	no		   1.88
  1	02:42:0a:00:09:1f	no		   1.88
  1	02:42:0a:00:09:20	no		   7.01
  1	02:42:0a:00:09:21	no		  12.16
  1	02:42:0a:00:09:22	no		   5.52
  1	02:42:0a:00:09:23	no		   5.52
 10	02:42:0a:00:09:24	no		   0.02
  1	02:42:0a:00:09:25	no		   0.46
  1	02:42:0a:00:09:26	no		   1.30
  1	02:42:0a:00:09:27	no		   0.04
 14	02:42:0a:00:09:28	no		   0.11
  4	02:42:0a:00:09:30	no		   0.44
  1	02:42:0a:00:09:31	no		   6.39
  1	02:42:0a:00:09:32	no		   6.39
  1	02:42:0a:00:09:33	no		   1.38
  5	02:42:0a:00:09:34	no		   1.38
  1	02:42:0a:00:09:35	no		   0.58
  1	02:42:0a:00:09:36	no		   9.71
  1	02:42:0a:00:09:37	no		   0.44
  1	02:42:0a:00:09:38	no		   0.34
  4	06:6a:0b:f9:64:30	yes		   0.00
  8	32:6c:a4:67:81:a0	yes		   0.00
 11	56:8d:be:7f:fc:f7	yes		   0.00
 14	82:42:a3:5c:b8:b6	yes		   0.00
  9	8a:00:e9:70:02:07	yes		   0.00
  7	8e:b4:65:58:0a:34	yes		   0.00
  3	b6:85:ee:c3:97:ef	yes		   0.00
  6	b6:b1:d1:26:0e:6e	yes		   0.00
 13	c6:4a:3e:f0:f8:c3	yes		   0.00
  1	d6:d1:c6:a5:08:a7	yes		   0.00
 12	d6:e5:a2:77:38:6c	yes		   0.00
  5	e2:21:b6:8a:7e:f0	yes		   0.00
 10	e6:42:c8:04:b3:76	yes		   0.00
  2	ea:d5:32:7d:b3:db	yes		   0.00
```
