### ISSUE TITLE
Docker container stops resolve names

### ISSUE THREAD

**Issue by fireman777** [moby/moby#47414]
### Description

In RHEL 8.9 (Docker (```v25.0.1```), docker compose (```v2.24.2```) creates a container by docker-compose.yml:
version: '3.4'
services:
  <service>:
    image: <image>
    restart: always
    privileged: true
    environment:
      HTTPS_PROXY: "<HTTPS_PROXY>"
    volumes:
      - /var/run/docker.sock:/var/run/docker.sock
      - /home/\<user\>/\<folder\>/config:/etc/\<folder\>

After some time container stops resolving names:
```
docker exec -it <container> nslookup google.com
;; connection timed out; no servers could be reached
```

### Reproduce

1. Docker compose up docker-compose.yml
2. (After some time): docker exec -it <container> nslookup google.com

### Expected behavior

Docker container can resolve names

### docker version

```bash
Client:
 Version:           24.0.5
 API version:       1.43
 Go version:        go1.20.3
 Git commit:        24.0.5-0ubuntu1~22.04.1
 Built:             Mon Aug 21 19:50:14 2023
 OS/Arch:           linux/amd64
 Context:           default

Server:
 Engine:
  Version:          24.0.5
  API version:      1.43 (minimum version 1.12)
  Go version:       go1.20.3
  Git commit:       24.0.5-0ubuntu1~22.04.1
  Built:            Mon Aug 21 19:50:14 2023
  OS/Arch:          linux/amd64
  Experimental:     false
 containerd:
  Version:          1.7.2
  GitCommit:
 runc:
  Version:          1.1.7-0ubuntu1~22.04.2
  GitCommit:
 docker-init:
  Version:          0.19.0
  GitCommit:
```

### docker info

```bash
Client:
```

### Additional Info

Client:

**Comment by akerouanton** [comment]
Hi @fireman777, thanks for reporting. Can you try turning on the daemon debug logs (see https://docs.docker.com/config/daemon/logs/#enable-debugging) and paste the log lines about DNS stuff written around the time resolution starts failing please?

**Comment by fireman777** [comment]
Yes, @thaJeztah, the problem with the network doesn't allow us to resolve names.
I can't ping any host from the container (previously I could do it).

**Comment by akerouanton** [comment]
@fireman777 Can you paste the output of `docker network inspect` for your network please?

**Comment by fireman777** [comment]
Yes, sure (file is attached).
[network_inspect.txt](https://github.com/moby/moby/files/14348314/network_inspect.txt)
Label "com.docker.compose.version": "**1.29.2**" still has a version of a previous version, but I don't think it's critical, since previously (before docker update) the problem was the same. We updated docker/docker compose  to fix this problem, but it didn't help.

**Comment by fireman777** [comment]
I've started docker in debug logging mode and restarted it. As soon as docker will face network connectivity issue, I'll add debug logs.

**Comment by Athanasius** [comment]
I appear to have a similar problem to this.

OS: Debian bookworm - all current updates applied.
Docker version info:
```
Client: Docker Engine - Community
 Version:           27.2.0
 API version:       1.47
 Go version:        go1.21.13
 Git commit:        3ab4256
 Built:             Tue Aug 27 14:15:15 2024
 OS/Arch:           linux/amd64
 Context:           default

Server: Docker Engine - Community
 Engine:
  Version:          27.2.0
  API version:      1.47 (minimum version 1.24)
  Go version:       go1.21.13
  Git commit:       3ab5c7d
  Built:            Tue Aug 27 14:15:15 2024
  OS/Arch:          linux/amd64
  Experimental:     false
 containerd:
  Version:          1.7.21
  GitCommit:        472731909fa34bd7bc9c087e4c27943f9835f111
 runc:
  Version:          1.1.13
  GitCommit:        v1.1.13-0-g58aa920
 docker-init:
  Version:          0.19.0
  GitCommit:        de40ad0
```

1. I'm running Tiny Tiny RSS as per https://git.tt-rss.org/fox/ttrss-docker-compose.git
2. I have only customised `.env` enough to set TTRSS_SELF_URL_PATH, TTRSS_SESSION_COOKIE_LIFETIME, TTRSS_SMTP_FROM_NAME, TTRSS_SMTP_FROM_ADDRESS
3. It's using the docker internal DNS in each container.  The `/etc/resolv.conf` in each of them is:
```
# Generated by Docker Engine.
# This file can be edited; Docker Engine will not make further changes once it
# has been modified.

nameserver 127.0.0.11
search dsl.miggy.org
options ndots:0
trust-ad

# Based on host file: '/etc/resolv.conf' (internal resolver)
# ExtServers: [192.168.1.1]
# Overrides: []
# Option ndots from: internal
```
This works perfectly fine most of the time.  Some time after upgrading from docker-ce `27.1.2-1~debian.12~bookworm` to `27.2.0-1~debian.12~bookworm` I started seeing lines like:
```
2024-09-02T09:16:08.766146+01:00 tuesday dockerd[2980613]: time="2024-09-02T09:16:08.764672123+01:00" level=warning msg="[resolver] connect failed" error="invalid argument"
```
in the log.  Other than the first time this occurred, this starts shortly after midnight (BST, so 23h UTC), implying some daily maintenance task triggers it.

Once it's begun:
```
tt-rss@tuesday:~/sites/ttrss-docker$ docker exec -it ttrss-docker-updater-1 /bin/sh
/ # nslookup rss.slashdot.org
Server:         127.0.0.11
Address:        127.0.0.11:53

** server can't find rss.slashdot.org: SERVFAIL

** server can't find rss.slashdot.org: SERVFAIL

/ # 
```
As per comment above I enabled docker debug yesterday and restarted the docker service to ensure a clean slate:
```
2024-09-02T00:16:11.789218+01:00 tuesday dockerd[2980613]: time="2024-09-02T00:1
6:11.789148514+01:00" level=debug msg="Name To resolve: db."
2024-09-02T00:16:11.789295+01:00 tuesday dockerd[2980613]: time="2024-09-02T00:1
6:11.789200353+01:00" level=debug msg="[resolver] lookup name db. present without IPv6 address"
2024-09-02T00:16:11.789328+01:00 tuesday dockerd[2980613]: time="2024-09-02T00:16:11.789153234+01:00" level=debug msg="Name To resolve: db."
2024-09-02T00:16:11.789365+01:00 tuesday dockerd[2980613]: time="2024-09-02T00:16:11.789282393+01:00" level=debug msg="[resolver] lookup for db.: IP [172.16.1.4]"
2024-09-02T00:16:11.800224+01:00 tuesday dockerd[2980613]: time="2024-09-02T00:16:11.800141814+01:00" level=debug msg="Name To resolve: pypy.org."
2024-09-02T00:16:11.800298+01:00 tuesday dockerd[2980613]: time="2024-09-02T00:16:11.800252000+01:00" level=warning msg="[resolver] connect failed" error="invalid argument"
```
So, the internal names still resolve without issues, but external resolution fails with error `invalid argument`.  Testing in a container shell:
```
tt-rss@tuesday:~/sites/ttrss-docker$ docker exec -it ttrss-docker-updater-1 /bin/sh
/ # nslookup pypy.org
Server:         127.0.0.11
Address:        127.0.0.11:53

** server can't find pypy.org: SERVFAIL

** server can't find pypy.org: SERVFAIL
```
and then in the host itself:
```
tt-rss@tuesday:~/sites/ttrss-docker$ nslookup pypy.org
Server:         192.168.1.1
Address:        192.168.1.1#53

Non-authoritative answer:
Name:   pypy.org
Address: 185.199.110.153
Name:   pypy.org
Address: 185.199.108.153
Name:   pypy.org
Address: 185.199.109.153
Name:   pypy.org
Address: 185.199.111.153
Name:   pypy.org
Address: 2606:50c0:8002::153
Name:   pypy.org
Address: 2606:50c0:8000::153
Name:   pypy.org
Address: 2606:50c0:8001::153
Name:   pypy.org
Address: 2606:50c0:8003::153
```
So, something is causing the relevant dockerd process to be unable to make DNS queries to the local resolver (which is bind9).  I've yet to specifically find what triggers this behaviour so can only test once per day until I decide I need the relevant service and restart the containers. thus testing is somewhat slow.

How/where *should* I be able to trace the attempt to use external DNS?  I've traced through the following:

```
root@tuesday:/run/lock;
09:33:34 1$ docker ps | grep updater
eddc2f0fe1b0   cthulhoo/ttrss-fpm-pgsql-static:latest   "/opt/tt-rss/updater…"   2 days ago     Up 24 hours             9000/tcp                                                                                     ttrss-docker-updater-1
root@tuesday:/run/lock;
09:34:17 1$ docker inspect --format "{{.State.Pid}}" eddc2f0fe1b0
2981571
root@tuesday:/run/lock;
09:34:26 1$ nsenter -n -t 2981571 netstat -anop
Active Internet connections (servers and established)
Proto Recv-Q Send-Q Local Address           Foreign Address         State       PID/Program name     Timer
tcp        0      0 127.0.0.11:34983        0.0.0.0:*               LISTEN      2980613/dockerd      off (0.00/0/0)
tcp        0      0 172.16.1.6:46118        172.16.1.4:5432         TIME_WAIT   -                    timewait (4.40/0/0)
tcp        0      0 172.16.1.6:49318        172.16.1.4:5432         TIME_WAIT   -                    timewait (9.54/0/0)
tcp        0      0 172.16.1.6:54596        172.16.1.4:5432         TIME_WAIT   -                    timewait (9.54/0/0)
tcp        0      0 172.16.1.6:54584        172.16.1.4:5432         TIME_WAIT   -                    timewait (9.54/0/0)
tcp        0      0 172.16.1.6:46148        172.16.1.4:5432         TIME_WAIT   -                    timewait (9.48/0/0)
tcp        0      0 172.16.1.6:54254        172.16.1.4:5432         TIME_WAIT   -                    timewait (0.00/0/0)
tcp        0      0 172.16.1.6:46128        172.16.1.4:5432         TIME_WAIT   -                    timewait (4.40/0/0)
tcp        0      0 172.16.1.6:54268        172.16.1.4:5432         TIME_WAIT   -                    timewait (0.00/0/0)
tcp        0      0 172.16.1.6:46144        172.16.1.4:5432         TIME_WAIT   -                    timewait (9.48/0/0)
udp        0      0 127.0.0.11:36593        0.0.0.0:*                           2980613/dockerd      off (0.00/0/0)
Active UNIX domain sockets (servers and established)
Proto RefCnt Flags       Type       State         I-Node   PID/Program name     Path
unix  2      [ ]         DGRAM                    152585397 2984082/sudo         
root@tuesday:/run/lock;
09:34:33 1$ nsenter -n -t 2981571 iptables -nvL -t nat
Chain PREROUTING (policy ACCEPT 0 packets, 0 bytes)
 pkts bytes target     prot opt in     out     source               destination         

Chain INPUT (policy ACCEPT 0 packets, 0 bytes)
 pkts bytes target     prot opt in     out     source               destination         

Chain OUTPUT (policy ACCEPT 0 packets, 0 bytes)
 pkts bytes target     prot opt in     out     source               destination         
31694 1847K DOCKER_OUTPUT  0    --  *      *       0.0.0.0/0            127.0.0.11          

Chain POSTROUTING (policy ACCEPT 0 packets, 0 bytes)
 pkts bytes target     prot opt in     out     source               destination         
31694 1847K DOCKER_POSTROUTING  0    --  *      *       0.0.0.0/0            127.0.0.11          

Chain DOCKER_OUTPUT (1 references)
 pkts bytes target     prot opt in     out     source               destination         
    0     0 DNAT       6    --  *      *       0.0.0.0/0            127.0.0.11           tcp dpt:53 to:127.0.0.11:34983
31694 1847K DNAT       17   --  *      *       0.0.0.0/0            127.0.0.11           udp dpt:53 to:127.0.0.11:36593

Chain DOCKER_POSTROUTING (1 references)
 pkts bytes target     prot opt in     out     source               destination         
    0     0 SNAT       6    --  *      *       127.0.0.11           0.0.0.0/0            tcp spt:34983 to::53
    0     0 SNAT       17   --  *      *       127.0.0.11           0.0.0.0/0            udp spt:36593 to::53
```
Then dumping as per `nsenter -n -t 2981571 tcpdump -ni lo port 53` and running the in-container query:
```
tcpdump: verbose output suppressed, use -v[v]... for full protocol decode
listening on lo, link-type EN10MB (Ethernet), snapshot length 262144 bytes
09:35:42.595342 IP 127.0.0.11.53 > 127.0.0.1.45731: 18764 ServFail- 0/0/0 (26)
09:35:42.595410 IP 127.0.0.11.53 > 127.0.0.1.45731: 17664 ServFail- 0/0/0 (26)
09:35:42.596318 IP 127.0.0.11.53 > 127.0.0.1.45731: 17664 ServFail- 0/0/0 (26)
09:35:42.596541 IP 127.0.0.11.53 > 127.0.0.1.45731: 18764 ServFail- 0/0/0 (26)
09:35:42.597036 IP 127.0.0.11.53 > 127.0.0.1.45731: 17664 ServFail- 0/0/0 (26)
09:35:42.597380 IP 127.0.0.11.53 > 127.0.0.1.45731: 18764 ServFail- 0/0/0 (26)
```
And `nsenter -n -t 2981571 tcpdump -ni lo port 36593` shows similarly, so the DNAT/SNAT is functioning.  Thus the queries should end up with that PID `2981571`, yes ?  But neither `strace -p 2981571` nor `nsenter -n -t 2981571 strace -p 2981571` showing anything but:
```
09:37:51 1$ strace -p 2981571
strace: Process 2981571 attached
wait4(-1, 
```
I assume there's some other process/thread I'd need to `strace` to see what's happening.  How do I find that ?  The `2980613` from the netstat output is:
```
2980613 ?        Ssl    8:09 /usr/bin/dockerd -H fd:// --containerd=/run/containerd/containerd.sock
```
but `strace`ing it yields only:
```
09:42:04 1$ strace -p 2980613
strace: Process 2980613 attached
futex(0x5613d2dd80c8, FUTEX_WAIT_PRIVATE, 0, NULL
```
So, if I can be educated about what to strace or otherwise inspect I'm keen to track down the cause of this, rather than just implement a nightly restart of the containers to work around it.

**Comment by Athanasius** [comment]
Having now performed *only* `docker compose restart updater` lookups within that container are once more functional:

```
tt-rss@tuesday:~/sites/ttrss-docker$ docker compose restart updater
WARN[0000] /home/users/tt-rss/sites/ttrss-docker/docker-compose.yml: the attribute `version` is obsolete, it will be ignored, please remove it to avoid potential confusion 
[+] Restarting 1/1
 ✔ Container ttrss-docker-updater-1  Started                                                                    10.5s 
tt-rss@tuesday:~/sites/ttrss-docker$ docker exec -it ttrss-docker-updater-1 /bin/sh
/ # nslookup pypy.org
Server:         127.0.0.11
Address:        127.0.0.11:53

Non-authoritative answer:
Name:   pypy.org
Address: 185.199.109.153
Name:   pypy.org
Address: 185.199.110.153
Name:   pypy.org
Address: 185.199.111.153
Name:   pypy.org
Address: 185.199.108.153

Non-authoritative answer:
Name:   pypy.org
Address: 2606:50c0:8002::153
Name:   pypy.org
Address: 2606:50c0:8003::153
Name:   pypy.org
Address: 2606:50c0:8000::153
Name:   pypy.org
Address: 2606:50c0:8001::153

/ # nslookup rss.slashdot.org
Server:         127.0.0.11
Address:        127.0.0.11:53

Non-authoritative answer:
rss.slashdot.org        canonical name = www.slashdot.org
www.slashdot.org        canonical name = www.slashdot.org.cdn.cloudflare.net

Non-authoritative answer:
rss.slashdot.org        canonical name = www.slashdot.org
www.slashdot.org        canonical name = www.slashdot.org.cdn.cloudflare.net
Name:   www.slashdot.org.cdn.cloudflare.net
Address: 104.18.36.64
Name:   www.slashdot.org.cdn.cloudflare.net
Address: 172.64.151.192

/ # 
```

**Comment by Athanasius** [comment]
However the actual app is still having issues, probably because I'll need to restart the `web-nginx` container as well, due to how I'm testing that functionality (debugging the feed with the ttrss web UI).  Ah, no, it took restarting the `app` container for that to work.

So, I won't be able to examine the state of anything affected until the problem reoccurs, which will likely be overnight.

**Comment by Athanasius** [comment]
I'm also running bitwarden under docker, and it looks like its containers are also affected.  It uses a different base image/container setup though, so no `nslookup` to test with.  I'm having to use `curl` instead, and it also is currently seeing name resolution issues.  As the bitwarden containers don't have as much need for external DNS lookups I can leave them in this state for further investigation.

**Comment by robmry** [comment]
Hi @Athanasius - thank you for reporting this, and all the detailed info.

Logs from the original issue showed `i/o timeout` rather than the `invalid argument` you're getting. Because of that, and because the problems started for you with upgrade from 27.1.2 to 27.2.0, I'd guess the two are unrelated (only sharing the symptom that DNS lookups fail). So, we should probably shift this discussion to a separate issue - could you raise one?

I can't think of any related changes in 27.2.0, so don't have any ideas for more targeted debugging ...

The resolver that's hitting the error is in `dockerd` itself, so strace-ing it was worth a try - I think you just need to add `-f` / `--follow-forks`. Maybe that will point us at what's returning `invalid argument`.

The resolver forwards the DNS request from the container's network namespace (in 27.2.0, that'll change in the next release)... so, it might be interesting to try an nslookup to your host's resolver from a broken container's netns - either by replacing the `127.0.0.11` in its `/etc/resolv.conf` with your `192.168.1.1`, or something like `nsenter -n -t 2981571 nslookup pypy.org`.

**Comment by thaJeztah** [comment]
closing because this went stale
