### ISSUE TITLE
Swarm Network Encryption stopped Working after Upgrade

### ISSUE THREAD

**Issue by RAKedz** [moby/moby#34857]
**Description**

Upgraded from 17.03.2-ce to 17.06.2-ce.  Before I did the upgrade I bled off the services and removed them.  Upgrade went fine without  issues.  I have a swarm with 3 managers on 5 hosts running on Ubuntu 16.04.  The swarm ran on an encrypted network.  It was working like a charm for a long time.  Decided to upgrade to the latest.  Placed all the services back and noticed I was getting connection issues.  I suspected perhaps the upgrade did something to the swarm network.

**Steps to reproduce the issue:**
1.  I decided to re-create the encrypted network.  Still broken.
2. I decided to re-create the ingress network.  Still broken.
3. I decided to create a couple of testing services like two nginx and curl back and forth while using the `tcpdump -i eth1 esp`.  They couldn't communicate with each other.
4.  Then I created a new network that was not encrypted and added two testing nginx services on them and curl back and forth and they communicated without issues.

**Describe the results you received:**
No communication was showing when using `tcpdump -i eth1 esp` when doing a curl command within a nginx container to another nginx container.  I did this before when I first worked with an encrypted network for testing.

**Describe the results you expected:**
Communication on esp from the nginx containers when executing curl.

**Additional information you deem important (e.g. issue happens only occasionally):**
Not sure if there was anything I was supposed to do that I missed during the upgrade.  I upgraded all the hosts and they all have the same version of docker.  

**Output of `docker version`:**
```
Client:
 Version:      17.06.2-ce
 API version:  1.30
 Go version:   go1.8.3
 Git commit:   cec0b72
 Built:        Tue Sep  5 20:00:17 2017
 OS/Arch:      linux/amd64

Server:
 Version:      17.06.2-ce
 API version:  1.30 (minimum version 1.12)
 Go version:   go1.8.3
 Git commit:   cec0b72
 Built:        Tue Sep  5 19:59:11 2017
 OS/Arch:      linux/amd64
 Experimental: false
```

**Output of `docker info`:**
```
Containers: 2
 Running: 2
 Paused: 0
 Stopped: 0
Images: 1
Server Version: 17.06.2-ce
Storage Driver: overlay2
 Backing Filesystem: extfs
 Supports d_type: true
 Native Overlay Diff: true
Logging Driver: json-file
Cgroup Driver: cgroupfs
Plugins: 
 Volume: local
 Network: bridge host macvlan null overlay
 Log: awslogs fluentd gcplogs gelf journald json-file logentries splunk syslog
Swarm: active
 NodeID: hutwkmsywqc6ahgbkibtk5bpp
 Is Manager: true
 ClusterID: ikw17v5mr6pjoudqqji9uwha3
 Managers: 3
 Nodes: 5
 Orchestration:
  Task History Retention Limit: 5
 Raft:
  Snapshot Interval: 10000
  Number of Old Snapshots to Retain: 0
  Heartbeat Tick: 1
  Election Tick: 3
 Dispatcher:
  Heartbeat Period: 5 seconds
 CA Configuration:
  Expiry Duration: 3 months
  Force Rotate: 0
 Root Rotation In Progress: false
 Node Address: 10.132.89.61
 Manager Addresses:
  10.132.15.105:2377
  10.132.89.61:2377
  10.132.89.69:2377
Runtimes: runc
Default Runtime: runc
Init Binary: docker-init
containerd version: 6e23458c129b551d5c9871e5174f6b1b7f6d1170
runc version: 810190ceaa507aa2727d7ae6f4790c76ec150bd2
init version: 949e6fa
Security Options:
 apparmor
 seccomp
  Profile: default
Kernel Version: 4.4.0-62-generic
Operating System: Ubuntu 16.04.3 LTS
OSType: linux
Architecture: x86_64
CPUs: 2
Total Memory: 3.859GiB
Name: app03
ID: B7OH:HGZ3:RT5Q:GMGV:I66P:GUCA:C55X:4UZT:U7IU:B6WV:GJL5:HHZS
Docker Root Dir: /var/lib/docker
Debug Mode (client): false
Debug Mode (server): false
Registry: https://index.docker.io/v1/
Experimental: false
Insecure Registries:
 127.0.0.0/8
Live Restore Enabled: false

**Additional environment details (AWS, VirtualBox, physical, etc.):**

Digital Ocean

`docker network inspect ingress
[
    {
        "Name": "ingress",
        "Id": "j2hem6jxnl4ngugms75qh8ldc",
        "Created": "2017-09-14T16:34:18.283484569-05:00",
        "Scope": "swarm",
        "Driver": "overlay",
        "EnableIPv6": false,
        "IPAM": {
            "Driver": "default",
            "Options": null,
            "Config": [
                {
                    "Subnet": "10.0.0.0/24",
                    "Gateway": "10.0.0.1"
                }
            ]
        },
        "Internal": false,
        "Attachable": false,
        "Ingress": true,
        "ConfigFrom": {
            "Network": ""
        },
        "ConfigOnly": false,
        "Containers": {
            "ingress-sbox": {
                "Name": "ingress-endpoint",
                "EndpointID": "073d3b349a3ef6d90d2e490ac271871e3581cdeda65f0c087eba4dae36afaf04",
                "MacAddress": "02:42:0a:00:00:03",
                "IPv4Address": "10.0.0.3/24",
                "IPv6Address": ""
            }
        },
        "Options": {
            "com.docker.network.driver.overlay.vxlanid_list": "4096"
        },
        "Labels": {},
        "Peers": [
            {
                "Name": "app03-108cda1c4c38",
                "IP": "10.132.89.61"
            },
            {
                "Name": "app01-6c87632f7fb6",
                "IP": "10.132.66.195"
            },
            {
                "Name": "app06-dffe271c60a6",
                "IP": "10.132.15.105"
            },
            {
                "Name": "app04-3c5d7410db80",
                "IP": "10.132.89.69"
            },
            {
                "Name": "app05-a46374cb3c2b",
                "IP": "10.132.89.96"
            }
        ]
    }
]`

Encrypted:
`
docker network inspect saturn
[
    {
        "Name": "saturn",
        "Id": "2ut8wt5jgf2p8nr9z3fm3e4fp",
        "Created": "2017-09-14T16:35:56.010383443-05:00",
        "Scope": "swarm",
        "Driver": "overlay",
        "EnableIPv6": false,
        "IPAM": {
            "Driver": "default",
            "Options": null,
            "Config": [
                {
                    "Subnet": "10.0.1.0/24",
                    "Gateway": "10.0.1.1"
                }
            ]
        },
        "Internal": false,
        "Attachable": false,
        "Ingress": false,
        "ConfigFrom": {
            "Network": ""
        },
        "ConfigOnly": false,
        "Containers": {
            "c18c558a922726290b9190cbcc5ad4139d86e7c464e9d932a0a8e98da43dea7f": {
                "Name": "a.1.11v7elqlixl67a75gqgwhrsdh",
                "EndpointID": "2b948022ead71e6d5d64e703294516cb02f166b87ccc7e797884a3b2979097eb",
                "MacAddress": "02:42:0a:00:01:03",
                "IPv4Address": "10.0.1.3/24",
                "IPv6Address": ""
            }
        },
        "Options": {
            "com.docker.network.driver.overlay.vxlanid_list": "4097",
            "encrypted": ""
        },
        "Labels": {},
        "Peers": [
            {
                "Name": "app03-108cda1c4c38",
                "IP": "10.132.89.61"
            },
            {
                "Name": "app06-dffe271c60a6",
                "IP": "10.132.15.105"
            }
        ]
    }
]`

Not encrypted:

`docker network inspect juno
[
    {
        "Name": "juno",
        "Id": "bggkna8bukocg5m28zojlsehq",
        "Created": "2017-09-14T16:55:04.530226272-05:00",
        "Scope": "swarm",
        "Driver": "overlay",
        "EnableIPv6": false,
        "IPAM": {
            "Driver": "default",
            "Options": null,
            "Config": [
                {
                    "Subnet": "10.0.2.0/24",
                    "Gateway": "10.0.2.1"
                }
            ]
        },
        "Internal": false,
        "Attachable": false,
        "Ingress": false,
        "ConfigFrom": {
            "Network": ""
        },
        "ConfigOnly": false,
        "Containers": {
            "b0a67cdde417cb231864eff9b3af503abbfeee7fd56a0a5f21f9012d7eedbc5a": {
                "Name": "aa.1.fpjwd1vppn7xoyabr7bqvzanu",
                "EndpointID": "0643eb2dcbe9391a0410b004c1cb460d8af7c97abd27c0c131660e25287f47f6",
                "MacAddress": "02:42:0a:00:02:03",
                "IPv4Address": "10.0.2.3/24",
                "IPv6Address": ""
            }
        },
        "Options": {
            "com.docker.network.driver.overlay.vxlanid_list": "4098"
        },
        "Labels": {},
        "Peers": [
            {
                "Name": "app03-108cda1c4c38",
                "IP": "10.132.89.61"
            },
            {
                "Name": "app06-dffe271c60a6",
                "IP": "10.132.15.105"
            }
        ]
    }
]
`
Example test services:

`docker service create --network juno --name aa --constraint node.hostname==app03 nginx`
`docker service create --network juno --name bb --constraint node.hostname==app06 nginx`

Thanks

**Comment by RAKedz** [comment]
There is some latency before the encrypted network starts working.  After wrestling with it for about an hour I decided to walk away and go home.  The services I tested with were still running.  Today and in fact about 10 mins ago I decided to test the curl command in nginx that is using the encrypted network.  I got a response and the tcpdump showed it too.

`tcpdump -i eth1 esp
tcpdump: verbose output suppressed, use -v or -vv for full protocol decode
listening on eth1, link-type EN10MB (Ethernet), capture size 262144 bytes
14:49:12.247175 IP app03.nyc3.apizue.com > app06.nyc3.apizue.com: ESP(spi=0xfb6da25e,seq=0x16), length 116
14:49:12.248431 IP app06.nyc3.apizue.com > app03.nyc3.apizue.com: ESP(spi=0x059bc6e2,seq=0x10), length 116
14:49:12.249239 IP app03.nyc3.apizue.com > app06.nyc3.apizue.com: ESP(spi=0xfb6da25e,seq=0x17), length 108
14:49:12.249307 IP app03.nyc3.apizue.com > app06.nyc3.apizue.com: ESP(spi=0xfb6da25e,seq=0x18), length 176
14:49:12.249544 IP app06.nyc3.apizue.com > app03.nyc3.apizue.com: ESP(spi=0x059bc6e2,seq=0x11), length 108
14:49:12.250409 IP app06.nyc3.apizue.com > app03.nyc3.apizue.com: ESP(spi=0x059bc6e2,seq=0x12), length 348
14:49:12.250773 IP app06.nyc3.apizue.com > app03.nyc3.apizue.com: ESP(spi=0x059bc6e2,seq=0x13), length 720
14:49:12.251073 IP app03.nyc3.apizue.com > app06.nyc3.apizue.com: ESP(spi=0xfb6da25e,seq=0x1a), length 108
14:49:12.251166 IP app03.nyc3.apizue.com > app06.nyc3.apizue.com: ESP(spi=0xfb6da25e,seq=0x1b), length 108
14:49:12.251762 IP app06.nyc3.apizue.com > app03.nyc3.apizue.com: ESP(spi=0x059bc6e2,seq=0x14), length 108
14:49:12.252889 IP app03.nyc3.apizue.com > app06.nyc3.apizue.com: ESP(spi=0xfb6da25e,seq=0x1c), length 108
`
Then I put my services back and now they are all working.
I really thought I had to start doing some major hashing with my swarm and now I don't have to.
Not sure why it didn't start working as soon as the services we placed on the encrypted network.
