### ISSUE TITLE
docker overlay network fails to update neigh info

### ISSUE THREAD

**Issue by int32bit** [moby/moby#39607]
**Description**

Create two container on different host with the same overlay network but they can't ping each other.

**Steps to reproduce the issue:**

1. Create a overlay network:

```
docker network create -d overlay --subnet 192.168.100.0/24 overlay
```

2. Run containers in three host:

**host 1:**

```sh
docker run -d --name busybox-1 --net overlay busybox sleep 3600
```

**host 2:**

```sh
docker run -d --name busybox-2 --net overlay busybox sleep 3600
```

3. Let's ping each other:

**host 1:**

```
docker exec busybox-1 ip -o addr show
1: lo    inet 127.0.0.1/8 scope host lo\       valid_lft forever preferred_lft forever
335: eth0    inet 192.168.100.2/24 brd 192.168.100.255 scope global eth0\       valid_lft forever preferred_lft forever
337: eth1    inet 172.18.0.2/16 brd 172.18.255.255 scope global eth1\       valid_lft forever preferred_lft forever
```

**host 2:**

```
# docker exec busybox-2 ping -c 2 -w 2 192.168.100.2
PING 192.168.100.2 (192.168.100.2): 56 data bytes

--- 192.168.100.2 ping statistics ---
2 packets transmitted, 0 packets received, 100% packet loss
```

tcpdump on host 2:

```
# nsenter --net=/var/run/docker/netns/2-a4a048ac67 tcpdump -nv -i vxlan0
tcpdump: listening on vxlan0, link-type EN10MB (Ethernet), capture size 262144 bytes
11:07:57.481516 ARP, Ethernet (len 6), IPv4 (len 4), Request who-has 192.168.100.2 tell 192.168.100.3, length 28
11:07:57.973786 ARP, Ethernet (len 6), IPv4 (len 4), Request who-has 192.168.100.4 tell 192.168.100.3, length 28
11:07:58.505561 ARP, Ethernet (len 6), IPv4 (len 4), Request who-has 192.168.100.2 tell 192.168.100.3, length 28
11:07:58.985619 ARP, Ethernet (len 6), IPv4 (len 4), Request who-has 192.168.100.4 tell 192.168.100.3, length 28
11:07:59.529564 ARP, Ethernet (len 6), IPv4 (len 4), Request who-has 192.168.100.2 tell 192.168.100.3, length 28
11:08:00.009593 ARP, Ethernet (len 6), IPv4 (len 4), Request who-has 192.168.100.4 tell 192.168.100.3, length 28
^C
6 packets captured
6 packets received by filter
0 packets dropped by kernel
```

The dump result shows that nobody answers the arp request.

I checked the neigh and fdb as follows:

```
# nsenter --net=/var/run/docker/netns/2-a4a048ac67 ip neigh
192.168.100.3 dev br0 lladdr 02:42:c0:a8:64:03 REACHABLE
# nsenter --net=/var/run/docker/netns/2-a4a048ac67 bridge fdb
33:33:00:00:00:01 dev br0 self permanent
01:00:5e:00:00:01 dev br0 self permanent
f6:e7:61:fa:6b:71 dev vxlan0 master br0 permanent
02:42:c0:a8:64:03 dev veth0 master br0
2e:5c:07:7e:61:5b dev veth0 master br0 permanent
33:33:00:00:00:01 dev veth0 self permanent
01:00:5e:00:00:01 dev veth0 self permanent
```

The result shows that no any l2/l3 info about container 1 in overlay network namespace forward table.

I checked the etcd and all the endpoints were ok:

```
# etcdctl ls /docker/network/v1.0/endpoint/a4a048ac67f4a0035ccdf64c21fa8ee4d08ddf8e5231ae4eef82f1ecc48cbad9
/docker/network/v1.0/endpoint/a4a048ac67f4a0035ccdf64c21fa8ee4d08ddf8e5231ae4eef82f1ecc48cbad9/d39d0bd9a29ec0e584a6708ec90b483e1e76ca452bfaaa871729c6bef4426105
/docker/network/v1.0/endpoint/a4a048ac67f4a0035ccdf64c21fa8ee4d08ddf8e5231ae4eef82f1ecc48cbad9/28621ffd4c4e3ed9c9df8af4617076e66553b5df9a783cff7d38c11ef0151d3a
/docker/network/v1.0/endpoint/a4a048ac67f4a0035ccdf64c21fa8ee4d08ddf8e5231ae4eef82f1ecc48cbad9/7ce94a488c88689cac26d0497e80a9669ecdc8f0d6c48b1726b2ebddd9620623

# etcdctl get /docker/network/v1.0/endpoint/a4a048ac67f4a0035ccdf64c21fa8ee4d08ddf8e5231ae4eef82f1ecc48cbad9/d39d0bd9a29ec0e584a6708ec90b483e1e76ca452bfaaa871729c6bef4426105 | python -m json.tool
{
    "anonymous": false,
    "disableResolution": false,
    "ep_iface": {
        "addr": "192.168.100.2/24",
        "dstPrefix": "eth",
        "mac": "02:42:c0:a8:64:02",
        "routes": null,
        "srcName": "vethed97975",
        "v4PoolID": "GlobalDefault/192.168.100.0/24",
        "v6PoolID": ""
    },
    "exposed_ports": [],
    "generic": {
        "com.docker.network.endpoint.exposedports": [],
        "com.docker.network.portmap": []
    },
    "id": "d39d0bd9a29ec0e584a6708ec90b483e1e76ca452bfaaa871729c6bef4426105",
    "ingressPorts": null,
    "joinInfo": {
        "StaticRoutes": null,
        "disableGatewayService": false
    },
    "loadBalancer": false,
    "locator": "",
    "myAliases": [
        "50915a21fb67"
    ],
    "name": "busybox-1",
    "sandbox": "84af8faf06a148048c9a89372ebae4a8b79c2c5cff8b85a3c44b741a6a03ccfb",
    "svcAliases": null,
    "svcID": "",
    "svcName": "",
    "virtualIP": "<nil>"
}
```

I guess dockerd lost the serf/gossip event, so didn't update namespace neigh/fdb table.

I tried add manually:

```sh
# host 1
nsenter --net=/var/run/docker/netns/1-a4a048ac67 ip neighbor add 192.168.100.3 lladdr 02:42:c0:a8:64:03 dev vxlan0
nsenter --net=/var/run/docker/netns/1-a4a048ac67 bridge fdb add 02:42:c0:a8:64:03 dev vxlan0 self dst 192.168.1.254 vni 256 port 4789

# host 2
nsenter --net=/var/run/docker/netns/2-a4a048ac67 ip neighbor add 192.168.100.2 lladdr 02:42:c0:a8:64:02 dev vxlan0
nsenter --net=/var/run/docker/netns/2-a4a048ac67 bridge fdb add 02:42:c0:a8:64:02 dev vxlan0 self dst 192.168.1.68 vni 256
port 4789
```

As result, It seems OK:

```
# docker exec busybox-2 ping   192.168.100.2
PING 192.168.100.2 (192.168.100.2): 56 data bytes
64 bytes from 192.168.100.2: seq=0 ttl=64 time=0.349 ms
64 bytes from 192.168.100.2: seq=1 ttl=64 time=0.395 ms
64 bytes from 192.168.100.2: seq=2 ttl=64 time=0.440 ms
64 bytes from 192.168.100.2: seq=3 ttl=64 time=0.433 ms
```

**Describe the results you received:**

Three containers can't ping each other.

**Describe the results you expected:**

Three containers should ping ok to each other.

**Additional information you deem important (e.g. issue happens only occasionally):**

**Output of `docker version`:**

```
# docker version
Client:
 Version:           18.09.7
 API version:       1.39
 Go version:        go1.10.8
 Git commit:        2d0083d
 Built:             Thu Jun 27 17:56:23 2019
 OS/Arch:           linux/amd64
 Experimental:      false

Server: Docker Engine - Community
 Engine:
  Version:          18.09.7
  API version:      1.39 (minimum version 1.12)
  Go version:       go1.10.8
  Git commit:       2d0083d
  Built:            Thu Jun 27 17:23:02 2019
  OS/Arch:          linux/amd64
  Experimental:     false
```

**Output of `docker info`:**

```
# docker info
Containers: 1
 Running: 1
 Paused: 0
 Stopped: 0
Images: 8
Server Version: 18.09.7
Storage Driver: overlay2
 Backing Filesystem: extfs
 Supports d_type: true
 Native Overlay Diff: true
Logging Driver: json-file
Cgroup Driver: cgroupfs
Plugins:
 Volume: local
 Network: bridge host macvlan null overlay
 Log: awslogs fluentd gcplogs gelf journald json-file local logentries splunk syslog
Swarm: inactive
Runtimes: runc
Default Runtime: runc
Init Binary: docker-init
containerd version: 894b81a4b802e4eb2a91d1ce216b8817763c29fb
runc version: 425e105d5a03fabd737a126ad93d62a9eeede87f
init version: fec3683
Security Options:
 apparmor
 seccomp
  Profile: default
Kernel Version: 4.15.0-1043-aws
Operating System: Ubuntu 18.04.2 LTS
OSType: linux
Architecture: x86_64
CPUs: 2
Total Memory: 3.851GiB
Name: int32bit-docker-2
ID: MSJG:VBRM:3KFP:TIZK:XFPB:GRNS:4OGN:GOZB:OWGZ:LAP3:YXJE:JHNN
Docker Root Dir: /var/lib/docker
Debug Mode (client): false
Debug Mode (server): false
Registry: https://index.docker.io/v1/
Labels:
Experimental: false
Cluster Store: etcd://192.168.1.68:2379
Insecure Registries:
 127.0.0.0/8
Live Restore Enabled: false
Product License: Community Engine

WARNING: No swap limit support
```

**Additional environment details (AWS, VirtualBox, physical, etc.):**

* AWS EC2

```sh
# uname -a
Linux int32bit-docker-2 4.15.0-1043-aws #45-Ubuntu SMP Mon Jun 24 14:07:03 UTC 2019 x86_64 x86_64 x86_64 GNU/Linux
# lsb_release  -a
No LSB modules are available.
Distributor ID: Ubuntu
Description:    Ubuntu 18.04.2 LTS
Release:        18.04
Codename:       bionic
```

**Comment by int32bit** [comment]
I observed  that the `locator` in endpoint is empty, so I guess the dockerd couldn't get node info of container.

**Comment by int32bit** [comment]
I manually updated endpoint object and filled in the `locator` value with container node ip, but it still  didn't work.

```sh
etcdctl --endpoints http://192.168.1.68:2379,http://192.168.1.254:2379,http://192.168.1.245:2379  set /docker/network/v1.0/endpoint/a4a048ac67f4a0035ccdf64c21fa8ee4d08ddf8e5231ae4eef82f1ecc48cbad9/9d759506fc2c47ac525a797b28ef4a31cc6d62543e1e72241e5baedfe72314fa '{"anonymous":false,"disableResolution":false,"ep_iface":{"addr":"192.168.100.3/24","dstPrefix":"eth","mac":"02:42:c0:a8:64:03","routes":null,"srcName":"vethb3112ed","v4PoolID":"GlobalDefault/192.168.100.0/24","v6PoolID":""},"exposed_ports":[],"generic":{"com.docker.network.endpoint.exposedports":[],"com.docker.network.portmap":[]},"id":"9d759506fc2c47ac525a797b28ef4a31cc6d62543e1e72241e5baedfe72314fa","ingressPorts":null,"joinInfo":{"StaticRoutes":null,"disableGatewayService":false},"loadBalancer":false,"locator":"192.168.1.254","myAliases":["0bc911cac0e0"],"name":"busybox","sandbox":"b978e6cebb306f0c99412ecc4ca1ea3e915a5e1f9742be8717f705bc73713d36","svcAliases":null,"svcID":"","svcName":"","virtualIP":"\u003cnil\u003e"}'

etcdctl --endpoints http://192.168.1.68:2379,http://192.168.1.254:2379,http://192.168.1.245:2379  set /docker/network/v1.0/endpoint/a4a048ac67f4a0035ccdf64c21fa8ee4d08ddf8e5231ae4eef82f1ecc48cbad9/afa375d3f005929a0858a43abc41c88b14bbe94da0f0c7d2fc62ba66ee7f7154 '{"anonymous":false,"disableResolution":false,"ep_iface":{"addr":"192.168.100.4/24","dstPrefix":"eth","mac":"02:42:c0:a8:64:04","routes":null,"srcName":"veth0c9d752","v4PoolID":"GlobalDefault/192.168.100.0/24","v6PoolID":""},"exposed_ports":[],"generic":{"com.docker.network.endpoint.exposedports":[],"com.docker.network.portmap":[]},"id":"afa375d3f005929a0858a43abc41c88b14bbe94da0f0c7d2fc62ba66ee7f7154","ingressPorts":null,"joinInfo":{"StaticRoutes":null,"disableGatewayService":false},"loadBalancer":false,"locator":"192.168.1.245","myAliases":["abcec0705839"],"name":"busybox","sandbox":"7f82ee1ac223e35324be96bb02d65acae0b4d69e6e00660db28eb2a6f287f613","svcAliases":null,"svcID":"","svcName":"","virtualIP":"\u003cnil\u003e"}'

etcdctl --endpoints http://192.168.1.68:2379,http://192.168.1.254:2379,http://192.168.1.245:2379  set /docker/network/v1.0/endpoint/a4a048ac67f4a0035ccdf64c21fa8ee4d08ddf8e5231ae4eef82f1ecc48cbad9/0d8a939b8b270f4de3449471bfbfda31f69133f423d5c3dfb99e17dfb420772a '{"anonymous":false,"disableResolution":false,"ep_iface":{"addr":"192.168.100.2/24","dstPrefix":"eth","mac":"02:42:c0:a8:64:02","routes":null,"srcName":"veth3b26768","v4PoolID":"GlobalDefault/192.168.100.0/24","v6PoolID":""},"exposed_ports":[],"generic":{"com.docker.network.endpoint.exposedports":[],"com.docker.network.portmap":[]},"id":"0d8a939b8b270f4de3449471bfbfda31f69133f423d5c3dfb99e17dfb420772a","ingressPorts":null,"joinInfo":{"StaticRoutes":null,"disableGatewayService":false},"loadBalancer":false,"locator":"192.168.1.68","myAliases":["9818a72d6f6d"],"name":"busybox","sandbox":"abe31dbbc39411f4d4e29acb01d934dcf2bb4a819ce70c5c0f0e976aebd0f9ab","svcAliases":null,"svcID":"","svcName":"","virtualIP":"\u003cnil\u003e"}'
```
