### ISSUE TITLE
container traffic dropped randomly after repeated cycles of creating and removing

### ISSUE THREAD

**Issue by brainchild0** [moby/moby#43113]
# Description

I have been struggling with an elusive issue for almost two weeks.

The symptoms appear identical to those reported in moby/moby#27808, but while this previous issue was reported resolved in systemd/systemd#4228, my observations occur on systems with releases of systemd downstream to this revision.

The problem is also very similar to moby/moby#26492, but unlike in this previous issue, in which interfaces are reported as not assigned to a bridge, I observe   assignment is made, but simply ineffective. Traffic originating from within a container never reaches the other. 

The effect is intermittent. Over successive iterations of preparing a bridged container system, of the same Compose definition and internal structure and processes,  failure rate may be less than 1% or more than 25%.

The problem originally manifested running repeated unit testing operations. Each unit test composed two containers linked by a bridge, prepared by a Compose file. The relation between the containers and the bridge was always given by the same Compose file, and the processes executed inside the containers always followed the same deterministic routine, over successive iterations. These observations indicate   the failures are resulting from a race condition outside of the container definitions, such as in Docker, the kernel, or elsewhere on the system.

 In most cases, prepared containers and bridges behaved correctly. Requests originating in one container were received by the other. In some cases, however, the containers were prepared in a state such all or some traffic originating in either was dropped. 

Subnet conflicts were originally suspected, but the daemon was configured to operate only in a reserved subnet, without resolving the problem.

# Docker Info

The address pool was chosen to avoid conflicts with other interfaces.

```
$ docker info
Client:
 Context:    default
 Debug Mode: false

Server:
 Containers: 14
  Running: 2
  Paused: 0
  Stopped: 12
 Images: 41
 Server Version: 20.10.7
 Storage Driver: btrfs
  Build Version: Btrfs v5.4.1 
  Library Version: 102
 Logging Driver: json-file
 Cgroup Driver: cgroupfs
 Cgroup Version: 1
 Plugins:
  Volume: local
  Network: bridge host ipvlan macvlan null overlay
  Log: awslogs fluentd gcplogs gelf journald json-file local logentries splunk syslog
 Swarm: inactive
 Runtimes: io.containerd.runc.v2 io.containerd.runtime.v1.linux runc
 Default Runtime: runc
 Init Binary: docker-init
 containerd version: 
 runc version: 
 init version: 
 Security Options:
  apparmor
  seccomp
   Profile: default
 Kernel Version: 5.13.0-22-generic
 Operating System: Linux Mint 20.3
 OSType: linux
 Architecture: x86_64
 CPUs: 8
 Total Memory: 31.11GiB
 Name: myhostname
 ID: WLBH:MHQN:VIUW:FS4E:QJFB:ZEJ5:C6QI:LWGR:3JEG:S7Y2:R6WY:VSWT
 Docker Root Dir: /var/lib/docker
 Debug Mode: false
 Registry: https://index.docker.io/v1/
 Labels:
 Experimental: false
 Insecure Registries:
  127.0.0.0/8
 Live Restore Enabled: false
 Default Address Pools:
   Base: 172.31.0.0/16, Size: 24
```

# Network Info

The final three interfaces are a bridge and two virtual interfaces for two containers, created by Docker Compose.

```
$ ip addr show
1: lo: <LOOPBACK,UP,LOWER_UP> mtu 65536 qdisc noqueue state UNKNOWN group default qlen 1000
    link/loopback 00:00:00:00:00:00 brd 00:00:00:00:00:00
    inet 127.0.0.1/8 scope host lo
       valid_lft forever preferred_lft forever
    inet6 ::1/128 scope host 
       valid_lft forever preferred_lft forever
2: wlo1: <BROADCAST,MULTICAST,UP,LOWER_UP> mtu 1500 qdisc mq state UP group default qlen 1000
    link/ether d8:12:65:68:d1:d1 brd ff:ff:ff:ff:ff:ff
    altname wlp1s0
    inet 10.4.2.11/16 brd 10.4.255.255 scope global dynamic noprefixroute wlo1
       valid_lft 85475sec preferred_lft 85475sec
    inet6 fe80::be7b:692c:b6fc:4018/64 scope link noprefixroute 
       valid_lft forever preferred_lft forever
4: vboxnet0: <BROADCAST,MULTICAST,UP,LOWER_UP> mtu 1500 qdisc fq_codel state UP group default qlen 1000
    link/ether 0a:00:27:00:00:00 brd ff:ff:ff:ff:ff:ff
    inet 192.168.56.1/24 brd 192.168.56.255 scope global vboxnet0
       valid_lft forever preferred_lft forever
    inet6 fe80::800:27ff:fe00:0/64 scope link 
       valid_lft forever preferred_lft forever
29: docker0: <NO-CARRIER,BROADCAST,MULTICAST,UP> mtu 1500 qdisc noqueue state DOWN group default 
    link/ether 02:42:56:1d:5d:24 brd ff:ff:ff:ff:ff:ff
    inet 172.31.0.1/24 brd 172.31.0.255 scope global docker0
       valid_lft forever preferred_lft forever
    inet6 fe80::42:56ff:fe1d:5d24/64 scope link 
       valid_lft forever preferred_lft forever
72: br-a70432a10062: <BROADCAST,MULTICAST,UP,LOWER_UP> mtu 1500 qdisc noqueue state UP group default 
    link/ether 02:42:d6:b2:3e:3e brd ff:ff:ff:ff:ff:ff
    inet 172.31.7.1/24 brd 172.31.7.255 scope global br-a70432a10062
       valid_lft forever preferred_lft forever
    inet6 fe80::42:d6ff:feb2:3e3e/64 scope link 
       valid_lft forever preferred_lft forever
74: vethdc4fb82@if73: <BROADCAST,MULTICAST,UP,LOWER_UP> mtu 1500 qdisc noqueue master br-a70432a10062 state UP group default 
    link/ether f6:ef:29:6c:a1:d3 brd ff:ff:ff:ff:ff:ff link-netnsid 1
    inet6 fe80::f4ef:29ff:fe6c:a1d3/64 scope link 
       valid_lft forever preferred_lft forever
76: vethc656682@if75: <BROADCAST,MULTICAST,UP,LOWER_UP> mtu 1500 qdisc noqueue master br-a70432a10062 state UP group default 
    link/ether fa:ee:9a:8c:68:3a brd ff:ff:ff:ff:ff:ff link-netnsid 2
    inet6 fe80::f8ee:9aff:fe8c:683a/64 scope link 
       valid_lft forever preferred_lft forever
```

# Traffic Tests

The testing sequence was configured such that after a failed test in a sequence of many, the sequence was terminated and the prepared containers and bridge were left intact.

Immediately after, several tests of capturing ICMP echo (i.e. ping) traffic were performed.

## Basic Test

In a trivial test, traffic targeted at a virtual interface corresponding to one of the containers was handled properly.

```
$ ping -c1 172.31.7.2
PING 172.31.7.2 (172.31.7.2) 56(84) bytes of data.
64 bytes from 172.31.7.2: icmp_seq=1 ttl=64 time=0.105 ms

--- 172.31.7.2 ping statistics ---
1 packets transmitted, 1 received, 0% packet loss, time 0ms
rtt min/avg/max/mdev = 0.105/0.105/0.105/0.000 ms
```
```
$ sudo tcpdump -n -i any 'icmp[icmptype] == icmp-echo or icmp[icmptype] == icmp-echoreply'
tcpdump: verbose output suppressed, use -v or -vv for full protocol decode
listening on any, link-type LINUX_SLL (Linux cooked v1), capture size 262144 bytes
02:03:05.849346 IP 172.31.7.1 > 172.31.7.2: ICMP echo request, id 28, seq 1, length 64
02:03:05.849368 IP 172.31.7.1 > 172.31.7.2: ICMP echo request, id 28, seq 1, length 64
02:03:05.849409 IP 172.31.7.2 > 172.31.7.1: ICMP echo reply, id 28, seq 1, length 64
02:03:05.849409 IP 172.31.7.2 > 172.31.7.1: ICMP echo reply, id 28, seq 1, length 64
```

## Basic Source Test

Traffic was handled correctly when explicitly set to originate from the bridge.

```
$ ping -c1 -I br-a70432a10062 172.31.7.2 
PING 172.31.7.2 (172.31.7.2) from 172.31.7.1 br-a70432a10062: 56(84) bytes of data.
64 bytes from 172.31.7.2: icmp_seq=1 ttl=64 time=0.090 ms

--- 172.31.7.2 ping statistics ---
1 packets transmitted, 1 received, 0% packet loss, time 0ms
rtt min/avg/max/mdev = 0.090/0.090/0.090/0.000 ms
```
```
$ sudo tcpdump -n -i any 'icmp[icmptype] == icmp-echo or icmp[icmptype] == icmp-echoreply'
tcpdump: verbose output suppressed, use -v or -vv for full protocol decode
listening on any, link-type LINUX_SLL (Linux cooked v1), capture size 262144 bytes
02:10:38.746925 IP 172.31.7.1 > 172.31.7.2: ICMP echo request, id 31, seq 1, length 64
02:10:38.746941 IP 172.31.7.1 > 172.31.7.2: ICMP echo request, id 31, seq 1, length 64
02:10:38.746944 IP 172.31.7.1 > 172.31.7.2: ICMP echo request, id 31, seq 1, length 64
02:10:38.746972 IP 172.31.7.2 > 172.31.7.1: ICMP echo reply, id 31, seq 1, length 64
02:10:38.746972 IP 172.31.7.2 > 172.31.7.1: ICMP echo reply, id 31, seq 1, length 64
```

##  Bridge Source  Test

Traffic set to originate from the address of the interface corresponding to one  container, the one different from that corresponding to the destination address, was not shown in a capture. The ping client issued a warning, but its significance  with respect to the tests is unknown.

```
$ ping -c1 -I vethc656682 172.31.7.2
ping: Warning: source address might be selected on device other than: vethc656682
PING 172.31.7.2 (172.31.7.2) from 10.4.2.11 vethc656682: 56(84) bytes of data.

--- 172.31.7.2 ping statistics ---
1 packets transmitted, 0 received, 100% packet loss, time 0ms
```
```
$ sudo tcpdump -n -i any 'icmp[icmptype] == icmp-echo or icmp[icmptype] == icmp-echoreply'
tcpdump: verbose output suppressed, use -v or -vv for full protocol decode
listening on any, link-type LINUX_SLL (Linux cooked v1), capture size 262144 bytes
```

## Container Source Test

Traffic originating from inside one container was dropped. This effect was not reproducible. In most cases, the process of creating the containers was validated, and this test would pass. 

In some cases, for   an unknown reason, the traffic from inside a container was dropped.

```
$ docker-compose exec container_name ping -c1 172.21.7.2
PING 172.21.7.2 (172.21.7.2): 56 data bytes

--- 172.21.7.2 ping statistics ---
1 packets transmitted, 0 packets received, 100% packet loss
```
```
$ sudo tcpdump -n -i any 'icmp[icmptype] == icmp-echo or icmp[icmptype] == icmp-echoreply'
tcpdump: verbose output suppressed, use -v or -vv for full protocol decode
listening on any, link-type LINUX_SLL (Linux cooked v1), capture size 262144 bytes
02:07:59.438912 IP 172.31.7.3 > 172.21.7.2: ICMP echo request, id 1066, seq 0, length 64
02:07:59.438912 IP 172.31.7.3 > 172.21.7.2: ICMP echo request, id 1066, seq 0, length 64
02:07:59.438957 IP 10.4.2.11 > 172.21.7.2: ICMP echo request, id 1066, seq 0, length 64
```
