### ISSUE TITLE
[docker-ce 27.2.0] Containers lose external DNS resolver ability after some time

### ISSUE THREAD

**Issue by Athanasius** [moby/moby#48418]
### Description

This is possibly related to docker-ce and containerd.io upgrades on 28th August 2024.  Until I upgraded from docker-ce `27.1.2-1~debian.12~bookworm` to `27.2.0-1~debian.12~bookworm` these containers functioned without issue.

NB: I originally added this information to https://github.com/moby/moby/issues/47414#issuecomment-2324164182 as it looked like a similar issue.  But @robmry advised I should open a new issue.

OS: Debian bookworm - all current updates applied.

On a nightly basis my tt-rss containers cease being able to resolve external DNS.  If I restart the containers it once more functions again until the issue reoccurs overnight.

1. I'm running Tiny Tiny RSS as per https://git.tt-rss.org/fox/ttrss-docker-compose.git
2. I have only customised `.env` enough to set TTRSS_SELF_URL_PATH, TTRSS_SESSION_COOKIE_LIFETIME, TTRSS_SMTP_FROM_NAME, TTRSS_SMTP_FROM_ADDRESS
3. I have a small `docker-compose.override.yml` to fix up some networking configuration:
```
networks:
  default:
    ipam:
      config:
        - subnet: 172.16.1.0/24
    driver_opts:
      # Must be no more than ppp0's MTU
      com.docker.network.driver.mtu: 1492
```
4. It's using the docker internal DNS in each container.  The `/etc/resolv.conf` in each of them is:
```
# Generated by Docker Engine.
# This file can be edited; Docker Engine will not make further changes once it
# has been modified.

nameserver 127.0.0.11
search dsl.miggy.org
options ndots:0
trust-ad

# Based on host file: '/etc/resolv.conf' (internal resolver)
# ExtServers: [192.168.1.1]
# Overrides: []
# Option ndots from: internal
```
This works perfectly fine most of the time.  Some time after upgrading from docker-ce `27.1.2-1~debian.12~bookworm` to `27.2.0-1~debian.12~bookworm` I started seeing lines like:
```
2024-09-02T09:16:08.766146+01:00 tuesday dockerd[2980613]: time="2024-09-02T09:16:08.764672123+01:00" level=warning msg="[resolver] connect failed" error="invalid argument"
```
in the log.  Other than the first time this occurred, this starts shortly after midnight (BST, so 23h UTC), implying some daily maintenance task triggers it.

Once it's begun:
```
tt-rss@tuesday:~/sites/ttrss-docker$ docker exec -it ttrss-docker-updater-1 /bin/sh
/ # nslookup rss.slashdot.org
Server:         127.0.0.11
Address:        127.0.0.11:53

** server can't find rss.slashdot.org: SERVFAIL

** server can't find rss.slashdot.org: SERVFAIL

/ # 
```
I enabled docker debug yesterday and restarted the docker service to ensure a clean slate:
```
2024-09-02T00:16:11.789218+01:00 tuesday dockerd[2980613]: time="2024-09-02T00:1
6:11.789148514+01:00" level=debug msg="Name To resolve: db."
2024-09-02T00:16:11.789295+01:00 tuesday dockerd[2980613]: time="2024-09-02T00:1
6:11.789200353+01:00" level=debug msg="[resolver] lookup name db. present without IPv6 address"
2024-09-02T00:16:11.789328+01:00 tuesday dockerd[2980613]: time="2024-09-02T00:16:11.789153234+01:00" level=debug msg="Name To resolve: db."
2024-09-02T00:16:11.789365+01:00 tuesday dockerd[2980613]: time="2024-09-02T00:16:11.789282393+01:00" level=debug msg="[resolver] lookup for db.: IP [172.16.1.4]"
2024-09-02T00:16:11.800224+01:00 tuesday dockerd[2980613]: time="2024-09-02T00:16:11.800141814+01:00" level=debug msg="Name To resolve: pypy.org."
2024-09-02T00:16:11.800298+01:00 tuesday dockerd[2980613]: time="2024-09-02T00:16:11.800252000+01:00" level=warning msg="[resolver] connect failed" error="invalid argument"
```
So, the internal names still resolve without issues, but external resolution fails with error `invalid argument`.  Testing in a container shell:
```
tt-rss@tuesday:~/sites/ttrss-docker$ docker exec -it ttrss-docker-updater-1 /bin/sh
/ # nslookup pypy.org
Server:         127.0.0.11
Address:        127.0.0.11:53

** server can't find pypy.org: SERVFAIL

** server can't find pypy.org: SERVFAIL
```
and then in the host itself:
```
tt-rss@tuesday:~/sites/ttrss-docker$ nslookup pypy.org
Server:         192.168.1.1
Address:        192.168.1.1#53

Non-authoritative answer:
Name:   pypy.org
Address: 185.199.110.153
Name:   pypy.org
Address: 185.199.108.153
Name:   pypy.org
Address: 185.199.109.153
Name:   pypy.org
Address: 185.199.111.153
Name:   pypy.org
Address: 2606:50c0:8002::153
Name:   pypy.org
Address: 2606:50c0:8000::153
Name:   pypy.org
Address: 2606:50c0:8001::153
Name:   pypy.org
Address: 2606:50c0:8003::153
```
So, something is causing the relevant dockerd process to be unable to make DNS queries to the local resolver (which is bind9).  I've yet to specifically find what triggers this behaviour so can only test once per day until I decide I need the relevant service and restart the containers. thus testing is somewhat slow.

How/where *should* I be able to trace the attempt to use external DNS?  I've traced through the following:
```
root@tuesday:/run/lock;
09:33:34 1$ docker ps | grep updater
eddc2f0fe1b0   cthulhoo/ttrss-fpm-pgsql-static:latest   "/opt/tt-rss/updater…"   2 days ago     Up 24 hours             9000/tcp                                                                                     ttrss-docker-updater-1
root@tuesday:/run/lock;
09:34:17 1$ docker inspect --format "{{.State.Pid}}" eddc2f0fe1b0
2981571
root@tuesday:/run/lock;
09:34:26 1$ nsenter -n -t 2981571 netstat -anop
Active Internet connections (servers and established)
Proto Recv-Q Send-Q Local Address           Foreign Address         State       PID/Program name     Timer
tcp        0      0 127.0.0.11:34983        0.0.0.0:*               LISTEN      2980613/dockerd      off (0.00/0/0)
tcp        0      0 172.16.1.6:46118        172.16.1.4:5432         TIME_WAIT   -                    timewait (4.40/0/0)
tcp        0      0 172.16.1.6:49318        172.16.1.4:5432         TIME_WAIT   -                    timewait (9.54/0/0)
tcp        0      0 172.16.1.6:54596        172.16.1.4:5432         TIME_WAIT   -                    timewait (9.54/0/0)
tcp        0      0 172.16.1.6:54584        172.16.1.4:5432         TIME_WAIT   -                    timewait (9.54/0/0)
tcp        0      0 172.16.1.6:46148        172.16.1.4:5432         TIME_WAIT   -                    timewait (9.48/0/0)
tcp        0      0 172.16.1.6:54254        172.16.1.4:5432         TIME_WAIT   -                    timewait (0.00/0/0)
tcp        0      0 172.16.1.6:46128        172.16.1.4:5432         TIME_WAIT   -                    timewait (4.40/0/0)
tcp        0      0 172.16.1.6:54268        172.16.1.4:5432         TIME_WAIT   -                    timewait (0.00/0/0)
tcp        0      0 172.16.1.6:46144        172.16.1.4:5432         TIME_WAIT   -                    timewait (9.48/0/0)
udp        0      0 127.0.0.11:36593        0.0.0.0:*                           2980613/dockerd      off (0.00/0/0)
Active UNIX domain sockets (servers and established)
Proto RefCnt Flags       Type       State         I-Node   PID/Program name     Path
unix  2      [ ]         DGRAM                    152585397 2984082/sudo         
root@tuesday:/run/lock;
09:34:33 1$ nsenter -n -t 2981571 iptables -nvL -t nat
Chain PREROUTING (policy ACCEPT 0 packets, 0 bytes)
 pkts bytes target     prot opt in     out     source               destination         

Chain INPUT (policy ACCEPT 0 packets, 0 bytes)
 pkts bytes target     prot opt in     out     source               destination         

Chain OUTPUT (policy ACCEPT 0 packets, 0 bytes)
 pkts bytes target     prot opt in     out     source               destination         
31694 1847K DOCKER_OUTPUT  0    --  *      *       0.0.0.0/0            127.0.0.11          

Chain POSTROUTING (policy ACCEPT 0 packets, 0 bytes)
 pkts bytes target     prot opt in     out     source               destination         
31694 1847K DOCKER_POSTROUTING  0    --  *      *       0.0.0.0/0            127.0.0.11          

Chain DOCKER_OUTPUT (1 references)
 pkts bytes target     prot opt in     out     source               destination         
    0     0 DNAT       6    --  *      *       0.0.0.0/0            127.0.0.11           tcp dpt:53 to:127.0.0.11:34983
31694 1847K DNAT       17   --  *      *       0.0.0.0/0            127.0.0.11           udp dpt:53 to:127.0.0.11:36593

Chain DOCKER_POSTROUTING (1 references)
 pkts bytes target     prot opt in     out     source               destination         
    0     0 SNAT       6    --  *      *       127.0.0.11           0.0.0.0/0            tcp spt:34983 to::53
    0     0 SNAT       17   --  *      *       127.0.0.11           0.0.0.0/0            udp spt:36593 to::53
```
Then dumping as per `nsenter -n -t 2981571 tcpdump -ni lo port 53` and running the in-container query:
```
tcpdump: verbose output suppressed, use -v[v]... for full protocol decode
listening on lo, link-type EN10MB (Ethernet), snapshot length 262144 bytes
09:35:42.595342 IP 127.0.0.11.53 > 127.0.0.1.45731: 18764 ServFail- 0/0/0 (26)
09:35:42.595410 IP 127.0.0.11.53 > 127.0.0.1.45731: 17664 ServFail- 0/0/0 (26)
09:35:42.596318 IP 127.0.0.11.53 > 127.0.0.1.45731: 17664 ServFail- 0/0/0 (26)
09:35:42.596541 IP 127.0.0.11.53 > 127.0.0.1.45731: 18764 ServFail- 0/0/0 (26)
09:35:42.597036 IP 127.0.0.11.53 > 127.0.0.1.45731: 17664 ServFail- 0/0/0 (26)
09:35:42.597380 IP 127.0.0.11.53 > 127.0.0.1.45731: 18764 ServFail- 0/0/0 (26)
```
And `nsenter -n -t 2981571 tcpdump -ni lo port 36593` shows similarly, so the DNAT/SNAT is functioning.  Thus the queries should end up with that PID `2981571`, yes ?  But neither `strace -p 2981571` nor `nsenter -n -t 2981571 strace -p 2981571` showing anything but:
```
09:37:51 1$ strace -p 2981571
strace: Process 2981571 attached
wait4(-1, 
```
I assume there's some other process/thread I'd need to `strace` to see what's happening.  How do I find that ?  The `2980613` from the netstat output is:
```
2980613 ?        Ssl    8:09 /usr/bin/dockerd -H fd:// --containerd=/run/containerd/containerd.sock
```
but `strace`ing it yields only:
```
09:42:04 1$ strace -p 2980613
strace: Process 2980613 attached
futex(0x5613d2dd80c8, FUTEX_WAIT_PRIVATE, 0, NULL
```
So, if I can be educated about what to strace or otherwise inspect I'm keen to track down the cause of this, rather than just implement a nightly restart of the containers to work around it.

Because this is primarily affecting my ttrss containers, and they do not function well without working DNS I'm likely to restart them each time this occurs.  However, the issue likely also affects my bitwarden containers, and their functionality is a lot less DNS dependent so I can probably leave them in broken state for further diagnosis.  I do have to be careful to use a 'correct' bitwarden container though as some of them are only on an internal-only network.  I've identified at least one where DNS normally functions correctly.

### Reproduce

I do not yet know what is triggering this.  It feels like some daily maintenance task might be implicated.

### Expected behavior

DNS resolution, via the dockerd internal DNS should continue to function.

### docker version

```bash
Client: Docker Engine - Community
 Version:           27.2.0
 API version:       1.47
 Go version:        go1.21.13
 Git commit:        3ab4256
 Built:             Tue Aug 27 14:15:15 2024
 OS/Arch:           linux/amd64
 Context:           default

Server: Docker Engine - Community
 Engine:
  Version:          27.2.0
  API version:      1.47 (minimum version 1.24)
  Go version:       go1.21.13
  Git commit:       3ab5c7d
  Built:            Tue Aug 27 14:15:15 2024
  OS/Arch:          linux/amd64
  Experimental:     false
 containerd:
  Version:          1.7.21
  GitCommit:        472731909fa34bd7bc9c087e4c27943f9835f111
 runc:
  Version:          1.1.13
  GitCommit:        v1.1.13-0-g58aa920
 docker-init:
  Version:          0.19.0
  GitCommit:        de40ad0
```

### docker info

```bash
Client: Docker Engine - Community
 Version:    27.2.0
 Context:    default
 Debug Mode: false
 Plugins:
  buildx: Docker Buildx (Docker Inc.)
    Version:  v0.16.2
    Path:     /usr/libexec/docker/cli-plugins/docker-buildx
  compose: Docker Compose (Docker Inc.)
    Version:  v2.29.2
    Path:     /usr/libexec/docker/cli-plugins/docker-compose

Server:
 Containers: 22
  Running: 16
  Paused: 0
  Stopped: 6
 Images: 48
 Server Version: 27.2.0
 Storage Driver: overlay2
  Backing Filesystem: extfs
  Supports d_type: true
  Using metacopy: true
  Native Overlay Diff: false
  userxattr: false
 Logging Driver: json-file
 Cgroup Driver: systemd
 Cgroup Version: 2
 Plugins:
  Volume: local
  Network: bridge host ipvlan macvlan null overlay
  Log: awslogs fluentd gcplogs gelf journald json-file local splunk syslog
 Swarm: inactive
 Runtimes: io.containerd.runc.v2 runc
 Default Runtime: runc
 Init Binary: docker-init
 containerd version: 472731909fa34bd7bc9c087e4c27943f9835f111
 runc version: v1.1.13-0-g58aa920
 init version: de40ad0
 Security Options:
  seccomp
   Profile: builtin
  cgroupns
 Kernel Version: 6.10.6
 Operating System: Debian GNU/Linux 12 (bookworm)
 OSType: linux
 Architecture: x86_64
 CPUs: 8
 Total Memory: 31.24GiB
 Name: tuesday
 ID: IK2Q:XS2J:UWC2:UV26:DPRF:XDG6:JPKA:OUID:QOUP:33CX:QC7B:CT2Q
 Docker Root Dir: /var/lib/docker
 Debug Mode: true
  File Descriptors: 147
  Goroutines: 151
  System Time: 2024-09-02T20:56:23.518568925+01:00
  EventsListeners: 0
 Experimental: false
 Insecure Registries:
  127.0.0.0/8
 Live Restore Enabled: false
```

### Additional Info

As per @robmry 's suggestion:
> The resolver forwards the DNS request from the container's network namespace (in 27.2.0, that'll change in the next release)... so, it might be interesting to try an nslookup to your host's resolver from a broken container's netns - either by replacing the 127.0.0.11 in its /etc/resolv.conf with your 192.168.1.1, or something like nsenter -n -t 2981571 nslookup pypy.org.

*With the tt-rss containers in a working state*:
```
21:06:33 1$ docker ps | grep updater
eddc2f0fe1b0   cthulhoo/ttrss-fpm-pgsql-static:latest   "/opt/tt-rss/updater…"   2 days ago   Up 25 minutes             9000/tcp                                                                                     ttrss-docker-updater-1
root@tuesday:/etc/cron.d;
21:06:46 1$ docker inspect --format "{{.State.Pid}}" eddc2f0fe1b0
184382
root@tuesday:/etc/cron.d;
21:06:51 1$ nsenter -n -t 184382 nslookup pypy.org 192.168.1.1
Server:         192.168.1.1
Address:        192.168.1.1#53

Non-authoritative answer:
Name:   pypy.org
Address: 185.199.110.153
Name:   pypy.org
Address: 185.199.109.153
Name:   pypy.org
Address: 185.199.108.153
Name:   pypy.org
Address: 185.199.111.153
Name:   pypy.org
Address: 2606:50c0:8000::153
Name:   pypy.org
Address: 2606:50c0:8003::153
Name:   pypy.org
Address: 2606:50c0:8002::153
Name:   pypy.org
Address: 2606:50c0:8001::153
```
I'll try that again the next time they're in the broken state.

I *did* try `strace` with `-o <file> -f -ff` on the identified dockerd process, but it produced only the main PID file, with nothing further in it.  So it seems I still need some advice for monitoring what it's actually doing/not doing.

**Comment by Athanasius** [comment]
OK, I've identified one thing about the `strace` issue.  I was applying it to the actual in-container process PID, rather than the dockerd process responsible for running it.  That shows a little more, but still nothing of note:

```
21:17:37 1$ docker ps | grep updater
eddc2f0fe1b0   cthulhoo/ttrss-fpm-pgsql-static:latest   "/opt/tt-rss/updater…"   2 days ago   Up 36 minutes             9000/tcp                                                                                     ttrss-docker-updater-1
root@tuesday:/etc/cron.d;
21:17:38 1$ docker inspect --format "{{.State.Pid}}" eddc2f0fe1b0
184382
root@tuesday:/etc/cron.d;
21:17:42 1$ ps 184382
    PID TTY      STAT   TIME COMMAND
 184382 ?        Ss     0:00 /bin/sh -e /opt/tt-rss/updater.sh
```
Utilising `ps afx | less` to find the PPID of that:
```
 184256 ?        Sl     0:00 /usr/bin/containerd-shim-runc-v2 -namespace moby -i
d eddc2f0fe1b0302d077070bff2e16b4d5640ed9dc9c44943e87d0900b4f99d89 -address /run
/containerd/containerd.sock
 184382 ?        Ss     0:00  \_ /bin/sh -e /opt/tt-rss/updater.sh
 187191 ?        S      0:00      \_ sudo -E -u app /usr/bin/php83 /var/www/html/tt-rss/update_daemon2.php
 187192 ?        S      0:00          \_ /usr/bin/php83 /var/www/html/tt-rss/update_daemon2.php
```
If I strace that containerd process, and get rid of anything uninteresting, all that's left is:
```
root@tuesday:/var/tmp/strace/docker;
21:19:25 0$ grep -vE 'nanosleep|futex|epoll_wait|getpid|tgkill|epoll_pwait|sched_yield|madvise|rt_sigreturn' *
nslookup-ttrss_updater_dockerd.184258:restart_syscall(<... resuming interrupted read ...>) = -1 EAGAIN (Resource temporarily unavailable)
nslookup-ttrss_updater_dockerd.184271:read(3,  <detached ...>
nslookup-ttrss_updater_dockerd.198478:--- SIGURG {si_signo=SIGURG, si_code=SI_TKILL, si_pid=184256, si_uid=0} ---
```
But I want the, one and only, dockerd process, and that looks more promising, for a pair of `nsenter -n -t 184382 nslookup pypy.org`, one just that, and the other with ` 192.168.1.1` on the end as specific server, I am seeing some threads with `recvmsg()` activity at least.  I'll drill into that some to be sure I know what I *should* see whilst DNS resolution is working and then compare the next time it breaks.

**Comment by Athanasius** [comment]
OK, I've now found what to expect in `strace` for a working "container asks dockerd for external DNS lookup, and it performs it" scenario.  I can also see that this causes debug logging like:
```
2024-09-02T00:14:16.566616+01:00 tuesday dockerd[2980613]: time="2024-09-02T00:1
4:16.566390822+01:00" level=debug msg="Name To resolve: cad-comic.com."
2024-09-02T00:14:16.567261+01:00 tuesday dockerd[2980613]: time="2024-09-02T00:1
4:16.567039811+01:00" level=debug msg="[resolver] forwarding query" client-addr=
"udp:172.16.1.6:47640" dns-server="udp:192.168.1.1:53" question=";cad-comic.com.
\tIN\t A"
2024-09-02T00:14:16.567836+01:00 tuesday dockerd[2980613]: time="2024-09-02T00:1
4:16.567663184+01:00" level=debug msg="[resolver] received A record \"172.67.166
.137\" for \"cad-comic.com.\" from udp:192.168.1.1"
2024-09-02T00:14:16.568075+01:00 tuesday dockerd[2980613]: time="2024-09-02T00:1
4:16.567746358+01:00" level=debug msg="[resolver] received A record \"104.21.66.
248\" for \"cad-comic.com.\" from udp:192.168.1.1"
```
That being the last such logging recorded last night before the external DNS broke for the container.

The next time it breaks I'll check whether the dockerd process even sees the request from the container process, which looks something like:
```
recvmsg(106, {msg_name={sa_family=AF_INET, sin_port=htons(51517), sin_addr=inet_addr("127.0.0.1")}, msg_namelen=112 => 16, msg_iov=[{iov_base="\275$\1\0\0\1\0\0\0\0\0\0\4pypy\3org\0\0\1\0\1", iov_len=512}], msg_iovlen=1, msg_control=[{cmsg_len=28, cmsg_level=SOL_IP, cmsg_type=IP_PKTINFO, cmsg_data={ipi_ifindex=if_nametoindex("lo"), ipi_spec_dst=inet_addr("127.0.0.11"), ipi_addr=inet_addr("127.0.0.11")}}], msg_controllen=32, msg_flags=0}, 0) = 26
```

**Comment by robmry** [comment]
Hi @Athanasius - thank you for raising the new issue.

> The next time it breaks I'll check whether the dockerd process even sees the request from the container process, ...

I'm sure it does - the log message  `level=warning msg="[resolver] connect failed" error="invalid argument"` comes from the internal resolver ... https://github.com/moby/moby/blob/7177a05666929d55a7f185185b5df0c53d66d69d/libnetwork/resolver.go#L627-L634

... but EINVAL from the `Dial` is quite mysterious. An strace of the dockerd process (not containerd) might show the system call that's failing, maybe it'll be a clue.

**Comment by Athanasius** [comment]
Comparing a working (I restarted one tt-rss container, the `app` one for this purpose), PID `183680`, TID `183689`:
```
write(2, "time=\"2024-09-03T12:44:06.800529073+01:00\" level=debug msg=\"Name To resolve: pypy.org.\"\n", 88) = 88
futex(0xc000318948, FUTEX_WAKE_PRIVATE, 1) = 0
openat(AT_FDCWD, "/var/run/docker/netns/77b8a0c69317", O_RDONLY|O_CLOEXEC) = 112
getpid()                                = 183680
gettid()                                = 183711
openat(AT_FDCWD, "/proc/183680/task/183711/ns/net", O_RDONLY|O_CLOEXEC) = 120
setns(112, CLONE_NEWNET)                = 0
socket(AF_INET, SOCK_DGRAM|SOCK_CLOEXEC|SOCK_NONBLOCK, IPPROTO_IP) = 124
setsockopt(124, SOL_SOCKET, SO_BROADCAST, [1], 4) = 0
connect(124, {sa_family=AF_INET, sin_port=htons(53), sin_addr=inet_addr("192.168.1.1")}, 16) = 0
epoll_ctl(5, EPOLL_CTL_ADD, 124, {events=EPOLLIN|EPOLLOUT|EPOLLRDHUP|EPOLLET, data={u32=4142928329, u64=9155957774758187465}}) = 0
getsockname(124, {sa_family=AF_INET, sin_port=htons(38715), sin_addr=inet_addr("172.16.1.3")}, [112 => 16]) = 0
getpeername(124, {sa_family=AF_INET, sin_port=htons(53), sin_addr=inet_addr("192.168.1.1")}, [112 => 16]) = 0
setns(120, CLONE_NEWNET)                = 0
close(120)                              = 0
close(112)                              = 0
write(2, "time=\"2024-09-03T12:44:06.801598416+01:00\" level=debug msg=\"[resolver] forwarding query\" client-addr=\"udp:172.16.1.3:38715\" dns-server=\"udp:192.168.1.1:53\" question=\";pypy.org.\\tIN\\t A\"\n", 186) = 186
write(124, "-\246\1 \0\1\0\0\0\0\0\0\4pypy\3org\0\0\1\0\1", 26) = 26
read(124, 0xc000e18000, 65535)          = -1 EAGAIN (Resource temporarily unavailable)
...
```
To a non-working (the ttrss `updater` container), PID `183680`, TID `184500`:
```
write(2, "time=\"2024-09-03T12:44:26.675329696+01:00\" level=debug msg=\"Name To resolve: pypy.org.\"\n", 88) = 88
openat(AT_FDCWD, "/var/run/docker/netns/066a3ce46b55", O_RDONLY|O_CLOEXEC) = 119
getpid()                                = 183680
gettid()                                = 184500
openat(AT_FDCWD, "/proc/183680/task/184500/ns/net", O_RDONLY|O_CLOEXEC) = 120
setns(119, CLONE_NEWNET)                = -1 EINVAL (Invalid argument)
close(120)                              = 0
futex(0xc000da4948, FUTEX_WAIT_PRIVATE, 0, NULL) = 0
futex(0xc000a12548, FUTEX_WAKE_PRIVATE, 1) = 1
futex(0xc000da4948, FUTEX_WAIT_PRIVATE, 0, NULL) = 0
nanosleep({tv_sec=0, tv_nsec=3000}, NULL) = 0
futex(0xc00121a148, FUTEX_WAKE_PRIVATE, 1) = 1
```
This appears to be that `setns()` call ?
```
12:54:23 1$ ls -l /var/run/docker/netns/066a3ce46b55
-rw-r--r-- 1 root root 0 Sep  2 20:40 /var/run/docker/netns/066a3ce46b55
12:54:44 1$ ls -l /proc/183680/task/184500/ns/net
lrwxrwxrwx 1 root root 0 Sep  2 20:43 /proc/183680/task/184500/ns/net -> 'net:[4026531840]'
```
This is with a self-compiled (using the `make dep-pkg` target` wrapped in a script to perform some git manipulation), version `Linux tuesday 6.10.6 #1 SMP PREEMPT_DYNAMIC Mon Aug 19 09:02:49 BST 2024 x86_64 GNU/Linux`.  Is this possibly some limit of namespaces that I have inadvertently set ?

**Comment by Athanasius** [comment]
I can confirm that the `/var/run/docker/netns/066a3ce46b55` is indeed invalid in general, whilst that for the working container is valid:
```
13:15:30 3$ nsenter --net=/var/run/docker/netns/066a3ce46b55 ip link show
nsenter: reassociate to namespace 'ns/net' failed: Invalid argument
root@tuesday:/proc/sys/net/core;
13:15:34 3$ nsenter --net=/var/run/docker/netns/77b8a0c69317 ip link show
1: lo: <LOOPBACK,UP,LOWER_UP> mtu 65536 qdisc noqueue state UNKNOWN mode DEFAULT group default qlen 1000
    link/loopback 00:00:00:00:00:00 brd 00:00:00:00:00:00
461: eth0@if462: <BROADCAST,MULTICAST,UP,LOWER_UP> mtu 1492 qdisc noqueue state UP mode DEFAULT group default 
    link/ether 02:42:ac:10:01:03 brd ff:ff:ff:ff:ff:ff link-netnsid 0
```
So, docker has lost track of the netns values, or something has invalidated the ones it has ?

**Comment by Athanasius** [comment]
Checking the entirety of `/var/run/docker/netns/*`, the only one that represents a valid netns is the ttrss/app one where I restarted the container:
```
for i in * ; do echo ; echo ${i} ; nsenter --net=/var/run/docker/netns/${i} ip link show ; done

029e243dd028
nsenter: reassociate to namespace 'ns/net' failed: Invalid argument
<same for all others except>

77b8a0c69317
1: lo: <LOOPBACK,UP,LOWER_UP> mtu 65536 qdisc noqueue state UNKNOWN mode DEFAULT group default qlen 1000
    link/loopback 00:00:00:00:00:00 brd 00:00:00:00:00:00
461: eth0@if462: <BROADCAST,MULTICAST,UP,LOWER_UP> mtu 1492 qdisc noqueue state UP mode DEFAULT group default 
    link/ether 02:42:ac:10:01:03 brd ff:ff:ff:ff:ff:ff link-netnsid 0
...
```

**Comment by Athanasius** [comment]
I think I have figured out something to do with this.  My nightly backups include an `rsync` of the root and other key filesystems over to a backup on different disks/partitions.  I recently started *not* umounting these after the sync was complete so as to enable icinga2 monitoring of their free space/inodes without it complaining when they weren't mounted.

This includes some bind mounts of things like `/proc`, `/sys` ... and `/run`, which will include `/run/docker`.  This is so that a `grub-mkconfig` chroot'd inside the target of the copy will work correctly.

I think it duplicating up `/run` (`/var/run` is a symlink to `/run`) is probably causing the problem ?  I'll adjust the syncing script to definitely umount that type of mount (rather than the normal storage mounts which are what I need to stay mounted) and see if the problem reoccurs.  This would explain why this was happening on a nightly basis.

Looking at `namespaces(7)`, the "Namespace lifetime" section, perhaps the double-mounting is interfering with some of the namespaces going away, and perhaps dockerd is meant to track that, but is failing to do so in this scenario due to the extra mounts ?

And, yes, I last adjusted that script ... on the 29th August 2024, coincidentally when the docker issue started.

**Comment by Athanasius** [comment]
Yes, that was the issue.  Having adjusted that nightly sync script to umount the `/run/` (and other) bind mounts everything has continued to run properly overnight and `docker exec -it ttrss-docker-updater-1 /usr/bin/nslookup pypy.org` has just succeeded without any interventions.

Hopefully this issue will serve as a point of reference for anyone else experiencing the same issue.  I'll close this now, but obviously feel free to re-open if you feel a need to utilise it for updating documentation.
