### DISCUSSION TITLE
Docker produces unexpected network behavior

### DISCUSSION THREAD

**Discussion by may11544** [moby/moby#46737] [Q&A]
Problem overview
After modifying the host IP, the established tcp connection is not disconnected and data can still be sent and received.

My docker version:
```
root@platform:~#  docker --version
Docker version 20.10.7, build f0df350
```
My operating system kernel version:
```
root@platform:~# uname -a
Linux platform 5.15.0-78-generic #85-Ubuntu SMP Fri Jul 7 15:25:09 UTC 2023 x86_64 x86_64 x86_64 GNU/Linux
```
I have a tcp server running in the alpine image,below is my code

```
package main

import (
	"flag"
	"fmt"
	"net"
)

var shost string
var sport int

func main() {
	flag.StringVar(&shost, "h", "", "this help")
	flag.IntVar(&sport, "p", 0, "this help")
	flag.Parse()
	host := &net.TCPAddr{IP: net.ParseIP(shost), Port: sport}
	fmt.Println("Starting the server ...")
	listener, err := net.ListenTCP("tcp4", host)
	if err != nil {
		fmt.Println("Error listening", err.Error())
		return
	}
	for {
		conn, err := listener.Accept()
		if err != nil {
			fmt.Println("Error accepting", err.Error())
			return
		}
		go doServerStuff(conn)
	}
}

func doServerStuff(conn net.Conn) {
	for {
		buf := make([]byte, 512)
		len, err := conn.Read(buf)
		if err != nil {
			fmt.Println("Error reading\n", err.Error())
			return
		}
		fmt.Printf("Received data: %v\n", string(buf[:len]))
	}
}

```
The IP listening when running is 0.0.0.0 and the port is 6666,the host ip is 1.1.1.161

`c6b5b3fe9015   portus.in.chaitin.net/library/golang:1.19-alpine                  "/bin/sh"                25 minutes ago   Up 25 minutes          0.0.0.0:6666->6666/tcp, :::6666->6666/tcp                                      practical_curie`

I have a tcp client running on another host,My code looks like below
```
package main

import (
	"bufio"
	"flag"
	"fmt"
	"net"
	"os"
	"strings"
	"time"
)

var host string
var port string

func main() {
	flag.StringVar(&host, "h", "", "this help")
	flag.StringVar(&port, "p", "", "this help")
	flag.Parse()
	fmt.Printf("start args host=%s,port=%s", host, port)

	conn, err := net.DialTimeout("tcp", fmt.Sprintf("%s:%s", host, port), time.Second*5)
	if tcpConn, ok := conn.(*net.TCPConn); ok {
		tcpConn.SetKeepAlive(true)
		tcpConn.SetKeepAlivePeriod(1 * time.Second)
	} else {
		panic("tcp connection error")
	}
	if err != nil {
		fmt.Println("Error dialing", err.Error())
		return
	}

	inputReader := bufio.NewReader(os.Stdin)
	fmt.Println("First, what is your name?")
	clientName, _ := inputReader.ReadString('\n')
	
	trimmedClient := strings.Trim(clientName, "\r\n")
	
	for {
		str := "What to send to the server? Type Q to quit."
		_, err = conn.Write([]byte(trimmedClient + " says: " + str))
		time.Sleep(time.Second * 2)
	}
}
```
Execute client code as follows
`./client -h 1.1.1.161 -p 6666`

After I enter the Enter key, the tcp server can see the following output

```
Received data:  says: What to send to the server? Type Q to quit.
Received data:  says: What to send to the server? Type Q to quit.
Received data:  says: What to send to the server? Type Q to quit.
Received data:  says: What to send to the server? Type Q to quit.
Received data:  says: What to send to the server? Type Q to quit.
Received data:  says: What to send to the server? Type Q to quit.
Received data:  says: What to send to the server? Type Q to quit.
Received data:  says: What to send to the server? Type Q to quit.
Received data:  says: What to send to the server? Type Q to quit.
Received data:  says: What to send to the server? Type Q to quit.
Received data:  says: What to send to the server? Type Q to quit.
Received data:  says: What to send to the server? Type Q to quit.
Received data:  says: What to send to the server? Type Q to quit.
Received data:  says: What to send to the server? Type Q to quit.
```
When I changed the IP of the machine 1.1.1.161 to 1.1.1.162, I found that the tcp server could still receive data.

```
enp24s0f0: flags=4163<UP,BROADCAST,RUNNING,MULTICAST>  mtu 1500
        inet 1.1.1.162  netmask 255.0.0.0  broadcast 1.255.255.255
        inet6 fe80::76a4:b5ff:fe02:b4  prefixlen 64  scopeid 0x20<link>
        ether 74:a4:b5:02:00:b4  txqueuelen 1000  (Ethernet)
        RX packets 3912  bytes 351202 (351.2 KB)
        RX errors 0  dropped 0  overruns 0  frame 0
        TX packets 3969  bytes 262618 (262.6 KB)
        TX errors 0  dropped 0 overruns 0  carrier 0  collisions 0
```

Through tcpdump, we found that the IP in the traffic is still 1.1.1.161
```
13:58:12.211452 IP 1.1.1.186.38500 > 1.1.1.161.6666: Flags [S], seq 2368770585, win 65535, options [mss 1460,sackOK,TS val 1791577244 ecr 0,nop,wscale 9], length 0
13:58:12.211612 IP 1.1.1.161.6666 > 1.1.1.186.38500: Flags [S.], seq 3375221185, ack 2368770586, win 65160, options [mss 1460,sackOK,TS val 1979894071 ecr 1791577244,nop,wscale 7], length 0
13:58:12.211665 IP 1.1.1.186.38500 > 1.1.1.161.6666: Flags [.], ack 1, win 128, options [nop,nop,TS val 1791577245 ecr 1979894071], length 0
13:58:13.220294 IP 1.1.1.186.38500 > 1.1.1.161.6666: Flags [.], ack 1, win 128, options [nop,nop,TS val 1791578253 ecr 1979894071], length 0
13:58:13.220357 IP 1.1.1.161.6666 > 1.1.1.186.38500: Flags [.], ack 1, win 510, options [nop,nop,TS val 1979895080 ecr 1791577245], length 0
13:58:14.248256 IP 1.1.1.186.38500 > 1.1.1.161.6666: Flags [.], ack 1, win 128, options [nop,nop,TS val 1791579281 ecr 1979895080], length 0
13:58:14.248300 IP 1.1.1.161.6666 > 1.1.1.186.38500: Flags [.], ack 1, win 510, options [nop,nop,TS val 1979896108 ecr 1791577245], length 0
13:58:15.268225 IP 1.1.1.186.38500 > 1.1.1.161.6666: Flags [.], ack 1, win 128, options [nop,nop,TS val 1791580301 ecr 1979896108], length 0
13:58:15.268295 IP 1.1.1.161.6666 > 1.1.1.186.38500: Flags [.], ack 1, win 510, options [nop,nop,TS val 1979897128 ecr 1791577245], length 0
13:58:16.292191 IP 1.1.1.186.38500 > 1.1.1.161.6666: Flags [.], ack 1, win 128, options [nop,nop,TS val 1791581325 ecr 1979897128], length 0
13:58:16.292254 IP 1.1.1.161.6666 > 1.1.1.186.38500: Flags [.], ack 1, win 510, options [nop,nop,TS val 1979898152 ecr 1791577245], length 0
13:58:17.220151 ARP, Request who-has 1.1.1.161 tell 1.1.1.186, length 46
13:58:17.220172 ARP, Reply 1.1.1.161 is-at 74:a4:b5:02:00:b4 (oui Unknown), length 28
13:58:17.316152 IP 1.1.1.186.38500 > 1.1.1.161.6666: Flags [.], ack 1, win 128, options [nop,nop,TS val 1791582349 ecr 1979898152], length 0
```

Then I tried to run the tcp server on the host machine,It is found that the connection can be disconnected and the data is unreachable after the IP is changed.I'm curious about what docker did to cause the host to receive traffic with a destination address other than its own.
