### ISSUE TITLE
TCP connections stall in Docker containers in WSL2 using mirrored networking mode

### ISSUE THREAD

**Issue by nnathan** [moby/moby#48201]
### Description

I use Ubuntu 24.04 in WSL2. (Although this issue is also present in Ubuntu 22.04 in WSL2).

When WSL2 mirrored network mode is disabled I do not have any issues.

When I enable WSL2 mirrored networking mode, TCP connections stall in containers, but not on the host. I do not know if this impacts UDP connections or other types of packets.

If I do a `apt -y update` or a `apt -y install <package>` sometimes the connection will stall and cause the process to block indefinitely. I was able to reproduce by just using wget in a `ubuntu:20.04`, `ubuntu:24.04`, and `alpine:latest (3.20.1)` container.

After starting the container with a shell, install `wget` and do the following:

```
while true; do wget --max-redirect 0 -O/dev/null http://angry.lastninja.net/test.dat; done
```

Which results in a stall like so (note the `--.-KB/s`):

```
/dev/null                              5%[===>                                                                 ]   5.94M  --.-KB/s    eta 5m 22s
```

This only happens when run in the container, the issue doesn't manifest on the host and the download doesn't stall and always completes.

### Reproduce

1. Update `.wslconfig` to have:
```
[wsl2]
networkingMode=mirrored
```

2. Start WSL2 host with Docker

3. Run a docker container with shell: `docker run -it ubuntu:20.04 /bin/bash`

4. In container install wget (assuming the issue doesn't manifest when doing this command): `apt -y update && apt -y install wget`

5. In container do a wget loop to download a large file and wait until it stalls indefinitely: `while true; do wget --max-redirect 0 -O/dev/null http://angry.lastninja.net/test.dat; done`

### Expected behavior

`wget` should always be progressing and not stall indefinitely.

### docker version

```bash
$ docker version
Client: Docker Engine - Community
 Version:           27.0.3
 API version:       1.46
 Go version:        go1.21.11
 Git commit:        7d4bcd8
 Built:             Sat Jun 29 00:02:23 2024
 OS/Arch:           linux/amd64
 Context:           default

Server: Docker Engine - Community
 Engine:
  Version:          27.0.3
  API version:      1.46 (minimum version 1.24)
  Go version:       go1.21.11
  Git commit:       662f78c
  Built:            Sat Jun 29 00:02:23 2024
  OS/Arch:          linux/amd64
  Experimental:     false
 containerd:
  Version:          1.7.18
  GitCommit:        ae71819c4f5e67bb4d5ae76a6b735f29cc25774e
 runc:
  Version:          1.7.18
  GitCommit:        v1.1.13-0-g58aa920
 docker-init:
  Version:          0.19.0
  GitCommit:        de40ad0
```
```


### docker info

```bash
$ docker info
Client: Docker Engine - Community
 Version:    27.0.3
 Context:    default
 Debug Mode: false
 Plugins:
  buildx: Docker Buildx (Docker Inc.)
    Version:  v0.15.1
    Path:     /usr/libexec/docker/cli-plugins/docker-buildx
  compose: Docker Compose (Docker Inc.)
    Version:  v2.28.1
    Path:     /usr/libexec/docker/cli-plugins/docker-compose

Server:
 Containers: 14
  Running: 3
  Paused: 0
  Stopped: 11
 Images: 9
 Server Version: 27.0.3
 Storage Driver: overlay2
  Backing Filesystem: extfs
  Supports d_type: true
  Using metacopy: false
  Native Overlay Diff: true
  userxattr: false
 Logging Driver: json-file
 Cgroup Driver: cgroupfs
 Cgroup Version: 1
 Plugins:
  Volume: local
  Network: bridge host ipvlan macvlan null overlay
  Log: awslogs fluentd gcplogs gelf journald json-file local splunk syslog
 Swarm: inactive
 Runtimes: runc io.containerd.runc.v2
 Default Runtime: runc
 Init Binary: docker-init
 containerd version: ae71819c4f5e67bb4d5ae76a6b735f29cc25774e
 runc version: v1.1.13-0-g58aa920
 init version: de40ad0
 Security Options:
  seccomp
   Profile: builtin
 Kernel Version: 5.15.133.1-microsoft-standard-WSL2
 Operating System: Ubuntu 24.04 LTS
 OSType: linux
 Architecture: x86_64
 CPUs: 16
 Total Memory: 31.3GiB
 Name: z
 ID: 88822076-12a7-48bc-a2e5-a9d468faadcb
 Docker Root Dir: /var/lib/docker
 Debug Mode: false
 Username: slsritchie1337
 Experimental: false
 Insecure Registries:
  127.0.0.0/8
 Live Restore Enabled: false

WARNING: No blkio throttle.read_bps_device support
WARNING: No blkio throttle.write_bps_device support
WARNING: No blkio throttle.read_iops_device support
WARNING: No blkio throttle.write_iops_device support
```
```


### Additional Info

```
C:\Users\naveen>type .wslconfig
[wsl2]
#kernel=C:\\Users\\naveen\\vmlinux-5.15.133.1-webcam
networkingMode=mirrored

C:\Users\naveen>wsl --status
Default Distribution: Ubuntu-24.04
Default Version: 2

C:\Users\naveen>wsl --version
WSL version: 2.0.14.0
Kernel version: 5.15.133.1-1
WSLg version: 1.0.59
MSRDC version: 1.2.4677
Direct3D version: 1.611.1-81528511
DXCore version: 10.0.25131.1002-220531-1700.rs-onecore-base2-hyp
Windows version: 10.0.22631.3880
```

I've created an issue with the WSL2 team https://github.com/microsoft/WSL/issues/11819 which has pcap captures, strace output, and some WSL2 diagnostics. From this comment https://github.com/microsoft/WSL/issues/11819#issuecomment-2241607978 I have provided the following pcaps/logs:

[WslNetworkingLogs-2024-07-21_23-04-48.zip](https://github.com/user-attachments/files/16324558/WslNetworkingLogs-2024-07-21_23-04-48.zip)
[WslLogs-2024-07-21_23-04-51.zip](https://github.com/user-attachments/files/16324556/WslLogs-2024-07-21_23-04-51.zip)
[pcaps.zip](https://github.com/user-attachments/files/16324554/pcaps.zip)
[wget-strace.txt](https://github.com/user-attachments/files/16324555/wget-strace.txt)

The `Wsl*` logs aren't that interesting in my opinion but are required by MS for filing an issue.

The `pcaps.zip` have pcaps from the vantage point of the Windows host wifi adapter (port 80 only), the Ubuntu host containing the "internet facing" network adapter (`eth1` -- it's eth1 because of mirrored mode, otherwise it'd be eth0), the `docker0` interface, and the container interface `vethcdca12b`.

## vethcdca12b.docker0.2024-07-21.pcap

What is interesting is the client in the container `vethcdca12b.docker0.2024-07-21.pcap` is packets 8246, 8248 and 8249:

This is a normal packet:

```
8426	14.239120	172.17.0.2	149.248.1.168	TCP	66	58038 → 80 [ACK] Seq=155 Ack=37652410 Win=2815232 Len=0 TSval=96511730 TSecr=1894383471
```

This packet is sent, but fails to deliver which yields an ICMP packet below:

```
8428	14.240250	172.17.0.2	149.248.1.168	TCP	66	58038 → 80 [ACK] Seq=155 Ack=37656730 Win=2812416 Len=0 TSval=96511731 TSecr=1894383473
Transmission Control Protocol, Src Port: 58038, Dst Port: 80, Seq: 155, Ack: 37656730, Len: 0
    Source Port: 58038
    Destination Port: 80
    [Stream index: 0]
    [Conversation completeness: Complete, WITH_DATA (31)]
    [TCP Segment Len: 0]
    Sequence Number: 155    (relative sequence number)
    Sequence Number (raw): 4060812192
    [Next Sequence Number: 155    (relative sequence number)]
    Acknowledgment Number: 37656730    (relative ack number)
    Acknowledgment number (raw): 2661116900
    1000 .... = Header Length: 32 bytes (8)
    Flags: 0x010 (ACK)
    Window: 21972
    [Calculated window size: 2812416]
    [Window size scaling factor: 128]
    Checksum: 0x43da [unverified]
    [Checksum Status: Unverified]
    Urgent Pointer: 0
    Options: (12 bytes), No-Operation (NOP), No-Operation (NOP), Timestamps
    [Timestamps]
    [SEQ/ACK analysis]

```

ICMP packet in response to packet 8428:

```
8429	14.240269	172.17.0.1	172.17.0.2	ICMP	94	Destination unreachable (Network unreachable)
Internet Control Message Protocol
    Type: 3 (Destination unreachable)
    Code: 0 (Network unreachable)
    Checksum: 0xc9f1 [correct]
    [Checksum Status: Good]
    Unused: 00000000
    Internet Protocol Version 4, Src: 172.17.0.2, Dst: 149.248.1.168
    Transmission Control Protocol, Src Port: 58038, Dst Port: 80, Seq: 4060812192, Ack: 2661116900
        Source Port: 58038
        Destination Port: 80
        Sequence Number: 4060812192
        [Stream index: 0]
        [Conversation completeness: Complete, WITH_DATA (31)]
        Acknowledgment Number: 2661116900    (relative ack number)
        Acknowledgment number (raw): 2661116900
        1000 .... = Header Length: 32 bytes (8)
        Flags: 0x010 (ACK)
        Window: 21972
        [Calculated window size: 21972]
        [Window size scaling factor: 128]
        Checksum: 0x43da [unverified]
        [Checksum Status: Unverified]
        Urgent Pointer: 0
        Options: (12 bytes), No-Operation (NOP), No-Operation (NOP), Timestamps
        [Timestamps]
```

Why in ICMP packet 8429 is the docker GW (`172.17.0.1`) sending a Destination Unreachable? Also, in the same ICMP packet it looks like the Acknowledgement Number (relative) is wrong and should be 37656730 as seen in packet 8428.

## eth1.2024-07-21.pcap

We see packet 8445 which was the last successful TCP packet:

```
8445	18.418087	192.168.0.161	149.248.1.168	TCP	66	60427 → 80 [ACK] Seq=155 Ack=37652410 Win=2815232 Len=0 TSval=96511730 TSecr=1894383471
```

Then we see packet 8458, which is the next outgoing packet from the client sending a RST:

```
8458	18.428572	192.168.0.161	149.248.1.168	TCP	54	60427 → 80 [RST] Seq=155 Win=0 Len=0
```

This is when the connection dies.

**My gut feel is something is suspect with the Docker Daemon / Networking on the gateway side when mirroring mode is enabled.**

**Comment by nnathan** [comment]
I don't think this is isolated to Docker.

I ran an experiment to test `wget` in a network namespace using both (1) virtual eth with NAT and (2) virtual eth connected to bridge which is NAT (in same vein as docker0).

I had no issue with (1), but ran into the same problem in (2).

I have an experiment and reproduction of the issue using network name with bridge here: https://github.com/microsoft/WSL/issues/11819#issuecomment-2241724079

I want to leave the issue open though to see if others using WSL2 are having the issue or not.

**Comment by thaJeztah** [comment]
I think this is a duplicate of https://github.com/moby/moby/issues/48056 (and https://github.com/microsoft/WSL/issues/10494).

It's not a bug, but it requires changes to adjust networking for the non-standard way in which the mirror feature is set up within wsl2. We have a PR pending to implement this (which checks if we're running inside wsl2, in which case networking is set up to work with the mirror features);

- https://github.com/moby/moby/pull/48075

That PR may soon be merged, but we requested the Microsoft team to give it a review.

**Comment by thaJeztah** [comment]
Let me cc @robmry to double-check if it's a duplicate, or if there's other changes required for this specific scenario.

**Comment by nnathan** [comment]
Thanks for the heads up @thaJeztah . First thing when I return to my WSL2 machine later in the week will be to try out this PR and see if it alleviates the issue. I can't say I fully understand how both of these are similar issues because one is about forwarding ports, but I agree that the issue might be inherent with NAT (which, on the host, is probably initiating the TCP resets on the flow).

**Comment by thaJeztah** [comment]
Yeah, in all honesty; I saw `mirror` mentioned, and may have made the assumption too fast that they were the same (could be related, but not 100% sure if they're the _same_) 😅 🫶

**Comment by robmry** [comment]
This does sound like a different issue, https://github.com/moby/moby/issues/48056 is specifically about communication between processes on the Windows host and in a container, using a special `loopback0` device in the WSL2'd Linux - which I don't think is involved in this case. When that problem is hit communication always fails because packets can't be routed back to the Windows host, it doesn't work then fail after some time.

I can't think of anything docker itself could be doing to cause this problem... I tried to repro using the download in an Ubuntu container but, no-luck, downloads continue to work for me.

**Comment by nnathan** [comment]
> I can't think of anything docker itself could be doing to cause this problem...

Although I did post here first, I don't think Docker is the culprit actually. I've verified the issue manifests in a setup with  a routed bridge interface with a connected network namespace as a veth adapter, with that bridge interface NAT'd via the WSL2 host network adapter.

I think mirrored network mode and Docker is becoming a popular combination that if this issue was happening, there'd be more reports of instability.

**Comment by nuno4793** [comment]
I can confirm that I am facing the same issue, the connectivity from docker just stops working randomly. The workaround is to restart docker desktop and it starts to work again or just set WSL2 network to the default (NAT).

Docker Desktop 4.37.1
Windows 11 23H2 OS build: 22631.4751
WSL version: 2.4.9.0
Kernel version: 5.15.167.4-1
WSLg version: 1.0.65
MSRDC version: 1.2.5716
Direct3D version: 1.611.1-81528511
DXCore version: 10.0.26100.1-240331-1435.ge-release
Windows version: 10.0.22631.4751

I am not surprised this is not more popular issue, a lot of people doesn't even realize there are different network modes for WSL, to be hones the default NAT works just fine fro 99% of people.

**Comment by nnathan** [comment]
@nuno4793 - can you check https://github.com/microsoft/WSL/issues/11819 and maybe try to reproduce the issue without docker (using bridges etc. - i have steps to reproduce in a comment on that issue).
