### ISSUE TITLE
Docker 19.03.1 changes the source IP address

### ISSUE THREAD

**Issue by igorkatz** [moby/moby#39665]
**Description:**
Docker 19.03.1 changes the source IP address for HTTP request where a service name is used as a destination and there is no "X-Forwarded-For" field in the request header. The HTTP request is performed inside a overlay network. Docker 18.03.1 did not change the source IP address in the same case.

**Output of `docker version`:**
```
 Version:           19.03.1
 API version:       1.40
 Go version:        go1.12.5
 Git commit:        74b1e89
 Built:             Thu Jul 25 21:21:07 2019
 OS/Arch:           linux/amd64
 Experimental:      false

Server: Docker Engine - Community
 Engine:
  Version:          19.03.1
  API version:      1.40 (minimum version 1.12)
  Go version:       go1.12.5
  Git commit:       74b1e89
  Built:            Thu Jul 25 21:19:36 2019
  OS/Arch:          linux/amd64
  Experimental:     true
 containerd:
  Version:          1.2.6
  GitCommit:        894b81a4b802e4eb2a91d1ce216b8817763c29fb
 runc:
  Version:          1.0.0-rc8
  GitCommit:        425e105d5a03fabd737a126ad93d62a9eeede87f
 docker-init:
  Version:          0.18.0
  GitCommit:        fec3683
```
**Output of `docker info`:**     
```
Client:
 Debug Mode: false

Server:
 Containers: 4
  Running: 4
  Paused: 0
  Stopped: 0
 Images: 2
 Server Version: 19.03.1
 Storage Driver: overlay2
  Backing Filesystem: xfs
  Supports d_type: true
  Native Overlay Diff: true
 Logging Driver: json-file
 Cgroup Driver: cgroupfs
 Plugins:
  Volume: local
  Network: bridge host ipvlan macvlan null overlay
  Log: awslogs fluentd gcplogs gelf journald json-file local logentries splunk syslog
 Swarm: active
  NodeID: p1ixxl3vpbxpzr94ngkiy0i1r
  Is Manager: true
  ClusterID: isuf7t0sfk9oxq6vqekxxc78k
  Managers: 1
  Nodes: 1
  Default Address Pool: 10.0.0.0/8  
  SubnetSize: 24
  Data Path Port: 4789
  Orchestration:
   Task History Retention Limit: 5
  Raft:
   Snapshot Interval: 10000
   Number of Old Snapshots to Retain: 0
   Heartbeat Tick: 1
   Election Tick: 10
  Dispatcher:
   Heartbeat Period: 5 seconds
  CA Configuration:
   Expiry Duration: 3 months
   Force Rotate: 0
  Autolock Managers: false
  Root Rotation In Progress: false
  Node Address: 10.0.2.15
  Manager Addresses:
   10.0.2.15:2377
 Runtimes: runc
 Default Runtime: runc
 Init Binary: docker-init
 containerd version: 894b81a4b802e4eb2a91d1ce216b8817763c29fb
 runc version: 425e105d5a03fabd737a126ad93d62a9eeede87f
 init version: fec3683
 Security Options:
  seccomp
   Profile: default
 Kernel Version: 3.10.0-957.10.1.el7.x86_64
 Operating System: CentOS Linux 7 (Core)
 OSType: linux
 Architecture: x86_64
 CPUs: 1
 Total Memory: 3.701GiB
 Name: centos1.ecicloud.com
 ID: SVFF:X4IM:V3SQ:VKVV:LL6S:4EDF:EIBF:FMJB:72S7:QVDT:IX7W:U7RI
 Docker Root Dir: /var/lib/docker
 Debug Mode: false
 Registry: https://index.docker.io/v1/
 Labels:
 Experimental: true
 Insecure Registries:
  globe:5000
  127.0.0.0/8
 Live Restore Enabled: false

WARNING: bridge-nf-call-ip6tables is disabled
```

**Comment by thaJeztah** [comment]
Do you have minimum steps to reproduce the issue? (also, this is not the same problem as https://github.com/moby/moby/issues/25526 ?)

**Comment by arkodg** [comment]
@igorkatz are you referring to internal services talking to other services via HTTP within the same swarm cluster ?

For that case you can create an overlay network in DSR mode (`--opt dsr`) to circumvent the Layer 3 rewrite

**Comment by igorkatz** [comment]
Yes, I am referring to internal services talking to other services via HTTP within the same swarm cluster. Now, if one service is talking to another service via overlay network w/o DSR mode, the server receives IP address of load balancer in this network. If a HTTP request is performed via overlay network w/ DSR mode, the server receives VIP of the client service. In Docker 18.03, the server receives IP address of the specific client task (container), that performed this HTTP request. 
Maybe, it will be helpful to fill down "X-Forwarded-For" field in the request header.       
This looks like related to this change: https://github.com/docker/engine/pull/16 that was done in Docker 18.06.
I

**Comment by arkodg** [comment]
@igorkatz `docker` does not rewrite any Layer 7 headers .
To keep src ip intact please use `--opt-dsr`
https://github.com/docker/libnetwork/pull/2270 introduced that change

**Comment by igorkatz** [comment]
As I mentioned above, the server receives VIP of the client service now when the overlay network was created with `--opt-dsr` option. I named the client service, the service where one of its tasks (replicas) performed HTTP request. In Docker 18.03, the server receives IP address of the specific replica, that performed this HTTP request. For example: if whoami.3 (see below) performed HTTP request, the server receives VIP:  `10.0.0.2` when the overlay network was created with `--opt-dsr` option. But in Docker 18.03  the server receives endpoint IP: `10.0.0.5`
```
        "Services": {
            "whoami": {
                "VIP": "10.0.0.2",
                "Ports": [],
                "LocalLBIndex": 259,
                "Tasks": [
                    {
                        "Name": "whoami.3.n6maa5dlp8p410pzxt3rhvosp",
                        "EndpointID": "124b816e155d43549684831f75c48b105e372964e6a9c9893a0627e88d150bbf",
                        "EndpointIP": "10.0.0.5",
                        "Info": {
                            "Host IP": "10.0.2.15"
                        }
                    },
                    {
                        "Name": "whoami.2.prjschjr51edjyngz9v8i6kd3",
                        "EndpointID": "66535fe50f332c5571d0e8628890c58865ed654d3838887e91c61ba08a54bc53",
                        "EndpointIP": "10.0.0.4",
                        "Info": {
                            "Host IP": "10.0.2.15"
                        }
                    },
                    {
                        "Name": "whoami.1.kwg9zij55vrvl5j5dbqzalt80",
                        "EndpointID": "f1053601ed98cce0dde8f8d5ce8df8340994a66441d9551bfaeaddee34c40a8a",
                        "EndpointIP": "10.0.0.3",
                        "Info": {
                            "Host IP": "10.0.2.15"
                        }
                    }
                ]
            }
        }

```

**Comment by arkodg** [comment]
yes now we are talking about DST-IP :) which will be the VIP as you mentioned (and not the endpoint IP)
because in DSR mode, we do not perform any SNAT or DNAT

**Comment by igorkatz** [comment]
This means, you agree that overlay network created with` --opt dsr` option is not backwards compatible with Docker 18.03 and in Docker 19.03 the server can not obtain the client endpoint IP from HTTP call

**Comment by arkodg** [comment]
Yes I do agree with you that `--opt dsr` overlay networks do not work exactly as overlay networks in 18.03 . The changes were introduced to improve performance .

But your original issue was wrt Source IP being overwritten, and that can be achieved with the `--opt dsr`

Adding some more details here -

**Engine 18.03**

```
docker network create -d overlay testNet
docker service create --name web1-18.03 --network=testNet --replicas=2 ehazlett/docker-demo
docker service create --name web1-1803 --network=testNet --replicas=2 ehazlett/docker-demo
```

Relevant output from `docker network inspect testNet -v`

```
       "Services": {
            "web1-1803": {
                "VIP": "10.0.0.2",
                "Ports": [],
                "LocalLBIndex": 256,
                "Tasks": [
                    {
                        "Name": "web1-1803.1.9rid5apyqallv66pq7j9sevzv",
                        "EndpointID": "e9d73bd85ed258fc829c524d9778518258cd29b203037a08cb1649920faea914",
                        "EndpointIP": "10.0.0.4",
                        "Info": {
                            "Host IP": "172.31.7.26"
                        }
                    },
                    {
                        "Name": "web1-1803.2.v07le7dyh9b2k15xp4q22ozo0",
                        "EndpointID": "6f944d11120835876d0ab8727ae39cf1c639eac526dcc5d71896909594b7149a",
                        "EndpointIP": "10.0.0.3",
                        "Info": {
                            "Host IP": "172.31.8.242"
                        }
                    }
                ]
            },
            "web2-1803": {
                "VIP": "10.0.0.5",
                "Ports": [],
                "LocalLBIndex": 257,
                "Tasks": [
                    {
                        "Name": "web2-1803.1.jyluxbu3cfz6k62xzseju8m9g",
                        "EndpointID": "f1c016c993a5096a3e3af1d6149ebdb7b28a0df2376330e90b2aaf34d518b539",
                        "EndpointIP": "10.0.0.6",
                        "Info": {
                            "Host IP": "172.31.7.26"
                        }
                    },
                    {
                        "Name": "web2-1803.2.jmh7p6zayhzvic6ctcxf8hsde",
                        "EndpointID": "1252397e519f049896a8dd12165bb9d3ab6b134995a5ae74e13b551c0168e44d",
                        "EndpointIP": "10.0.0.7",
                        "Info": {
                            "Host IP": "172.31.8.242"
                        }
                    }
                ]
            }
```

Now when Service 1 (web1-1803) tries to reach Service 2 (web2-1803) via Service 2's VIP (10.0.0.5),
the data plane will rewrite the Destination IP from the VIP to Endpoint IP (10.0.0.7)

Performing a CURL from Service 1
```
sudo nsenter --net=/var/run/docker/netns/5a59606603e4 ifconfig eth0
eth0      Link encap:Ethernet  HWaddr 02:42:0a:00:00:03  
          inet addr:10.0.0.3  Bcast:10.0.0.255  Mask:255.255.255.0
          UP BROADCAST RUNNING MULTICAST  MTU:1450  Metric:1
          RX packets:0 errors:0 dropped:0 overruns:0 frame:0
          TX packets:0 errors:0 dropped:0 overruns:0 carrier:0
          collisions:0 txqueuelen:0 
          RX bytes:0 (0.0 B)  TX bytes:0 (0.0 B)


sudo nsenter --net=/var/run/docker/netns/5a59606603e4 curl http://10.0.0.5:8080/ping
{"instance":"f08657f0cb4e","version":"0.1"}
```

TCPDUMP in Service 2


```
sudo nsenter --net=/var/run/docker/netns/47add5f8738d ifconfig eth0
eth0      Link encap:Ethernet  HWaddr 02:42:0a:00:00:07  
          inet addr:10.0.0.7  Bcast:10.0.0.255  Mask:255.255.255.0
          UP BROADCAST RUNNING MULTICAST  MTU:1450  Metric:1
          RX packets:12 errors:0 dropped:0 overruns:0 frame:0
          TX packets:10 errors:0 dropped:0 overruns:0 carrier:0
          collisions:0 txqueuelen:0 
          RX bytes:769 (769.0 B)  TX bytes:843 (843.0 B)

sudo nsenter --net=/var/run/docker/netns/47add5f8738d tcpdump -ni eth0
tcpdump: verbose output suppressed, use -v or -vv for full protocol decode
listening on eth0, link-type EN10MB (Ethernet), capture size 262144 bytes
18:41:38.310076 IP 10.0.0.3.41872 > 10.0.0.7.8080: Flags [S], seq 2289666031, win 28200, options [mss 1410,sackOK,TS val 142173 ecr 0,nop,wscale 7], length 0
18:41:38.310109 IP 10.0.0.7.8080 > 10.0.0.3.41872: Flags [S.], seq 1015952617, ack 2289666032, win 27960, options [mss 1410,sackOK,TS val 142173 ecr 142173,nop,wscale 7], length 0
18:41:38.310131 IP 10.0.0.3.41872 > 10.0.0.7.8080: Flags [.], ack 1, win 221, options [nop,nop,TS val 142173 ecr 142173], length 0
18:41:38.310175 IP 10.0.0.3.41872 > 10.0.0.7.8080: Flags [P.], seq 1:82, ack 1, win 221, options [nop,nop,TS val 142173 ecr 142173], length 81: HTTP: GET /ping HTTP/1.1
18:41:38.310181 IP 10.0.0.7.8080 > 10.0.0.3.41872: Flags [.], ack 82, win 219, options [nop,nop,TS val 142173 ecr 142173], length 0
18:41:38.310679 IP 10.0.0.7.8080 > 10.0.0.3.41872: Flags [P.], seq 1:284, ack 82, win 219, options [nop,nop,TS val 142173 ecr 142173], length 283: HTTP: HTTP/1.1 200 OK
18:41:38.310720 IP 10.0.0.3.41872 > 10.0.0.7.8080: Flags [.], ack 284, win 229, options [nop,nop,TS val 142173 ecr 142173], length 0

```

**Engine 19.03 with overlay network in DSR mode**

```
docker network create -d overlay --opt dsr testNet 
docker service create --name web1-19.03 --network=testNet --replicas=2 ehazlett/docker-demo
docker service create --name web2-19-03 --network=testNet --replicas=2 ehazlett/docker-demo
```

```
       "Services": {
            "web1-19-03": {
                "VIP": "10.0.1.2",
                "Ports": [],
                "LocalLBIndex": 256,
                "Tasks": [
                    {
                        "Name": "web1-19-03.1.hkj7li0bzedl9gnc27grtqzf2",
                        "EndpointID": "6b646333eb73a20dc94c405fdebecca3a8c16afb1ef6d9649a003b14ea9390d7",
                        "EndpointIP": "10.0.1.3",
                        "Info": {
                            "Host IP": "172.31.2.191"
                        }
                    },
                    {
                        "Name": "web1-19-03.2.rebdyeqteatlj9wbin17c97f0",
                        "EndpointID": "dacf3fd765b3fd22a878d70bc1438cda160e060ecfe131a2af617a3a5a51d2a6",
                        "EndpointIP": "10.0.1.4",
                        "Info": {
                            "Host IP": "172.31.11.25"
                        }
                    }
                ]
            },
            "web2-19-03": {
                "VIP": "10.0.1.7",
                "Ports": [],
                "LocalLBIndex": 257,
                "Tasks": [
                    {
                        "Name": "web2-19-03.2.vakbpq8hm50oyl7vpm7hqmnmk",
                        "EndpointID": "ff4c2b114a30b18e7fd8b05e7837280948d578732527c8daa927f3517e3be156",
                        "EndpointIP": "10.0.1.9",
                        "Info": {
                            "Host IP": "172.31.11.25"
                        }
                    },
                    {
                        "Name": "web2-19-03.1.wl09z53j6map3412jc21mftp5",
                        "EndpointID": "f675e869186f0375430b3cdc1471bfdd066035beec0117cfd5e8c2a2d1a69e80",
                        "EndpointIP": "10.0.1.8",
                        "Info": {
                            "Host IP": "172.31.2.191"
                        }
                    }
                ]
            }
```

Now when Service 1 (web1-1903) tries to reach Service 2 (web2-1903) via Service 2's VIP (10.0.1.7),
the Source IP and the destination IP (also the VIP) will be left intact

Performing a CURL from Service 1

```
nsenter --net=/var/run/docker/netns/af573e3b0125 ifconfig eth0
eth0      Link encap:Ethernet  HWaddr 02:42:0a:00:01:04  
          inet addr:10.0.1.4  Bcast:10.0.1.255  Mask:255.255.255.0
          UP BROADCAST RUNNING MULTICAST  MTU:1450  Metric:1
          RX packets:0 errors:0 dropped:0 overruns:0 frame:0
          TX packets:0 errors:0 dropped:0 overruns:0 carrier:0
          collisions:0 txqueuelen:0 
          RX bytes:0 (0.0 B)  TX bytes:0 (0.0 B)


sudo nsenter --net=/var/run/docker/netns/af573e3b0125 curl http://10.0.1.7:8080/ping
{"instance":"c6ccf0bf29f1","version":"0.1"}
```
TCPDUMP in Service 2

```
sudo nsenter --net=/var/run/docker/netns/ce54bfa0268c tcpdump -ni eth0
tcpdump: verbose output suppressed, use -v or -vv for full protocol decode
listening on eth0, link-type EN10MB (Ethernet), capture size 262144 bytes
20:22:04.139483 ARP, Request who-has 10.0.1.7 tell 10.0.1.4, length 28
20:22:04.139589 ARP, Request who-has 10.0.1.8 tell 10.0.1.5, length 28
20:22:04.845554 ARP, Request who-has 10.0.1.9 tell 10.0.1.5, length 28
20:22:04.845595 ARP, Reply 10.0.1.9 is-at 02:42:0a:00:01:09, length 28
20:22:04.845612 IP 10.0.1.4.57286 > 10.0.1.7.8080: Flags [S], seq 3962245588, win 28200, options [mss 1410,sackOK,TS val 1687942 ecr 0,nop,wscale 7], length 0
20:22:04.845646 ARP, Request who-has 10.0.1.4 tell 10.0.1.9, length 28
20:22:04.845660 ARP, Reply 10.0.1.4 is-at 02:42:0a:00:01:04, length 28
20:22:04.845663 IP 10.0.1.7.8080 > 10.0.1.4.57286: Flags [S.], seq 1794238477, ack 3962245589, win 27960, options [mss 1410,sackOK,TS val 1687942 ecr 1687942,nop,wscale 7], length 0
20:22:04.845712 IP 10.0.1.4.57286 > 10.0.1.7.8080: Flags [.], ack 1, win 221, options [nop,nop,TS val 1687942 ecr 1687942], length 0
20:22:04.845782 IP 10.0.1.4.57286 > 10.0.1.7.8080: Flags [P.], seq 1:82, ack 1, win 221, options [nop,nop,TS val 1687942 ecr 1687942], length 81: HTTP: GET /ping HTTP/1.1
20:22:04.845788 IP 10.0.1.7.8080 > 10.0.1.4.57286: Flags [.], ack 82, win 219, options [nop,nop,TS val 1687942 ecr 1687942], length 0
```

**Comment by igorkatz** [comment]
Yes, this works. The difference is only in the case when you perform a CURL from some task (container) of Service 1 to Service 1. In 18.03 client IP is endpoint IP of this specific task. In 19.03 client IP is VIP of this service (Service 1 in our case).
