### ISSUE TITLE
Inconsistent connectivity with `internal` networks in 25.0.3

### ISSUE THREAD

**Issue by thespad** [moby/moby#47354]
### Description

Since upgrading from 24.x to 25.0.3 I'm seeing inconsistent connectivity when using `internal` docker networks.

For example I have an internal network:
```yaml
  yacht-dockerproxy:
    name: yacht-dockerproxy
    internal: true
    driver: bridge
    ipam:
      config:
        - subnet: 172.19.0.24/29
```
And attempting to ping from one container on this network to another fails, either by hostname or IP. If I change it to `internal: false` then communication works again.

However, if I change it instead to, for example:
```yaml
  yacht-dockerproxy:
    name: yacht-dockerproxy
    internal: true
    driver: bridge
    ipam:
      config:
        - subnet: 172.23.0.24/29
```
Then communication *also* works.

I've removed all networks and containers, restarted the docker service, but the same issue persists.

Is it possible that this could be a factor?
```
 Default Address Pools:
   Base: 172.20.0.0/16, Size: 24
```

### Reproduce

1. Create an `internal` network with multiple attached containers
2. Attempt to ping/curl/etc between containers
3. If necessary change the assigned subnet and retest

### Expected behavior

Internal networks should reliably allow inter-container communication

### docker version

```bash
Client: Docker Engine - Community
 Version:           25.0.3
 API version:       1.44
 Go version:        go1.21.6
 Git commit:        4debf41
 Built:             Tue Feb  6 21:13:09 2024
 OS/Arch:           linux/amd64
 Context:           default

Server: Docker Engine - Community
 Engine:
  Version:          25.0.3
  API version:      1.44 (minimum version 1.24)
  Go version:       go1.21.6
  Git commit:       f417435
  Built:            Tue Feb  6 21:13:09 2024
  OS/Arch:          linux/amd64
  Experimental:     false
 containerd:
  Version:          1.6.28
  GitCommit:        ae07eda36dd25f8a1b98dfbf587313b99c0190bb
 runc:
  Version:          1.1.12
  GitCommit:        v1.1.12-0-g51d5e94
 docker-init:
  Version:          0.19.0
  GitCommit:        de40ad0
```

### docker info

```bash
Client: Docker Engine - Community
 Version:    25.0.3
 Context:    default
 Debug Mode: false
 Plugins:
  buildx: Docker Buildx (Docker Inc.)
    Version:  v0.12.1
    Path:     /usr/libexec/docker/cli-plugins/docker-buildx
  compose: Docker Compose (Docker Inc.)
    Version:  v2.24.5
    Path:     /home/****/.docker/cli-plugins/docker-compose
  scan: Docker Scan (Docker Inc.)
    Version:  v0.23.0
    Path:     /usr/libexec/docker/cli-plugins/docker-scan

Server:
 Containers: 65
  Running: 65
  Paused: 0
  Stopped: 0
 Images: 60
 Server Version: 25.0.3
 Storage Driver: overlay2
  Backing Filesystem: extfs
  Supports d_type: true
  Using metacopy: false
  Native Overlay Diff: true
  userxattr: false
 Logging Driver: local
 Cgroup Driver: systemd
 Cgroup Version: 2
 Plugins:
  Volume: local
  Network: bridge host ipvlan macvlan null overlay
  Log: awslogs fluentd gcplogs gelf journald json-file local splunk syslog
 Swarm: inactive
 Runtimes: io.containerd.runc.v2 runc crun
 Default Runtime: runc
 Init Binary: docker-init
 containerd version: ae07eda36dd25f8a1b98dfbf587313b99c0190bb
 runc version: v1.1.12-0-g51d5e94
 init version: de40ad0
 Security Options:
  apparmor
  seccomp
   Profile: builtin
  cgroupns
 Kernel Version: 5.15.0-94-generic
 Operating System: Ubuntu 22.04.3 LTS
 OSType: linux
 Architecture: x86_64
 CPUs: 8
 Total Memory: 15.61GiB
 Name: docker2
 ID: 67LS:QX2S:7P4H:CTCH:IGKD:4BKW:6HYY:46PB:LHNR:IXBV:CDSP:FXXJ
 Docker Root Dir: /var/lib/docker
 Debug Mode: false
 Username: *****
 Experimental: false
 Insecure Registries:
  127.0.0.0/8
 Live Restore Enabled: true
 Default Address Pools:
   Base: 172.20.0.0/16, Size: 24
```

**Comment by robmry** [comment]
Hi @thespad - thank you for raising this separate ticket. I've been unable to reproduce the problem ... I tried four subnets on Ubuntu 22.04.3, with docker 25.0.3.

Please could you grab the output of `docker network inspect` for a broken network, and `docker inspect` for a pair of containers that are unable to ping each other?

Also `ip a`, and `route -n` from inside those containers - if you can repro with an image that has those tools (like 'alpine', or anything based on it).

Do the ping or curl commands fail immediately with an error, or time out / get stuck waiting for responses?

(I don't think the default pool is likely to be related. Specifying a subnet means it's not used for the network, and it doesn't overlap with the subnets in your example.)

**Comment by thespad** [comment]
Sure. So:
```yaml
services:
  test1:
    image: lscr.io/linuxserver/baseimage-alpine:3.19
    container_name: test1
    networks:
      - test-net
    security_opt:
      - no-new-privileges=true

  test2:
    image: lscr.io/linuxserver/baseimage-alpine:3.19
    container_name: test2
    networks:
      - test-net
    security_opt:
      - no-new-privileges=true

networks:
  test-net:
    name: test-net
    internal: true
    driver: bridge
    ipam:
      config:
        - subnet: 172.19.0.32/29
```
test1:
```
# ip a
1: lo: <LOOPBACK,UP,LOWER_UP> mtu 65536 qdisc noqueue state UNKNOWN qlen 1000
    link/loopback 00:00:00:00:00:00 brd 00:00:00:00:00:00
    inet 127.0.0.1/8 scope host lo
       valid_lft forever preferred_lft forever
1287: eth0@if1288: <BROADCAST,MULTICAST,UP,LOWER_UP,M-DOWN> mtu 1500 qdisc noqueue state UP 
    link/ether 02:42:ac:13:00:22 brd ff:ff:ff:ff:ff:ff
    inet 172.19.0.34/29 brd 172.19.0.39 scope global eth0
       valid_lft forever preferred_lft forever
```
```
# route -n
Kernel IP routing table
Destination     Gateway         Genmask         Flags Metric Ref    Use Iface
172.19.0.32     0.0.0.0         255.255.255.248 U     0      0        0 eth0
```
```
# ping test2
PING test2 (172.19.0.35): 56 data bytes
^C
--- test2 ping statistics ---
5 packets transmitted, 0 packets received, 100% packet loss
```
test2:
```
# ip a
1: lo: <LOOPBACK,UP,LOWER_UP> mtu 65536 qdisc noqueue state UNKNOWN qlen 1000
    link/loopback 00:00:00:00:00:00 brd 00:00:00:00:00:00
    inet 127.0.0.1/8 scope host lo
       valid_lft forever preferred_lft forever
1289: eth0@if1290: <BROADCAST,MULTICAST,UP,LOWER_UP,M-DOWN> mtu 1500 qdisc noqueue state UP 
    link/ether 02:42:ac:13:00:23 brd ff:ff:ff:ff:ff:ff
    inet 172.19.0.35/29 brd 172.19.0.39 scope global eth0
       valid_lft forever preferred_lft forever
```
```
# route -n
Kernel IP routing table
Destination     Gateway         Genmask         Flags Metric Ref    Use Iface
172.19.0.32     0.0.0.0         255.255.255.248 U     0      0        0 eth0
```
```
# ping test1
PING test1 (172.19.0.34): 56 data bytes
^C
--- test1 ping statistics ---
9 packets transmitted, 0 packets received, 100% packet loss
```
`inspect`s for each container + network
[test1.txt](https://github.com/moby/moby/files/14201791/test1.txt)
[test2.txt](https://github.com/moby/moby/files/14201792/test2.txt)

[test-net.txt](https://github.com/moby/moby/files/14201793/test-net.txt)

Let me know if you need anything additional.

**Comment by thespad** [comment]
Oh and in case it's helpful, my full daemon.json
```json
{
  "live-restore" : true,
  "default-address-pools":
  [
    {"base":"172.20.0.0/16","size":24}
  ],
  "default-runtime": "runc",
  "runtimes": {
    "crun": {
      "path": "/usr/local/bin/crun"
    }
  },
  "features": {
    "buildkit" : true
  },
  "log-driver": "local"
}
```

**Comment by robmry** [comment]
Thanks @thespad ... I can't see anything unusual in that, apart from the failing pings. And I'm unable to repro with equivalents to your daemon.json and compose files (but a base alpine image).

We could take a look at docker's iptables rules, on the host ...

  sudo iptables-save
  sudo iptables -nvL -t filter

Are you running any sort of firewall on the host, 'ufw' perhaps? It might be worth checking that if you are.

**Comment by thespad** [comment]
No host firewall.

[iptables-filter.txt](https://github.com/moby/moby/files/14208258/iptables-filter.txt)
[iptables-save.txt](https://github.com/moby/moby/files/14208259/iptables-save.txt)

FWIW I also can't replicate the issue on my other Ubuntu 22.04.3 LTS amd64 docker host, but that is running docker rootless so it's not a direct comparison. I've also got an arm64 host running Ubuntu 22.04.3 LTS, which I can't replicate it on, and apart from being arm it should be broadly configured the same way as the affected host.

So it seems to be something specific to the configuration or environment of docker on that host, but I don't know what it could be (and don't really want to have to rebuild it just to test).

**Comment by robmry** [comment]
Ok, it doesn't look like the iptables rules are dropping packets. I think the next step is some inspection of the bridge and tcpdump-ing to see what's on the network.

You should be able to get the name of the bridge device with...

`BNAME=$(echo br-$(docker network inspect test-net -f '{{.Id }}' | cut -c -12))`

Then ...

```
ip a show dev $BNAME
brctl show $BNAME
brctl showmacs $BNAME
brctl showstp $BNAME
sudo tcpdump -xxv -i $BNAME
```

Also, best to capture `inspect` for the containers and network, assuming they've been re-created since the ones you sent before.

I'm not sure we'll get useful clues from any of that, but fingers-crossed. The next step might be to look at what's happening in the container / its network namespace, but that gets a bit more fiddly.

**Comment by thespad** [comment]
```
1356: br-0fc854e9e29b: <BROADCAST,MULTICAST,UP,LOWER_UP> mtu 1500 qdisc noqueue state UP group default 
    link/ether 02:42:b0:6f:5d:ec brd ff:ff:ff:ff:ff:ff
    inet6 fe80::42:b0ff:fe6f:5dec/64 scope link 
       valid_lft forever preferred_lft forever

bridge name     bridge id               STP enabled     interfaces
br-0fc854e9e29b         8000.0242b06f5dec       no              veth6aea32d
                                                        veth887e315

port no mac addr                is local?       ageing timer
  1     02:42:ac:13:00:22       no                22.80
  2     02:42:ac:13:00:23       no                22.80
  2     f6:6b:57:3e:24:06       yes                0.00
  2     f6:6b:57:3e:24:06       yes                0.00
  1     fe:e9:a6:d1:ef:37       yes                0.00
  1     fe:e9:a6:d1:ef:37       yes                0.00

br-0fc854e9e29b
 bridge id              8000.0242b06f5dec
 designated root        8000.0242b06f5dec
 root port                 0                    path cost                  0
 max age                  20.00                 bridge max age            20.00
 hello time                2.00                 bridge hello time          2.00
 forward delay            15.00                 bridge forward delay      15.00
 ageing time             300.00
 hello timer               0.00                 tcn timer                  0.00
 topology change timer     0.00                 gc timer                 221.01
 flags


veth6aea32d (1)
 port id                8001                    state                forwarding
 designated root        8000.0242b06f5dec       path cost                  2
 designated bridge      8000.0242b06f5dec       message age timer          0.00
 designated port        8001                    forward delay timer        0.00
 designated cost           0                    hold timer                 0.00
 flags

veth887e315 (2)
 port id                8002                    state                forwarding
 designated root        8000.0242b06f5dec       path cost                  2
 designated bridge      8000.0242b06f5dec       message age timer          0.00
 designated port        8002                    forward delay timer        0.00
 designated cost           0                    hold timer                 0.00
 flags
```
Ping test1->test2
```
tcpdump: listening on br-0fc854e9e29b, link-type EN10MB (Ethernet), snapshot length 262144 bytes
21:58:11.151114 IP (tos 0x0, ttl 64, id 2998, offset 0, flags [DF], proto ICMP (1), length 84)
    172.19.0.35 > 172.19.0.34: ICMP echo request, id 178, seq 0, length 64
        0x0000:  0242 ac13 0022 0242 ac13 0023 0800 4500
        0x0010:  0054 0bb6 4000 4001 d687 ac13 0023 ac13
        0x0020:  0022 0800 1d6e 00b2 0000 f5ae e430 0000
        0x0030:  0000 0000 0000 0000 0000 0000 0000 0000
        0x0040:  0000 0000 0000 0000 0000 0000 0000 0000
        0x0050:  0000 0000 0000 0000 0000 0000 0000 0000
        0x0060:  0000
21:58:12.151208 IP (tos 0x0, ttl 64, id 3101, offset 0, flags [DF], proto ICMP (1), length 84)
    172.19.0.35 > 172.19.0.34: ICMP echo request, id 178, seq 1, length 64
        0x0000:  0242 ac13 0022 0242 ac13 0023 0800 4500
        0x0010:  0054 0c1d 4000 4001 d620 ac13 0023 ac13
        0x0020:  0022 0800 762a 00b2 0001 8df1 f330 0000
        0x0030:  0000 0000 0000 0000 0000 0000 0000 0000
        0x0040:  0000 0000 0000 0000 0000 0000 0000 0000
        0x0050:  0000 0000 0000 0000 0000 0000 0000 0000
        0x0060:  0000
21:58:13.151288 IP (tos 0x0, ttl 64, id 3159, offset 0, flags [DF], proto ICMP (1), length 84)
    172.19.0.35 > 172.19.0.34: ICMP echo request, id 178, seq 2, length 64
        0x0000:  0242 ac13 0022 0242 ac13 0023 0800 4500
        0x0010:  0054 0c57 4000 4001 d5e6 ac13 0023 ac13
        0x0020:  0022 0800 d4e6 00b2 0002 1f34 0331 0000
        0x0030:  0000 0000 0000 0000 0000 0000 0000 0000
        0x0040:  0000 0000 0000 0000 0000 0000 0000 0000
        0x0050:  0000 0000 0000 0000 0000 0000 0000 0000
        0x0060:  0000
21:58:14.151421 IP (tos 0x0, ttl 64, id 3314, offset 0, flags [DF], proto ICMP (1), length 84)
    172.19.0.35 > 172.19.0.34: ICMP echo request, id 178, seq 3, length 64
        0x0000:  0242 ac13 0022 0242 ac13 0023 0800 4500
        0x0010:  0054 0cf2 4000 4001 d54b ac13 0023 ac13
        0x0020:  0022 0800 02a3 00b2 0003 e276 1231 0000
        0x0030:  0000 0000 0000 0000 0000 0000 0000 0000
        0x0040:  0000 0000 0000 0000 0000 0000 0000 0000
        0x0050:  0000 0000 0000 0000 0000 0000 0000 0000
        0x0060:  0000
21:58:15.151519 IP (tos 0x0, ttl 64, id 3388, offset 0, flags [DF], proto ICMP (1), length 84)
    172.19.0.35 > 172.19.0.34: ICMP echo request, id 178, seq 4, length 64
        0x0000:  0242 ac13 0022 0242 ac13 0023 0800 4500
        0x0010:  0054 0d3c 4000 4001 d501 ac13 0023 ac13
        0x0020:  0022 0800 4e5f 00b2 0004 87b9 2131 0000
        0x0030:  0000 0000 0000 0000 0000 0000 0000 0000
        0x0040:  0000 0000 0000 0000 0000 0000 0000 0000
        0x0050:  0000 0000 0000 0000 0000 0000 0000 0000
        0x0060:  0000
```
And vice versa (plus some ARP traffic)
```
tcpdump: listening on br-0fc854e9e29b, link-type EN10MB (Ethernet), snapshot length 262144 bytes
21:59:03.631909 ARP, Ethernet (len 6), IPv4 (len 4), Request who-has 172.19.0.35 tell 172.19.0.34, length 28
        0x0000:  ffff ffff ffff 0242 ac13 0022 0806 0001
        0x0010:  0800 0604 0001 0242 ac13 0022 ac13 0022
        0x0020:  0000 0000 0000 ac13 0023
21:59:03.631930 ARP, Ethernet (len 6), IPv4 (len 4), Reply 172.19.0.35 is-at 02:42:ac:13:00:23 (oui Unknown), length 28
        0x0000:  0242 ac13 0022 0242 ac13 0023 0806 0001
        0x0010:  0800 0604 0002 0242 ac13 0023 ac13 0023
        0x0020:  0242 ac13 0022 ac13 0022
21:59:03.631933 IP (tos 0x0, ttl 64, id 419, offset 0, flags [DF], proto ICMP (1), length 84)
    172.19.0.34 > 172.19.0.35: ICMP echo request, id 170, seq 0, length 64
        0x0000:  0242 ac13 0023 0242 ac13 0022 0800 4500
        0x0010:  0054 01a3 4000 4001 e09a ac13 0022 ac13
        0x0020:  0023 0800 e4a7 00aa 0000 0d7a 0534 0000
        0x0030:  0000 0000 0000 0000 0000 0000 0000 0000
        0x0040:  0000 0000 0000 0000 0000 0000 0000 0000
        0x0050:  0000 0000 0000 0000 0000 0000 0000 0000
        0x0060:  0000
21:59:04.632031 IP (tos 0x0, ttl 64, id 560, offset 0, flags [DF], proto ICMP (1), length 84)
    172.19.0.34 > 172.19.0.35: ICMP echo request, id 170, seq 1, length 64
        0x0000:  0242 ac13 0023 0242 ac13 0022 0800 4500
        0x0010:  0054 0230 4000 4001 e00d ac13 0022 ac13
        0x0020:  0023 0800 1f64 00aa 0001 c3bc 1434 0000
        0x0030:  0000 0000 0000 0000 0000 0000 0000 0000
        0x0040:  0000 0000 0000 0000 0000 0000 0000 0000
        0x0050:  0000 0000 0000 0000 0000 0000 0000 0000
        0x0060:  0000
21:59:05.632109 IP (tos 0x0, ttl 64, id 582, offset 0, flags [DF], proto ICMP (1), length 84)
    172.19.0.34 > 172.19.0.35: ICMP echo request, id 170, seq 2, length 64
        0x0000:  0242 ac13 0023 0242 ac13 0022 0800 4500
        0x0010:  0054 0246 4000 4001 dff7 ac13 0022 ac13
        0x0020:  0023 0800 7f20 00aa 0002 54ff 2334 0000
        0x0030:  0000 0000 0000 0000 0000 0000 0000 0000
        0x0040:  0000 0000 0000 0000 0000 0000 0000 0000
        0x0050:  0000 0000 0000 0000 0000 0000 0000 0000
        0x0060:  0000
21:59:06.632210 IP (tos 0x0, ttl 64, id 754, offset 0, flags [DF], proto ICMP (1), length 84)
    172.19.0.34 > 172.19.0.35: ICMP echo request, id 170, seq 3, length 64
        0x0000:  0242 ac13 0023 0242 ac13 0022 0800 4500
        0x0010:  0054 02f2 4000 4001 df4b ac13 0022 ac13
        0x0020:  0023 0800 c8dc 00aa 0003 fb41 3334 0000
        0x0030:  0000 0000 0000 0000 0000 0000 0000 0000
        0x0040:  0000 0000 0000 0000 0000 0000 0000 0000
        0x0050:  0000 0000 0000 0000 0000 0000 0000 0000
        0x0060:  0000
```
Inspects:
[test1.txt](https://github.com/moby/moby/files/14215064/test1.txt)
[test2.txt](https://github.com/moby/moby/files/14215065/test2.txt)
[test-net.txt](https://github.com/moby/moby/files/14215066/test-net.txt)

No change to the compose from before.

**Comment by robmry** [comment]
Hmm, I'm running out of ideas ... the broadcast ARP makes it from one container to the other, and the unicast response makes it back - and that must be happening in both directions. But, either the ping request doesn't make it out of the bridge to the container, or the response doesn't make it back to the bridge. And, we know iptables rules on the host aren't dropping anything.

We could have a look at traffic on the container's interface, and check iptables rules in the container - although there should only be NAT rules to catch DNS requests in there.

So, for each container ...

```
PID=$(docker container inspect -f '{{.State.Pid}}' test1)
sudo nsenter -t $PID -n ip a
sudo nsenter -t $PID -n iptables-save
sudo nsenter -t $PID -n tcpdump -xxv -i eth0
```

**Comment by thespad** [comment]
test1
```
1: lo: <LOOPBACK,UP,LOWER_UP> mtu 65536 qdisc noqueue state UNKNOWN group default qlen 1000
    link/loopback 00:00:00:00:00:00 brd 00:00:00:00:00:00
    inet 127.0.0.1/8 scope host lo
       valid_lft forever preferred_lft forever
1359: eth0@if1360: <BROADCAST,MULTICAST,UP,LOWER_UP> mtu 1500 qdisc noqueue state UP group default 
    link/ether 02:42:ac:13:00:23 brd ff:ff:ff:ff:ff:ff link-netnsid 0
    inet 172.19.0.35/29 brd 172.19.0.39 scope global eth0
       valid_lft forever preferred_lft forever
```
[test1-iptables.txt](https://github.com/moby/moby/files/14220371/test1-iptables.txt)

test2
```
1: lo: <LOOPBACK,UP,LOWER_UP> mtu 65536 qdisc noqueue state UNKNOWN group default qlen 1000
    link/loopback 00:00:00:00:00:00 brd 00:00:00:00:00:00
    inet 127.0.0.1/8 scope host lo
       valid_lft forever preferred_lft forever
1357: eth0@if1358: <BROADCAST,MULTICAST,UP,LOWER_UP> mtu 1500 qdisc noqueue state UP group default 
    link/ether 02:42:ac:13:00:22 brd ff:ff:ff:ff:ff:ff link-netnsid 0
    inet 172.19.0.34/29 brd 172.19.0.39 scope global eth0
       valid_lft forever preferred_lft forever
```
[test2-iptables.txt](https://github.com/moby/moby/files/14220378/test2-iptables.txt)

This is weird, however, pinging test1->test2, tcpdump from test1:
```
tcpdump: listening on eth0, link-type EN10MB (Ethernet), snapshot length 262144 bytes
10:11:15.394692 ARP, Ethernet (len 6), IPv4 (len 4), Request who-has 172.19.0.34 tell 172.19.0.35, length 28
        0x0000:  ffff ffff ffff 0242 ac13 0023 0806 0001
        0x0010:  0800 0604 0001 0242 ac13 0023 ac13 0023
        0x0020:  0000 0000 0000 ac13 0022
10:11:15.394737 ARP, Ethernet (len 6), IPv4 (len 4), Reply 172.19.0.34 is-at 02:42:ac:13:00:22 (oui Unknown), length 28
        0x0000:  0242 ac13 0023 0242 ac13 0022 0806 0001
        0x0010:  0800 0604 0002 0242 ac13 0022 ac13 0022
        0x0020:  0242 ac13 0023 ac13 0023
10:11:15.394739 IP (tos 0x0, ttl 64, id 59724, offset 0, flags [DF], proto ICMP (1), length 84)
    172.19.0.35 > 172.19.0.34: ICMP echo request, id 245, seq 0, length 64
        0x0000:  0242 ac13 0022 0242 ac13 0023 0800 4500
        0x0010:  0054 e94c 4000 4001 f8f0 ac13 0023 ac13
        0x0020:  0022 0800 fea1 00f5 0000 69fa 8e6e 0000
        0x0030:  0000 0000 0000 0000 0000 0000 0000 0000
        0x0040:  0000 0000 0000 0000 0000 0000 0000 0000
        0x0050:  0000 0000 0000 0000 0000 0000 0000 0000
        0x0060:  0000
10:11:16.394827 IP (tos 0x0, ttl 64, id 59934, offset 0, flags [DF], proto ICMP (1), length 84)
    172.19.0.35 > 172.19.0.34: ICMP echo request, id 245, seq 1, length 64
        0x0000:  0242 ac13 0022 0242 ac13 0023 0800 4500
        0x0010:  0054 ea1e 4000 4001 f81e ac13 0023 ac13
        0x0020:  0022 0800 2a5e 00f5 0001 2e3d 9e6e 0000
        0x0030:  0000 0000 0000 0000 0000 0000 0000 0000
        0x0040:  0000 0000 0000 0000 0000 0000 0000 0000
        0x0050:  0000 0000 0000 0000 0000 0000 0000 0000
        0x0060:  0000
10:11:17.394943 IP (tos 0x0, ttl 64, id 60076, offset 0, flags [DF], proto ICMP (1), length 84)
    172.19.0.35 > 172.19.0.34: ICMP echo request, id 245, seq 2, length 64
        0x0000:  0242 ac13 0022 0242 ac13 0023 0800 4500
        0x0010:  0054 eaac 4000 4001 f790 ac13 0023 ac13
        0x0020:  0022 0800 661a 00f5 0002 e37f ad6e 0000
        0x0030:  0000 0000 0000 0000 0000 0000 0000 0000
        0x0040:  0000 0000 0000 0000 0000 0000 0000 0000
        0x0050:  0000 0000 0000 0000 0000 0000 0000 0000
        0x0060:  0000
10:11:18.395052 IP (tos 0x0, ttl 64, id 60206, offset 0, flags [DF], proto ICMP (1), length 84)
    172.19.0.35 > 172.19.0.34: ICMP echo request, id 245, seq 3, length 64
        0x0000:  0242 ac13 0022 0242 ac13 0023 0800 4500
        0x0010:  0054 eb2e 4000 4001 f70e ac13 0023 ac13
        0x0020:  0022 0800 aad6 00f5 0003 8fc2 bc6e 0000
        0x0030:  0000 0000 0000 0000 0000 0000 0000 0000
        0x0040:  0000 0000 0000 0000 0000 0000 0000 0000
        0x0050:  0000 0000 0000 0000 0000 0000 0000 0000
        0x0060:  0000
```
Fairly normal, but test2:
```
tcpdump: listening on eth0, link-type EN10MB (Ethernet), snapshot length 262144 bytes
10:11:15.394718 ARP, Ethernet (len 6), IPv4 (len 4), Request who-has 172.19.0.34 tell 172.19.0.35, length 28
        0x0000:  ffff ffff ffff 0242 ac13 0023 0806 0001
        0x0010:  0800 0604 0001 0242 ac13 0023 ac13 0023
        0x0020:  0000 0000 0000 ac13 0022
10:11:15.394733 ARP, Ethernet (len 6), IPv4 (len 4), Reply 172.19.0.34 is-at 02:42:ac:13:00:22 (oui Unknown), length 28
        0x0000:  0242 ac13 0023 0242 ac13 0022 0806 0001
        0x0010:  0800 0604 0002 0242 ac13 0022 ac13 0022
        0x0020:  0242 ac13 0023 ac13 0023
10:11:15.394768 IP (tos 0x0, ttl 64, id 59724, offset 0, flags [DF], proto ICMP (1), length 84)
    192.168.0.17 > 172.19.0.34: ICMP echo request, id 245, seq 0, length 64
        0x0000:  0242 ac13 0022 0242 ac13 0023 0800 4500
        0x0010:  0054 e94c 4000 4001 e46d c0a8 0011 ac13
        0x0020:  0022 0800 fea1 00f5 0000 69fa 8e6e 0000
        0x0030:  0000 0000 0000 0000 0000 0000 0000 0000
        0x0040:  0000 0000 0000 0000 0000 0000 0000 0000
        0x0050:  0000 0000 0000 0000 0000 0000 0000 0000
        0x0060:  0000
10:11:16.394855 IP (tos 0x0, ttl 64, id 59934, offset 0, flags [DF], proto ICMP (1), length 84)
    192.168.0.17 > 172.19.0.34: ICMP echo request, id 245, seq 1, length 64
        0x0000:  0242 ac13 0022 0242 ac13 0023 0800 4500
        0x0010:  0054 ea1e 4000 4001 e39b c0a8 0011 ac13
        0x0020:  0022 0800 2a5e 00f5 0001 2e3d 9e6e 0000
        0x0030:  0000 0000 0000 0000 0000 0000 0000 0000
        0x0040:  0000 0000 0000 0000 0000 0000 0000 0000
        0x0050:  0000 0000 0000 0000 0000 0000 0000 0000
        0x0060:  0000
10:11:17.394974 IP (tos 0x0, ttl 64, id 60076, offset 0, flags [DF], proto ICMP (1), length 84)
    192.168.0.17 > 172.19.0.34: ICMP echo request, id 245, seq 2, length 64
        0x0000:  0242 ac13 0022 0242 ac13 0023 0800 4500
        0x0010:  0054 eaac 4000 4001 e30d c0a8 0011 ac13
        0x0020:  0022 0800 661a 00f5 0002 e37f ad6e 0000
        0x0030:  0000 0000 0000 0000 0000 0000 0000 0000
        0x0040:  0000 0000 0000 0000 0000 0000 0000 0000
        0x0050:  0000 0000 0000 0000 0000 0000 0000 0000
        0x0060:  0000
10:11:18.395081 IP (tos 0x0, ttl 64, id 60206, offset 0, flags [DF], proto ICMP (1), length 84)
    192.168.0.17 > 172.19.0.34: ICMP echo request, id 245, seq 3, length 64
        0x0000:  0242 ac13 0022 0242 ac13 0023 0800 4500
        0x0010:  0054 eb2e 4000 4001 e28b c0a8 0011 ac13
        0x0020:  0022 0800 aad6 00f5 0003 8fc2 bc6e 0000
        0x0030:  0000 0000 0000 0000 0000 0000 0000 0000
        0x0040:  0000 0000 0000 0000 0000 0000 0000 0000
        0x0050:  0000 0000 0000 0000 0000 0000 0000 0000
        0x0060:  0000
```
192.168.0.17 is the host IP. Same thing pinging in the other direction; source shows both container IPs, destination shows source as the host IP.

If I set the bridge to `internal: false` then it looks normal:
```
10:14:40.627320 IP (tos 0x0, ttl 64, id 21332, offset 0, flags [DF], proto ICMP (1), length 84)
    172.19.0.33 > 172.19.0.35: ICMP echo request, id 161, seq 1, length 64
        0x0000:  0242 ac13 0023 0242 ac13 0022 0800 4500
        0x0010:  0054 5354 4000 4001 8eea ac13 0021 ac13
        0x0020:  0023 0800 ee4e 00a1 0001 3e94 ca7a 0000
        0x0030:  0000 0000 0000 0000 0000 0000 0000 0000
        0x0040:  0000 0000 0000 0000 0000 0000 0000 0000
        0x0050:  0000 0000 0000 0000 0000 0000 0000 0000
        0x0060:  0000
10:14:40.627334 IP (tos 0x0, ttl 64, id 29002, offset 0, flags [none], proto ICMP (1), length 84)
    172.19.0.35 > 172.19.0.33: ICMP echo reply, id 161, seq 1, length 64
        0x0000:  0242 35d4 c001 0242 ac13 0023 0800 4500
        0x0010:  0054 714a 0000 4001 b0f4 ac13 0023 ac13
        0x0020:  0021 0000 f64e 00a1 0001 3e94 ca7a 0000
        0x0030:  0000 0000 0000 0000 0000 0000 0000 0000
        0x0040:  0000 0000 0000 0000 0000 0000 0000 0000
        0x0050:  0000 0000 0000 0000 0000 0000 0000 0000
        0x0060:  0000
```
and
```
10:14:40.627291 IP (tos 0x0, ttl 64, id 21332, offset 0, flags [DF], proto ICMP (1), length 84)
    172.19.0.34 > 172.19.0.35: ICMP echo request, id 161, seq 1, length 64
        0x0000:  0242 ac13 0023 0242 ac13 0022 0800 4500
        0x0010:  0054 5354 4000 4001 8ee9 ac13 0022 ac13
        0x0020:  0023 0800 ee4e 00a1 0001 3e94 ca7a 0000
        0x0030:  0000 0000 0000 0000 0000 0000 0000 0000
        0x0040:  0000 0000 0000 0000 0000 0000 0000 0000
        0x0050:  0000 0000 0000 0000 0000 0000 0000 0000
        0x0060:  0000
10:14:40.627353 IP (tos 0x0, ttl 64, id 29002, offset 0, flags [none], proto ICMP (1), length 84)
    172.19.0.35 > 172.19.0.34: ICMP echo reply, id 161, seq 1, length 64
        0x0000:  0242 ac13 0022 0242 ac13 0023 0800 4500
        0x0010:  0054 714a 0000 4001 b0f3 ac13 0023 ac13
        0x0020:  0022 0000 f64e 00a1 0001 3e94 ca7a 0000
        0x0030:  0000 0000 0000 0000 0000 0000 0000 0000
        0x0040:  0000 0000 0000 0000 0000 0000 0000 0000
        0x0050:  0000 0000 0000 0000 0000 0000 0000 0000
        0x0060:  0000
```

**Comment by robmry** [comment]
Thank you - and yes, that is very surprising! Not sure what it could be at the moment, will have to think about it and ask around.

**Comment by robmry** [comment]
As an experiment - to eliminate a difference between internal and other networks, we could try adding an address to the bridge (which was removed in 25.0.0, but will be put back by https://github.com/moby/moby/pull/47356).

So, for this subnet, it'd be ...

`sudo ip a add 172.19.0.31 dev $(echo br-$(docker network inspect test-net -f '{{.Id }}' | cut -c -12))`

If it doesn't make a difference once pings have started, could also try it on a network that hasn't pinged yet.

**Comment by robmry** [comment]
Sorry - wrong IP address ...

`sudo ip a add 172.19.0.34 dev $(echo br-$(docker network inspect test-net -f '{{.Id }}' | cut -c -12))`

**Comment by thespad** [comment]
OK, that's *really* confusing.

So in test1 I see the ICMP requests
```
11:08:31.519455 IP (tos 0x0, ttl 64, id 28707, offset 0, flags [DF], proto ICMP (1), length 84)
    172.19.0.34 > 172.19.0.35: ICMP echo request, id 161, seq 1, length 64
        0x0000:  0242 ac13 0023 0242 ac13 0022 0800 4500
        0x0010:  0054 7023 4000 4001 721a ac13 0022 ac13
        0x0020:  0023 0800 db0d 00a1 0001 be14 5e3b 0000
        0x0030:  0000 0000 0000 0000 0000 0000 0000 0000
        0x0040:  0000 0000 0000 0000 0000 0000 0000 0000
        0x0050:  0000 0000 0000 0000 0000 0000 0000 0000
        0x0060:  0000
```
And in test2 I see the request (from .33 not .34) and it sends a reply, but the reply never makes it back to test1, presumably because it's being sent to the wrong IP
```
11:08:31.519492 IP (tos 0x0, ttl 64, id 28707, offset 0, flags [DF], proto ICMP (1), length 84)
    172.19.0.33 > 172.19.0.35: ICMP echo request, id 161, seq 1, length 64
        0x0000:  0242 ac13 0023 0242 ac13 0022 0800 4500
        0x0010:  0054 7023 4000 4001 721b ac13 0021 ac13
        0x0020:  0023 0800 db0d 00a1 0001 be14 5e3b 0000
        0x0030:  0000 0000 0000 0000 0000 0000 0000 0000
        0x0040:  0000 0000 0000 0000 0000 0000 0000 0000
        0x0050:  0000 0000 0000 0000 0000 0000 0000 0000
        0x0060:  0000
11:08:31.519509 IP (tos 0x0, ttl 64, id 8338, offset 0, flags [none], proto ICMP (1), length 84)
    172.19.0.35 > 172.19.0.33: ICMP echo reply, id 161, seq 1, length 64
        0x0000:  0242 a893 b8fe 0242 ac13 0023 0800 4500
        0x0010:  0054 2092 0000 4001 01ad ac13 0023 ac13
        0x0020:  0021 0000 e30d 00a1 0001 be14 5e3b 0000
        0x0030:  0000 0000 0000 0000 0000 0000 0000 0000
        0x0040:  0000 0000 0000 0000 0000 0000 0000 0000
        0x0050:  0000 0000 0000 0000 0000 0000 0000 0000
        0x0060:  0000
```
```
$ docker exec test1 ping test2
PING test2 (172.19.0.35): 56 data bytes
^C
--- test2 ping statistics ---
8 packets transmitted, 0 packets received, 100% packet loss
```

**Comment by robmry** [comment]
Oh, wow! That must be a massive clue. I guess the host's address must also have got involved by the same route as the bridge's, but I don't know what that route could be at the moment ...

**Comment by robmry** [comment]
Let's try taking a look at some more iptables data ...

```
echo === iptables-save host ===
sudo iptables-save
echo === iptables-save test1  ===
sudo nsenter -t $(docker container inspect -f '{{.State.Pid}}' test1) -n iptables-save
echo === iptables-save test2  ===
sudo nsenter -t $(docker container inspect -f '{{.State.Pid}}' test2) -n iptables-save
echo === iptables nat host ===
sudo iptables -nvL -t nat
echo === iptables nat test1 ===
sudo nsenter -t $(docker container inspect -f '{{.State.Pid}}' test1) -n iptables -nvL -t nat
echo === iptables nat test2 ===
sudo nsenter -t $(docker container inspect -f '{{.State.Pid}}' test2) -n iptables -nvL -t nat
```

**Comment by thespad** [comment]
[host-iptables.txt](https://github.com/moby/moby/files/14222210/host-iptables.txt)
[host-iptables-nat.txt](https://github.com/moby/moby/files/14222211/host-iptables-nat.txt)
[test1-iptables.txt](https://github.com/moby/moby/files/14222212/test1-iptables.txt)
[test1-iptables-nat.txt](https://github.com/moby/moby/files/14222213/test1-iptables-nat.txt)
[test2-iptables.txt](https://github.com/moby/moby/files/14222214/test2-iptables.txt)
[test2-iptables-nat.txt](https://github.com/moby/moby/files/14222215/test2-iptables-nat.txt)

**Comment by thespad** [comment]
I did notice this

> -A POSTROUTING -s 172.19.0.0/16 ! -o br-aa3ecd91e2ff -j MASQUERADE

But `br-aa3ecd91e2ff` doesn't seem to exist anywhere. Not sure where it's come from.

Restarted the docker service but it's still there.

**Comment by robmry** [comment]
Interesting - thank you, and thank you for your patience and help investigating.

I'm glad it's working now, but it is odd. Something not cleaned up properly I suppose - it will be interesting to know if it comes back ... maybe on another daemon restart as well as a reboot?

**Comment by robmry** [comment]
The host has a few 'filter' rules for that bridge, they probably need to be removed too.

**Comment by thespad** [comment]
OK, so I stopped the docker service, removed all lingering docker rules from iptables, rebooted the host, and none of them came back.

As far as I can tell everything is now working correctly with internal networks but I'll continue to keep an eye on things just in case.

Still no idea where those rules came from, or more importantly why they were still there, but the host is over 3 years old so it could have been there literally years until the 25.x changes allowed it to have an impact.

Appreciate your help in troubleshooting this.

**Comment by robmry** [comment]
That's good news - thank you for the update.
