### ISSUE TITLE
Can't reach container's default route. No network at all.

### ISSUE THREAD

**Issue by CapSel** [moby/moby#35785]
**Steps to reproduce the issue:**
1. install archlinux with docker ;)
2. clear firewall
2. start docker
3. start container
```
$ docker run -it --rm --privileged busybox ping -c 10 172.17.0.1
PING 172.17.0.1 (172.17.0.1): 56 data bytes

--- 172.17.0.1 ping statistics ---
10 packets transmitted, 0 packets received, 100% packet loss
```

```
# tcpdump -Avvnni docker0
tcpdump: listening on docker0, link-type EN10MB (Ethernet), capture size 262144 bytes
11:43:16.046066 ARP, Ethernet (len 6), IPv4 (len 4), Request who-has 172.17.0.1 tell 172.17.0.2, length 28
.........B..................
11:43:17.113506 ARP, Ethernet (len 6), IPv4 (len 4), Request who-has 172.17.0.1 tell 172.17.0.2, length 28
.........B..................
11:43:18.153488 ARP, Ethernet (len 6), IPv4 (len 4), Request who-has 172.17.0.1 tell 172.17.0.2, length 28
.........B..................
^C
3 packets captured
3 packets received by filter
0 packets dropped by kernel
```

```
# ifconfig docker0
docker0: flags=4099<UP,BROADCAST,MULTICAST>  mtu 1500
        inet 172.17.0.1  netmask 255.255.0.0  broadcast 0.0.0.0
        inet6 fe80::42:fdff:fed2:e0e3  prefixlen 64  scopeid 0x20<link>
        ether 02:42:fd:d2:e0:e3  txqueuelen 0  (Ethernet)
        RX packets 126  bytes 3528 (3.4 KiB)
        RX errors 0  dropped 0  overruns 0  frame 0
        TX packets 0  bytes 0 (0.0 B)
        TX errors 0  dropped 0 overruns 0  carrier 0  collisions 0
```

It just should work.

```
# docker version
Client:
 Version:      17.11.0-ce
 API version:  1.34
 Go version:   go1.9.2
 Git commit:   1caf76ce6b
 Built:        Sun Dec 10 10:15:57 2017
 OS/Arch:      linux/amd64

Server:
 Version:      17.11.0-ce
 API version:  1.34 (minimum version 1.12)
 Go version:   go1.9.2
 Git commit:   1caf76ce6b
 Built:        Sun Dec 10 10:16:13 2017
 OS/Arch:      linux/amd64
 Experimental: false
```

```
# docker version
Client:
 Version:      17.11.0-ce
 API version:  1.34
 Go version:   go1.9.2
 Git commit:   1caf76ce6b
 Built:        Sun Dec 10 10:15:57 2017
 OS/Arch:      linux/amd64

Server:
 Version:      17.11.0-ce
 API version:  1.34 (minimum version 1.12)
 Go version:   go1.9.2
 Git commit:   1caf76ce6b
 Built:        Sun Dec 10 10:16:13 2017
 OS/Arch:      linux/amd64
 Experimental: false
[localadmin@ki ~]# docker info
Containers: 0
 Running: 0
 Paused: 0
 Stopped: 0
Images: 2
Server Version: 17.11.0-ce
Storage Driver: btrfs
 Build Version: Btrfs v4.13.2
 Library Version: 102
Logging Driver: json-file
Cgroup Driver: cgroupfs
Plugins:
 Volume: local
 Network: bridge host macvlan null overlay
 Log: awslogs fluentd gcplogs gelf journald json-file logentries splunk syslog
Swarm: inactive
Runtimes: runc
Default Runtime: runc
Init Binary: docker-init
containerd version: 992280e8e265f491f7a624ab82f3e238be086e49
runc version: 0351df1c5a66838d0c392b4ac4cf9450de844e2d
init version: 949e6fa
Security Options:
 seccomp
  Profile: default
Kernel Version: 4.9.67-1-lts
Operating System: Arch Linux
OSType: linux
Architecture: x86_64
CPUs: 4
Total Memory: 11.55GiB
Name: ki
ID: 6FXO:KGTB:WLCQ:2N3S:EA6E:LPOO:KR4P:D5H2:Z7QZ:UY6L:ZYO7:BISL
Docker Root Dir: /var/lib/docker
Debug Mode (client): false
Debug Mode (server): false
Registry: https://index.docker.io/v1/
Experimental: false
Insecure Registries:
 127.0.0.0/8
Live Restore Enabled: false

```

Linux ki 4.9.67-1-lts #1 SMP Tue Dec 5 13:07:07 CET 2017 x86_64 GNU/Linux

```
# iptables-save
# Generated by iptables-save v1.6.1 on Wed Dec 13 12:09:45 2017
*nat
:PREROUTING ACCEPT [303:36624]
:INPUT ACCEPT [303:36624]
:OUTPUT ACCEPT [499:35410]
:POSTROUTING ACCEPT [495:35234]
:DOCKER - [0:0]
-A PREROUTING -m addrtype --dst-type LOCAL -j DOCKER
-A OUTPUT ! -d 127.0.0.0/8 -m addrtype --dst-type LOCAL -j DOCKER
-A POSTROUTING -s 172.17.0.0/16 ! -o docker0 -j MASQUERADE
-A POSTROUTING -s 172.18.0.0/16 ! -o br-6b794692f16a -j MASQUERADE
-A DOCKER -i docker0 -j RETURN
-A DOCKER -i br-6b794692f16a -j RETURN
COMMIT
# Completed on Wed Dec 13 12:09:45 2017
# Generated by iptables-save v1.6.1 on Wed Dec 13 12:09:45 2017
*filter
:INPUT ACCEPT [11104:5856772]
:FORWARD ACCEPT [0:0]
:OUTPUT ACCEPT [11056:1487848]
:DOCKER - [0:0]
:DOCKER-ISOLATION - [0:0]
:DOCKER-USER - [0:0]
-A FORWARD -j DOCKER-USER
-A FORWARD -j DOCKER-ISOLATION
-A FORWARD -o docker0 -m conntrack --ctstate RELATED,ESTABLISHED -j ACCEPT
-A FORWARD -o docker0 -j DOCKER
-A FORWARD -i docker0 ! -o docker0 -j ACCEPT
-A FORWARD -i docker0 -o docker0 -j ACCEPT
-A FORWARD -o br-6b794692f16a -m conntrack --ctstate RELATED,ESTABLISHED -j ACCEPT
-A FORWARD -o br-6b794692f16a -j DOCKER
-A FORWARD -i br-6b794692f16a ! -o br-6b794692f16a -j ACCEPT
-A FORWARD -i br-6b794692f16a -o br-6b794692f16a -j ACCEPT
-A DOCKER-ISOLATION -i br-6b794692f16a -o docker0 -j DROP
-A DOCKER-ISOLATION -i docker0 -o br-6b794692f16a -j DROP
-A DOCKER-ISOLATION -j RETURN
-A DOCKER-USER -j RETURN
COMMIT
# Completed on Wed Dec 13 12:09:45 2017
```
Creating `/etc/hosts` with single line `nameserver 8.8.8.8` does not help. Network works normally on host, does not work at all in container.

The only possible workaround is to add `--network=host`.

**Comment by breuerfelix** [comment]
I got the same problem. Have you ever got a fix for that ?

**Comment by breuerfelix** [comment]
Fixed it. I enabled DHCP in systemd and forgot to Match only the Ethernet Network Interface.  
So Systemd tried to also manage the docker0 Interface. Thats why Systemd overwrote the configuration that Docker did for this Network.

**Comment by thaJeztah** [comment]
Let me close this one, as the original report is quite old (and on a distro that's not officially supported, and known to periodically break docker)
