### ISSUE TITLE
Docker DNS not resolving certain addresses

### ISSUE THREAD

**Issue by sofam** [moby/moby#29398]
**Description**

Can't resolve certain domains (security.debian.org) from inside a container running on a Docker host in swarm mode.

The exact same `nslookup` works on the Docker host itself.

**Steps to reproduce the issue:**
1.  `docker exec -it <container ID> /bin/sh`
2. Run the following:
```
/go # nslookup security.debian.org
nslookup: can't resolve '(null)': Name does not resolve

nslookup: can't resolve 'security.debian.org': Try again
```

**Describe the results you received:**
I get `nslookup: can't resolve 'security.debian.org': Try again`.

**Describe the results you expected:**
```
Server:		168.63.129.16
Address:	168.63.129.16#53

Non-authoritative answer:
Name:	security.debian.org
Address: 195.20.242.89
Name:	security.debian.org
Address: 212.211.132.32
Name:	security.debian.org
Address: 212.211.132.250
security.debian.org	rdata_46 = A 8 3 300 20170113080228 20161214080228 26616 security.debian.org. YHXIBebtdCUWZrUQYH/7YxaTCC5sAc75AjqG62kVtGinDWISq00RJJnr arErmSYjkwnOI9CLuTHTBHITojwziLMb32ShnSLuKLv9y79tBO9y4von NqzKb0jL0ra7+NFhG2rPoqk4wro+w8h5THtlV7hJjWcBO0+4keMaIrz7 RIIt3LsdqbhODPifksnU29KqiX4q3+KLCeW191HXnFAzx7/wuCKeGLLR N1LV8E60VkrgWcls2mY8SrC5RolD0/GV
security.debian.org	rdata_46 = A 8 3 300 20170113080228 20161214080228 27264 security.debian.org. Ipaq1Mc+p8yhZ8qshhlWzj8QOLysgVv4+IjW1cThoMPkAvPClrzxyFw8 ZQ9ZB4ZKpuzc5tYeaT1QaE5VtIRyQYOIrJmjO8QL9sK0hav60aa/9XAD IsB3bo/WqRhU+czbijD2Thmou8G2h62TQ3sANIdi7iphpPLfzsBGvYLL 4x1VoDzcz8164NZyIqjz2prYRibaSWOsBrVDaWeTAFJ3Lng/FW8NXTtK GUwkYUopfVkkwaC4672qFYWDaJrs5dvZ
```

**Additional information you deem important (e.g. issue happens only occasionally):**
It happens reliably. The container uses the Docker DNS. 

tcpdump on the host shows that Docker communicates with the Azure DNS but the DNS replies do not end up in the container for some reason.
```
root@prodmgr1:~# tcpdump -i eth0 port 53
tcpdump: verbose output suppressed, use -v or -vv for full protocol decode
listening on eth0, link-type EN10MB (Ethernet), capture size 262144 bytes
11:39:24.028940 IP 172.16.0.4.45116 > 168.63.129.16.domain: 61501+ AAAA? security.debian.org. (37)
11:39:24.029140 IP 172.16.0.4.34565 > 168.63.129.16.domain: 60901+ A? security.debian.org. (37)
11:39:24.029941 IP 172.16.0.4.46180 > 168.63.129.16.domain: 36328+ PTR? 16.129.63.168.in-addr.arpa. (44)
11:39:24.113399 IP 168.63.129.16.domain > 172.16.0.4.45116: 61501 4/0/0 AAAA 2001:a78:5:1:216:35ff:fe7f:6ceb, AAAA 2001:a78:5:0:216:35ff:fe7f:be4f, RRSIG, RRSIG (579)
11:39:24.113472 IP 168.63.129.16.domain > 172.16.0.4.34565: 60901 5/0/0 A 212.211.132.250, A 212.211.132.32, A 195.20.242.89, RRSIG, RRSIG (571)
11:39:24.113560 IP 168.63.129.16.domain > 172.16.0.4.46180: 36328 NXDomain 0/1/0 (112)
11:39:24.114805 IP 172.16.0.4.56977 > 168.63.129.16.domain: 854+ PTR? 4.0.16.172.in-addr.arpa. (41)
11:39:26.531518 IP 172.16.0.4.33028 > 168.63.129.16.domain: 61501+ AAAA? security.debian.org. (37)
11:39:26.531531 IP 172.16.0.4.58915 > 168.63.129.16.domain: 60901+ A? security.debian.org. (37)
11:39:26.535494 IP 168.63.129.16.domain > 172.16.0.4.33028: 61501 4/0/0 AAAA 2001:a78:5:0:216:35ff:fe7f:be4f, AAAA 2001:a78:5:1:216:35ff:fe7f:6ceb, RRSIG, RRSIG (579)
11:39:26.535554 IP 168.63.129.16.domain > 172.16.0.4.58915: 60901 5/0/0 A 212.211.132.32, A 195.20.242.89, A 212.211.132.250, RRSIG, RRSIG (571)
```
**Output of `docker version`:**

```
Client:
 Version:      1.12.4
 API version:  1.24
 Go version:   go1.6.4
 Git commit:   1564f02
 Built:        Tue Dec 13 00:08:34 2016
 OS/Arch:      linux/amd64

Server:
 Version:      1.12.4
 API version:  1.24
 Go version:   go1.6.4
 Git commit:   1564f02
 Built:        Tue Dec 13 00:08:34 2016
 OS/Arch:      linux/amd64
```

**Output of `docker info`:**

```
Containers: 38
 Running: 2
 Paused: 0
 Stopped: 36
Images: 11
Server Version: 1.12.4
Storage Driver: aufs
 Root Dir: /var/lib/docker/aufs
 Backing Filesystem: extfs
 Dirs: 124
 Dirperm1 Supported: true
Logging Driver: json-file
Cgroup Driver: cgroupfs
Plugins:
 Volume: local
 Network: overlay host bridge null
Swarm: active
 NodeID: 04fskwcb5p93m448s03pbelvd
 Is Manager: true
 ClusterID: d2l1ktp0920uyqey500caiezj
 Managers: 3
 Nodes: 3
 Orchestration:
  Task History Retention Limit: 5
 Raft:
  Snapshot Interval: 10000
  Heartbeat Tick: 1
  Election Tick: 3
 Dispatcher:
  Heartbeat Period: 5 seconds
 CA Configuration:
  Expiry Duration: 3 months
 Node Address: 172.16.0.4
Runtimes: runc
Default Runtime: runc
Security Options: apparmor seccomp
Kernel Version: 4.4.0-53-generic
Operating System: Ubuntu 16.04.1 LTS
OSType: linux
Architecture: x86_64
CPUs: 2
Total Memory: 6.804 GiB
Name: prodmgr1
ID: SJG2:QO7A:DNZ6:LXBE:AC3M:45HR:TWR6:YNCQ:4Q66:62DE:KXZK:WLDN
Docker Root Dir: /var/lib/docker
Debug Mode (client): false
Debug Mode (server): false
Username: econdockerplayground
Registry: https://index.docker.io/v1/
WARNING: No swap limit support
Insecure Registries:
 127.0.0.0/8
```

**Additional environment details (AWS, VirtualBox, physical, etc.):**
Running on Azure.

**Comment by sofam** [comment]
It doesn't work if I force the use of an external DNS inside the container either. It works on the Docker host in both the following examples:
Using Azure DNS:
```
/go # nslookup deb.debian.org 168.63.129.16
Server:    168.63.129.16
Address 1: 168.63.129.16

nslookup: can't resolve 'deb.debian.org': Try again
```
Using Google DNS:
```
/go # nslookup deb.debian.org 8.8.8.8
Server:    8.8.8.8
Address 1: 8.8.8.8 google-public-dns-a.google.com

nslookup: can't resolve 'deb.debian.org': Try again
```

**Comment by sanimej** [comment]
@sofam Docker embedded DNS server is used for containers attached to user defined networks. Looks like you are using the default bridge network. In that case the external nameservers are directly populated in the container's resolv.conf file. Looks like the lookup fails for any external query. Are you able to do a direct ping external IP addresses from the container ?

**Comment by sofam** [comment]
@sanimej this is a container on a Swarm overlay network, I have created two overlay networks called "private" and "public". The Docker container uses 127.0.0.11 in `resolv.conf`.

And yeah, it works pinging out. It's just some oddly specific hostnames that aren't being resolved.

**Comment by sofam** [comment]
@sanimej this is the output from a container on the same host if I don't create it as a service, using the same base image:
```
root@devmgr1:~# docker run -it alpine:latest /bin/sh
/ # nslookup security.debian.org
nslookup: can't resolve '(null)': Name does not resolve

Name:      security.debian.org
Address 1: 212.211.132.250 lobos.debian.org
Address 2: 212.211.132.32 villa.debian.org
Address 3: 195.20.242.89 wieck.debian.org
Address 4: 2001:a78:5:1:216:35ff:fe7f:6ceb lobos.debian.org
Address 5: 2001:a78:5::216:35ff:fe7f:be4f villa.debian.org
/ # cat /etc/resolv.conf 
# Dynamic resolv.conf(5) file for glibc resolver(3) generated by resolvconf(8)
#     DO NOT EDIT THIS FILE BY HAND -- YOUR CHANGES WILL BE OVERWRITTEN
nameserver 168.63.129.16
search whznox0qnipeblekj3wowixojc.fx.internal.cloudapp.net
```
So it's the internal DNS for sure.

**Comment by sofam** [comment]
Sorry about the spam, I ran Docker in debug mode in our playground Swarm cluster and found this when doing the same query:
```
Dec 16 10:58:05 devmgr1 dockerd[50041]: time="2016-12-16T10:58:05.464819895Z" level=debug msg="Name To resolve: security.debian.org."
Dec 16 10:58:05 devmgr1 dockerd[50041]: time="2016-12-16T10:58:05.464947596Z" level=debug msg="Query security.debian.org.[28] from 172.18.0.5:59869, forwarding to udp:168.63.129.16"
Dec 16 10:58:05 devmgr1 dockerd[50041]: time="2016-12-16T10:58:05.465445497Z" level=debug msg="Name To resolve: security.debian.org."
Dec 16 10:58:05 devmgr1 dockerd[50041]: time="2016-12-16T10:58:05.465751598Z" level=debug msg="Query security.debian.org.[1] from 172.18.0.5:32815, forwarding to udp:168.63.129.16"
Dec 16 10:58:05 devmgr1 dockerd[50041]: time="2016-12-16T10:58:05.493276391Z" level=debug msg="Read from DNS server failed, dns: bad rdlength"
Dec 16 10:58:05 devmgr1 dockerd[50041]: time="2016-12-16T10:58:05.532090122Z" level=debug msg="Read from DNS server failed, dns: bad rdlength"
Dec 16 10:58:07 devmgr1 dockerd[50041]: time="2016-12-16T10:58:07.967483240Z" level=debug msg="Name To resolve: security.debian.org."
Dec 16 10:58:07 devmgr1 dockerd[50041]: time="2016-12-16T10:58:07.967968442Z" level=debug msg="Query security.debian.org.[28] from 172.18.0.5:55987, forwarding to udp:168.63.129.16"
Dec 16 10:58:07 devmgr1 dockerd[50041]: time="2016-12-16T10:58:07.967863441Z" level=debug msg="Name To resolve: security.debian.org."
Dec 16 10:58:07 devmgr1 dockerd[50041]: time="2016-12-16T10:58:07.968359843Z" level=debug msg="Query security.debian.org.[1] from 172.18.0.5:50265, forwarding to udp:168.63.129.16"
Dec 16 10:58:07 devmgr1 dockerd[50041]: time="2016-12-16T10:58:07.969799948Z" level=debug msg="Read from DNS server failed, dns: bad rdlength"
Dec 16 10:58:07 devmgr1 dockerd[50041]: time="2016-12-16T10:58:07.969965849Z" level=debug msg="Read from DNS server failed, dns: bad rdlength"
```

**Comment by sofam** [comment]
OK, so I spun up a new Docker host in Swarm mode on AWS using the same Ubuntu and Docker version and it works there. 
So something in the packet the Azure DNS responds with isn't handled well with the libcontainer resolver. 
The AWS DNS nslookup looks like this:
```
username@ip-10-0-17-212:~# nslookup security.debian.org
Server:		10.0.0.2
Address:	10.0.0.2#53

Non-authoritative answer:
Name:	security.debian.org
Address: 212.211.132.250
Name:	security.debian.org
Address: 195.20.242.89
Name:	security.debian.org
Address: 212.211.132.32
```

**Comment by sanimej** [comment]
Thanks for all the additional info. I tried a whole bunch of public DNS servers with a container on a user defined network. It works ok on all those. I am not able to use `168.63.129.16` though because its Azure specific. So this seems to be very specific to the response from Azure DNS.

When you do `nslookup deb.debian.org 8.8.8.8` the queries go directly to the DNS server specified. ie: docker DNS won't see the query or response. Its still failing for you. But `dig security.debian.org` works from with a service task as well. I am wondering if there is an issue outside of docker DNS as well. Can you confirm that dig works from within the container always but only nslookup or golang lookup fails ?

Can you please get the host tcpdump packets for the following commands from a service task..
`nslookup deb.debian.org 8.8.8.8`  and  `dig deb.debian.org`  ? Looks like dig does something different which fails both for nslookup and for docker DNS server.

**Comment by sofam** [comment]
I worked around it by setting up dnsmasq on each Docker host and setting Docker on each host to use the local IP as a resolver.
I will however purposefully make my development environment act like this again and I can give you the  requested data. 

I'll be back :)

**Comment by sanimej** [comment]
I tried it in a Debian Jessie host in Azure. DNS resolution works fine for the services you tried..
```
root@64b5fe8f3c2f:/# nslookup security.debian.org
Server:		127.0.0.11
Address:	127.0.0.11#53

Non-authoritative answer:
Name:	security.debian.org
Address: 128.101.240.215
Name:	security.debian.org
Address: 149.20.20.19
Name:	security.debian.org
Address: 128.31.0.63
Name:	security.debian.org
Address: 128.61.240.73

root@64b5fe8f3c2f:/# nslookup security.debian.org 168.63.129.16
Server:		168.63.129.16
Address:	168.63.129.16#53

Non-authoritative answer:
Name:	security.debian.org
Address: 149.20.20.19
Name:	security.debian.org
Address: 128.31.0.63
Name:	security.debian.org
Address: 128.61.240.73
Name:	security.debian.org
Address: 128.101.240.215

root@64b5fe8f3c2f:/# 
```

**Comment by sofam** [comment]
Hi, thank you for investigating!

I just spun up two completely new deployments, one running Jessie like you ran, one running Ubuntu 16.04.1 LTS like I'm running, basic install of docker-engine from the docker repositories, nothing else. 
Used the deployment template for 16.04 and Jessie respectively. 
Initiated a single machine swarm on both machines. Ran this command specifically:
`docker swarm init; docker network create -d overlay public; docker service create --name testing --network public golang:1.7.4-alpine sleep 3600000000`
Entered the container:
```
root@jessieDNStest:/home/econadmin# docker exec -it 43f2e0d14945 /bin/sh
/go # nslookup security.debian.org
nslookup: can't resolve '(null)': Name does not resolve

nslookup: can't resolve 'security.debian.org': Try again
```
And on Ubuntu:
```
root@dnstest:~# docker exec -it 497cbb6c13c6 /bin/sh
/go # nslookup security.debian.org
nslookup: can't resolve '(null)': Name does not resolve

nslookup: can't resolve 'security.debian.org': Try again
```

Debug logs from Ubuntu machine:
```
Dec 20 08:36:11 dnstest dockerd[7307]: time="2016-12-20T08:36:11.196996646Z" level=debug msg="Name To resolve: security.debian.org."
Dec 20 08:36:11 dnstest dockerd[7307]: time="2016-12-20T08:36:11.197722242Z" level=debug msg="Query security.debian.org.[28] from 172.18.0.3:49354, forwarding to udp:168.63.129.16"
Dec 20 08:36:11 dnstest dockerd[7307]: time="2016-12-20T08:36:11.198145440Z" level=debug msg="Name To resolve: security.debian.org."
Dec 20 08:36:11 dnstest dockerd[7307]: time="2016-12-20T08:36:11.198598838Z" level=debug msg="Query security.debian.org.[1] from 172.18.0.3:38888, forwarding to udp:168.63.129.16"
Dec 20 08:36:11 dnstest dockerd[7307]: time="2016-12-20T08:36:11.270268274Z" level=debug msg="Read from DNS server failed, dns: bad rdlength"
Dec 20 08:36:11 dnstest dockerd[7307]: time="2016-12-20T08:36:11.270736071Z" level=debug msg="Read from DNS server failed, dns: bad rdlength"
Dec 20 08:36:13 dnstest dockerd[7307]: time="2016-12-20T08:36:13.699354333Z" level=debug msg="Name To resolve: security.debian.org."
Dec 20 08:36:13 dnstest dockerd[7307]: time="2016-12-20T08:36:13.699949830Z" level=debug msg="Query security.debian.org.[28] from 172.18.0.3:42434, forwarding to udp:168.63.129.16"
Dec 20 08:36:13 dnstest dockerd[7307]: time="2016-12-20T08:36:13.700241528Z" level=debug msg="Name To resolve: security.debian.org."
Dec 20 08:36:13 dnstest dockerd[7307]: time="2016-12-20T08:36:13.700468527Z" level=debug msg="Query security.debian.org.[1] from 172.18.0.3:53108, forwarding to udp:168.63.129.16"
Dec 20 08:36:13 dnstest dockerd[7307]: time="2016-12-20T08:36:13.701876920Z" level=debug msg="Read from DNS server failed, dns: bad rdlength"
Dec 20 08:36:13 dnstest dockerd[7307]: time="2016-12-20T08:36:13.702195618Z" level=debug msg="Read from DNS server failed, dns: bad rdlength"
```
From Debian machine:
```
Dec 20 08:32:25 jessieDNStest dockerd[11385]: time="2016-12-20T08:32:25.893699036Z" level=debug msg="Name To resolve: security.debian.org."
Dec 20 08:32:25 jessieDNStest dockerd[11385]: time="2016-12-20T08:32:25.893814936Z" level=debug msg="Query security.debian.org.[28] from 172.18.0.3:49691, forwarding to udp:168.63.129.16"
Dec 20 08:32:25 jessieDNStest dockerd[11385]: time="2016-12-20T08:32:25.893981037Z" level=debug msg="Name To resolve: security.debian.org."
Dec 20 08:32:25 jessieDNStest dockerd[11385]: time="2016-12-20T08:32:25.894053237Z" level=debug msg="Query security.debian.org.[1] from 172.18.0.3:36803, forwarding to udp:168.63.129.16"
Dec 20 08:32:25 jessieDNStest dockerd[11385]: time="2016-12-20T08:32:25.896711440Z" level=debug msg="Read from DNS server failed, dns: bad rdlength"
Dec 20 08:32:26 jessieDNStest dockerd[11385]: time="2016-12-20T08:32:25.896765841Z" level=debug msg="Read from DNS server failed, dns: bad rdlength"
Dec 20 08:32:28 jessieDNStest dockerd[11385]: time="2016-12-20T08:32:28.396194847Z" level=debug msg="Name To resolve: security.debian.org."
Dec 20 08:32:28 jessieDNStest dockerd[11385]: time="2016-12-20T08:32:28.396306847Z" level=debug msg="Query security.debian.org.[28] from 172.18.0.3:47511, forwarding to udp:168.63.129.16"
Dec 20 08:32:28 jessieDNStest dockerd[11385]: time="2016-12-20T08:32:28.396401347Z" level=debug msg="Name To resolve: security.debian.org."
Dec 20 08:32:28 jessieDNStest dockerd[11385]: time="2016-12-20T08:32:28.396451047Z" level=debug msg="Query security.debian.org.[1] from 172.18.0.3:49562, forwarding to udp:168.63.129.16"
Dec 20 08:32:28 jessieDNStest dockerd[11385]: time="2016-12-20T08:32:28.399097251Z" level=debug msg="Read from DNS server failed, dns: bad rdlength"
Dec 20 08:32:28 jessieDNStest dockerd[11385]: time="2016-12-20T08:32:28.399150851Z" level=debug msg="Read from DNS server failed, dns: bad rdlength"
```

**Comment by sofam** [comment]
tcpdump output from Jessie, let me know if you want pcap files:
```
root@jessieDNStest:/home/econadmin# tcpdump -i docker_gwbridge
tcpdump: verbose output suppressed, use -v or -vv for full protocol decode
listening on docker_gwbridge, link-type EN10MB (Ethernet), capture size 262144 bytes
08:43:54.202764 IP 172.18.0.3.57725 > 168.63.129.16.domain: 33197+ AAAA? security.debian.org. (37)
08:43:54.202934 IP 172.18.0.3.47138 > 168.63.129.16.domain: 32397+ A? security.debian.org. (37)
08:43:54.384645 IP 168.63.129.16.domain > 172.18.0.3.57725: 33197 4/0/0 AAAA 2001:a78:5:0:216:35ff:fe7f:be4f, AAAA 2001:a78:5:1:216:35ff:fe7f:6ceb, RRSIG, RRSIG (579)
08:43:54.384682 IP 168.63.129.16.domain > 172.18.0.3.47138: 32397 5/0/0 A 195.20.242.89, A 212.211.132.32, A 212.211.132.250, RRSIG, RRSIG (571)
08:43:56.705370 IP 172.18.0.3.52017 > 168.63.129.16.domain: 33197+ AAAA? security.debian.org. (37)
08:43:56.705532 IP 172.18.0.3.55207 > 168.63.129.16.domain: 32397+ A? security.debian.org. (37)
08:43:56.708035 IP 168.63.129.16.domain > 172.18.0.3.52017: 33197 4/0/0 AAAA 2001:a78:5:1:216:35ff:fe7f:6ceb, AAAA 2001:a78:5:0:216:35ff:fe7f:be4f, RRSIG, RRSIG (579)
08:43:56.708045 IP 168.63.129.16.domain > 172.18.0.3.55207: 32397 5/0/0 A 212.211.132.32, A 212.211.132.250, A 195.20.242.89, RRSIG, RRSIG (571)
```

**Comment by sanimej** [comment]
I was using ubuntu based container. I tried the same image you are using `golang:1.7.4-alpine`. It still works. But there is some difference in the way alpine resolves the name because the result has v4 and v6 addresses. With glibc based resolver in ubuntu the result had only v4 addresses.

```
/go # nslookup security.debian.org
nslookup: can't resolve '(null)': Name does not resolve

Name:      security.debian.org
Address 1: 128.31.0.63 mirror-csail-security.debian.org
Address 2: 149.20.20.19 mirror-isc2.debian.org
Address 3: 128.61.240.73 sechter.debian.org
Address 4: 128.101.240.215 mirror-umn2.debian.org
Address 5: 2001:4f8:8:36::1deb:19 mirror-isc2.debian.org
Address 6: 2610:148:1f10:3::73 sechter.debian.org
Address 7: 2607:ea00:101:3c0b::1deb:215 mirror-umn2.debian.org
/go # 
```
When creating the Azure VM are you choosing any DNSSEC related option ? Its not clear what is different in your host that is triggering this issue.

Earlier you mentioned that `dig security.debian.org` works from the container. Can you confirm that ?

Can you also try a ubuntu based container to see if this happens only with alpine images ?

**Comment by sofam** [comment]
Hi, tried it with the golang:1.7.4 jessie based container. I didn't choose anything dnssec related when I spawned the nodes. I just basically chose the defaults on everything in a completely new resource group with a completely new vnet for each node.

nslookup still doesn't work, but dig works.
dig output:
```
root@d72d244d5b58:/go# dig security.debian.org

; <<>> DiG 9.9.5-9+deb8u8-Debian <<>> security.debian.org
;; global options: +cmd
;; Got answer:
;; ->>HEADER<<- opcode: QUERY, status: NOERROR, id: 34806
;; flags: qr rd ra; QUERY: 1, ANSWER: 3, AUTHORITY: 0, ADDITIONAL: 1

;; OPT PSEUDOSECTION:
; EDNS: version: 0, flags:; udp: 1280
;; QUESTION SECTION:
;security.debian.org.           IN      A

;; ANSWER SECTION:
security.debian.org.    84      IN      A       195.20.242.89
security.debian.org.    84      IN      A       212.211.132.250
security.debian.org.    84      IN      A       212.211.132.32

;; Query time: 5 msec
;; SERVER: 127.0.0.11#53(127.0.0.11)
;; WHEN: Tue Dec 20 20:14:18 UTC 2016
;; MSG SIZE  rcvd: 96
```


tcpdump for dig:
```
root@jessieDNStest:/home/econadmin# tcpdump -i docker_gwbridge
tcpdump: verbose output suppressed, use -v or -vv for full protocol decode
listening on docker_gwbridge, link-type EN10MB (Ethernet), capture size 262144 bytes
20:13:02.141687 IP 172.18.0.3.52134 > 168.63.129.16.domain: 45587+ [1au] A? security.debian.org. (48)
20:13:02.144016 IP 168.63.129.16.domain > 172.18.0.3.52134: 45587 3/0/1 A 212.211.132.32, A 195.20.242.89, A 212.211.132.250 (96)
```

**Comment by bentorfs** [comment]
It won't work in nslookup on busybox-based images (like alpine), because of this bug: https://dev.openwrt.org/ticket/18333

Basically, when you explicitly specify a nameserver, it is printed but ignored.

**Comment by bentorfs** [comment]
I have a similar problem with one of our internal company nameservers. A quite large DNS record is resolved from the host machine, but not from the container. A tcpdump shows that the correct information is being retrieved, but docker fails to read it with the following debug log:

```time="2017-01-05T15:16:07.362763839Z" level=debug msg="Read from DNS server failed, dns: failed to unpack truncated message"```

This is on docker 1.11.2

**Comment by sanimej** [comment]
@bentorfs Can you try 1.12.5 ? There was an issue with sending truncated responses from external resolvers to the containers. It was fixed in 1.12.

**Comment by bentorfs** [comment]
Unfortunately I am on amazon linux, and 1.12 is not available yet. Good to know it is fixed though!

**Comment by ozlatkov** [comment]
Sorry for stepping in that way - I was just exploring for other issues alike ( the DNS situation as it's getting more and more important around me) - this looks quite similar to one commented a while back (scroll back to the bottom and start up) : 

https://github.com/docker/docker/issues/12603

Trying to prove if upgrade to 13 would help - for now neither proved nor disproved though.

**Comment by sanimej** [comment]
@ozlatkov This is not similar to #12603. If you are able to recreate the EAI_AGAIN reported in #12603 with 1.12.5 or 1.12.6 can you provide the exact same steps so that I can try ?

**Comment by sanimej** [comment]
@sofam As [mentioned earlier](https://github.com/docker/docker/issues/29398#issuecomment-268176578)I couldn't recreate this with an Azure VM. If you are still seeing this issue it might be useful if I can access your Azure VM to debug. Let me know if thats possible.

**Comment by sofam** [comment]
@sanimej Yes, no problem at all. Just send me your public key and I'll add it to the hosts.

**Comment by sanimej** [comment]
@sofam Please use my github public key, curl https://github.com/sanimej.keys

**Comment by csandanov** [comment]
I have the same issue with 1.12.6 on Azure (Debian 8/Ubuntu 16.04)

**Comment by dan-higgins** [comment]
Is anybody looking at this?

I am in `/bin/sh` in an `alpine:3.6` container fresh from the Docker Hub,
using `Docker version 17.06.0-ce, build 3dfb8343`,
from ArchLinux, inside VirtualBox 5.1.22,
on a Windows 10 host,
on my corporate VPN which is thru Cisco AnyConnect.

DNS and hence all networking from the container is suffering from this error. I have `nslookup` but can't really install new commands here without the DNS.

FWIW, the container's `resolv.conf` is exactly the same as my ArchLinux guest, like this:
```
domain blahblahcorp.com
nameserver 10.5.6.11
nameserver 10.5.6.12
nameserver 10.0.0.1
```

`ifconfig` shows `eth0` and `lo`, and IPv6 is disabled on the ArchLinux guest at kernel level, which has cascaded correctly into the Alpine container.

I have never had a single problem with the networking from the ArchLinux guest. I'm fine running some other commands to gather more debug info, but note I'm limited by this Alpine container, and it will probably be hard to install any new commands here.

**Comment by dan-higgins** [comment]
Quick update to previous comment: It appears that the problem line was the `10.0.0.1` one. That is my gateway, which is outside the VPN but local to my subnet. I guess for me it's a good workaround, since my scenario here is unique.

Maybe these comments will help somebody.

**Comment by chemist** [comment]
add bind-tools to image, all work's

**Comment by alex-eri** [comment]
Note for someone who googling it. My issue was in systemds `firewald.service`. It uses `hosts.deny`/`hosts.allow` style for blocking network. Where is its config? Cant find it. Added dns service using applet. Or you cat just mask it.

**Comment by thaJeztah** [comment]
closing as this one went stale, but feel free to open a new ticket with details / reproduction steps if this is still an issue on current versions
